,current_location,current_work,previous_work,latest_Education,major,search_school,latitude,longitude,state,county,city,fips,current_company,previous_company,current_company_industry,previous_company_industry
1101, Oxford ,Founder & Principal at Scion Consultants,"Director of Integration, New Ventures Group at McKinsey & Company",2003–2005,Law,Brown University,51.752013,-1.25785,England,Oxfordshire,Oxford,,Scion Consultants,McKinsey & Company,,541611 Strategic planning consulting services
1102,"Oakland, California, United States",Principal Attorney at Terp Law,Supervising Attorney - Coronavirus Job Protection Helpline at Center for Workers' Rights,"University of California, Berkeley - School of Law",,Brown University,37.804456,-122.271356,California,Alameda,Oakland,6001.0,Terp Law,Center for Workers' Rights,,
1103,"Greenville, South Carolina, United States",President and COO(interim) at Kent Hospital,Chief Medical Officer at Kent Hospital,Texas A&M University,Biochemistry,Brown University,34.851354,-82.398488,South Carolina,Greenville,Greenville,45045.0,Kent Hospital,Kent Hospital,622110 Osteopathic hospitals,622110 Osteopathic hospitals
1104,New York City  ,Chief Executive Officer at Advanced Threat Response Holdings,"Vice President and General Manager, Global Security Services at IBM Security Business Unit",1983–1987,Economics / Business,Brown University,40.712728,-74.006015,New York,,New York,36061.0,Response Holdings,IBM Security Business Unit,"236118 Sun-room additions, residential",
1105,San Francisco Bay ,Co-founder and CEO at Vouch Insurance,"Co-founder, Chairman at Funding Circle US",Stanford University Graduate School of Business,"Finance, Entrepreneurship",Brown University,37.714029,-122.307794,California,San Mateo,,6081.0,Vouch Insurance,Funding Circle US,,
1106,New York City  ,,"Vice President, New Media & Content Marketing at Major League Baseball",Brown University,Literature,Brown University,40.712728,-74.006015,New York,,New York,36061.0,,Major League Baseball,,541690 Security consulting services
1107, Philadelphia,"Senior Vice President, Chief Medical Officer at Onslow Memorial Hospital-UNC Health",Medical Director of Population Health-Jefferson Medical Group at Abington - Jefferson Health,Harvard T.H. Chan School of Public Health,Health/Health Care Administration/Management,Brown University,39.952724,-75.163526,Pennsylvania,Philadelphia,Philadelphia,42101.0,Onslow Memorial Hospital-UNC Health,Abington - Jefferson Health,,
1108,"Del Mar, California, United States",Co-Founder and Managing Partner at Purpose Venture Group,Fellow at Beeck Center for Social Impact + Innovation,Georgetown University Law Center,Political Science,Brown University,32.959489,-117.265315,California,San Diego,,6073.0,Purpose Venture Group,Beeck Center for Social Impact + Innovation,,
1109,"Mumbai, Maharashtra, India",Founder at Project Rangeet,Director at Global Mangrove Trust,Brown University,Computer Science,Brown University,19.07599,72.877393,Maharashtra,,Mumbai,,Project Rangeet,Global Mangrove Trust,,
1110,"Redmond, Washington, United States",Sr Manager - Product Management at Best Buy,Product Management at Amazon Web Services (AWS),1993–1995,,Brown University,47.669414,-122.123877,Washington,King,,53033.0,Best Buy,Amazon Web Services (AWS),"337110 Vanity tops, wood or plastics laminated on wood, manufacturing",
1111, Boston,Chief Medical Officer at Abpro,Senior Medical Director at Celgene,Brown University,,Brown University,42.360253,-71.058291,Massachusetts,Suffolk,Boston,25025.0,Abpro,Celgene,"333517 Valve grinding machines, metalworking, manufacturing",325412 Zinc oxide medicinal preparations manufacturing
1112,"Chicago, Illinois, United States",President at Jirsa Construction Company,,Brown University,"Classics and Classical Languages, Literatures, and Linguistics",Brown University,41.875562,-87.624421,Illinois,Cook,Chicago,17031.0,Jirsa Construction Company,,"236115 Vacation home, single-family, construction by general contractors",
1113,"New York, New York, United States","Principal, The Catalyst Group at Incline Equity Partners",Vice President Of Commercial Operations at A Place for Mom,Harvard Business School,History,Brown University,40.712728,-74.006015,New York,,New York,36061.0,Incline Equity Partners,A Place for Mom,523910 Viatical settlement companies,"624190 Welfare service centers, multi-program"
1114,"New York, New York, United States",Partner at Kirkland & Ellis,"Partner at Skadden, Arps, Slate, Meagher & Flom LLP and Affiliates",Columbia University School of Law,Law,Brown University,40.712728,-74.006015,New York,,New York,36061.0,Kirkland & Ellis,"Skadden, Arps, Slate, Meagher & Flom LLP and Affiliates",541110 Tax law attorneys' private practices,
1115, Boston,Chief Compliance and Privacy Officer at Insulet Corporation,"Health Care Attorney, Consultant & Blogger at The Harlow Group LLC",Boston University School of Law,Health Law,Brown University,42.360253,-71.058291,Massachusetts,Suffolk,Boston,25025.0,Insulet Corporation,The Harlow Group LLC,339112 Veterinarians' instruments and apparatus manufacturing,
1116,"Boston, Massachusetts, United States","Program Director,  Office of Patient Experience/Center for Quality and Safety at Massachusetts General Hospital","Senior Program Manager, Center for Quality and Safety Process Improvement at Massachusetts General Hospital",Harvard University,Health Policy & Management,Brown University,42.360253,-71.058291,Massachusetts,Suffolk,Boston,25025.0,Massachusetts General Hospital,Massachusetts General Hospital,622110 Osteopathic hospitals,622110 Osteopathic hospitals
1117,New York City  ,"Global Director - Financial Services Industry Solutions at Aerospike, Inc.","Vice President - Sales, Partnerships at Io-Tahoe (acquired by Hitachi Vantara)",Yale School of Management,,Brown University,40.712728,-74.006015,New York,,New York,36061.0,"Aerospike, Inc.",Io-Tahoe (acquired by Hitachi Vantara),,
1118,"San Francisco, California, United States",Partner at True Search,Principal at True Search,Brown University,Women's Studies,Brown University,37.779026,-122.419906,California,,San Francisco,6075.0,True Search,True Search,561320 Temporary staffing services,561320 Temporary staffing services
1119,"Boulder, Colorado, United States","SVP, Health Solutions | President, AMA Innovations at American Medical Association",CEO at Shareable Ink,Brown University,Cognitive Science,Brown University,40.014986,-105.270545,Colorado,Boulder,Boulder,8013.0,American Medical Association,Shareable Ink,"523930 Investment advisory services, customized, fees paid by client",
1120,New York City  ,Pediatrician at Allied Physicians Group,,Brown University,,Brown University,40.712728,-74.006015,New York,,New York,36061.0,Allied Physicians Group,,623110 Skilled nursing facilities,
1121,New York City  ,Advisor at Better,Head of Portfolio Operations at Human Capital,Brown University,Africana Studies,Brown University,40.712728,-74.006015,New York,,New York,36061.0,Better,Human Capital,551112 Public utility holding companies,"523930 Investment advisory services, customized, fees paid by client"
1122,Los Angeles  ,Chief Executive Officer at DoctusTech,"Medical Director, Population Health, CA markets at Optum",Brown University,Biomedical Ethics,Brown University,34.053691,-118.242766,California,Los Angeles,Los Angeles,6037.0,DoctusTech,Optum,,621610 Visiting nurse associations
1123,"Kuala Lumpur, Federal Territory of Kuala Lumpur, Malaysia",Chief Executive Officer at Enfrasys Solutions Sdn Bhd,"Senior Client Manager, Public Sector at IBM",1989–1993,Mechanical Engineering,Brown University,3.189833,101.687136,,,Kuala Lumpur,,Enfrasys Solutions Sdn Bhd,IBM,,518210 Web hosting
1124,United States,"Vice President, Chief Information Security Officer at Marathon Petroleum Corporation","Chief Information Security Officer and Vice President, IT Architecture at Halliburton",Brown University,Cybersecurity,Brown University,39.78373,-100.445882,,,,,Marathon Petroleum Corporation,Halliburton,"424720 Petroleum and petroleum products merchant wholesalers (except bulk stations, terminals)",541330 Traffic engineering consulting services
1125,"Vancouver, British Columbia, Canada",COO & Co-Founder at Pairadime,"Senior Director, Business Development at 3vGeomatics",Massachusetts Institute of Technology - Sloan School of Management,Materials Engineering,Brown University,49.260872,-123.113952,British Columbia,Metro Vancouver Regional,Vancouver,,Pairadime,3vGeomatics,,
1126,San Francisco Bay ,Chief Executive Officer at Onfido,Advisory Board at Paradigm4,Harvard Business School,Electrical Engineering,Brown University,37.714029,-122.307794,California,San Mateo,,6081.0,Onfido,Paradigm4,561499 Videoconferencing services,"541512 Systems integration design services, computer"
1127,"New York, New York, United States","Chief Operating Officer at Building for the Arts NY, Inc.","Chief Of Staff at Building for the Arts NY, Inc.",Columbia Business School,Public and Private Sector Organizations,Brown University,40.712728,-74.006015,New York,,New York,36061.0,"Building for the Arts NY, Inc.","Building for the Arts NY, Inc.",237210 Subdividing real estate,237210 Subdividing real estate
1128,"East Hartford, Connecticut, United States","President & CEO at Doosan Fuel Cell Co., Ltd.",Chief Strategy Officer at Doosan Heavy Industries & Construction,Harvard University,Economics,Brown University,41.782322,-72.612035,Connecticut,Hartford,,9003.0,"Doosan Fuel Cell Co., Ltd.",Doosan Heavy Industries & Construction,"221118 Power generation, tidal electric","333611 Windmills, electric power, generation-type, manufacturing"
1129, Boston,Co-Founder | Chief Operating Officer at True Fit Corporation,Co-Founder & Chief Customer Officer at True Fit Corporation,1996–2000,International Commerce,Brown University,42.360253,-71.058291,Massachusetts,Suffolk,Boston,25025.0,True Fit Corporation,True Fit Corporation,811430 Shoe repair shops without retailing new shoes,811430 Shoe repair shops without retailing new shoes
1130,United States,CEO & Founder at KerlyGirl,,Brown University,Political Science and Government & Africana Studies,Brown University,39.78373,-100.445882,,,,,KerlyGirl,,,
1131,"San Francisco, California, United States",Head of Sales and Account Management at Faire,"Contractor, Business Operations at MasterClass",Stanford Graduate School of Business,English Literature,Brown University,37.779026,-122.419906,California,,San Francisco,6075.0,Faire,MasterClass,"493110 Warehousing and storage, general merchandise","551111 Holding companies, bank (except managing)"
1132,"Austin, Texas, United States",General Manager of Mortgage at Orchard,Chief Strategy Officer at LoanMonkey,Brown University,Applied Mathematics,Brown University,30.271129,-97.7437,Texas,Travis,Austin,48453.0,Orchard,LoanMonkey,"523991 Trust companies, nondepository",
1133,New York City  ,Vice President Video Engineering at Peacock TV,"Senior Director, Video Platform Engineering at NBC Universal",Brown University,Music Composition,Brown University,40.712728,-74.006015,New York,,New York,36061.0,Peacock TV,NBC Universal,515120 Television broadcasting stations,515120 Television broadcasting stations
1134,"Newport, Rhode Island, United States",President & CEO at Clarke Valve,Systems Supplier Performance Engineering Manager at Embraer,The Wharton School,Scaling Ventures: Developing the Playbook for Profitable Growth,Brown University,41.489983,-71.313771,Rhode Island,Newport,Newport,44005.0,Clarke Valve,Embraer,,336411 Ultra light aircraft manufacturing
1135,"Johnston, Rhode Island, United States","CEO, Founder and Owner of Aviva Electric Bikes at Aviva Bikes",President / CEO at Porino's Gourmet Foods,Bryant University,Marketing /Finance,Brown University,41.83104,-71.54121,Rhode Island,Providence,,44007.0,Aviva Bikes,Porino's Gourmet Foods,,
1136,New York City  ,"EVP, Chief Financial Officer at Element Solutions Inc",Vice President and Corporate Treasurer at Element Solutions Inc,Brown University,Biomedical Engineering; Economics,Brown University,40.712728,-74.006015,New York,,New York,36061.0,Element Solutions Inc,Element Solutions Inc,"325199 Wood alcohol, synthetic, manufacturing","325199 Wood alcohol, synthetic, manufacturing"
1137,"New York, New York, United States",Chief Growth Officer at MiniLuxe,"North America Marketing, Bulleit Frontier Whiskey at Diageo",Harvard Business School,Biology,Brown University,40.712728,-74.006015,New York,,New York,36061.0,MiniLuxe,Diageo,812113 Pedicurist services,424820 Wines merchant wholesalers
1138,"Boston, Massachusetts, United States",Chief Business Officer at ElevateBio,"VP, Head of Business Development & Strategy at Evelo Biosciences",Harvard Business School,Chemical Engineering,Brown University,42.360253,-71.058291,Massachusetts,Suffolk,Boston,25025.0,ElevateBio,Evelo Biosciences,621511 Urinalysis laboratories,541714
1139,"Oakland, California, United States",Head of Strategy & Revenue Operations at Even,Solutions Engineer at Even,Brown University,,Brown University,37.804456,-122.271356,California,Alameda,Oakland,6001.0,Even,Even,999990,999990
1140,"Tampa, Florida, United States",Chief Financial Officer at Symphonic Distribution,Chief Financial Officer at Florida Auto Recycling Partners,1996–2000,,Brown University,27.94776,-82.458444,Florida,Hillsborough,Tampa,12057.0,Symphonic Distribution,Florida Auto Recycling Partners,512250,
1141, Seattle ,co-founder at CURIO,co-founder at Mixcard,2000–2004,Sociology with Honors,Brown University,47.603832,-122.330062,Washington,King,Seattle,53033.0,CURIO,Mixcard,,
1142,San Francisco Bay ,Founder & CEO at Komaza,Research Associate at KEMRI-Wellcome Trust,Brown University,Neuroscience,Brown University,37.714029,-122.307794,California,San Mateo,,6081.0,Komaza,KEMRI-Wellcome Trust,,"541910 Sampling services, statistical"
1143,San Francisco Bay ,"Executive Leadership Coach, Principal & Founder at Integral Response",Fractional CTO & Executive Coach at LiveRamp,Brown University,Computer Science,Brown University,37.714029,-122.307794,California,San Mateo,,6081.0,Integral Response,LiveRamp,,518210 Web hosting
1144,"Truckee, California, United States",Chief Strategy Officer at See Change Institute,"Senior Managing Consultant at ILLUME Advising, LLC","University of California, Berkeley",Biology,Brown University,39.327962,-120.183253,California,Nevada,,6057.0,See Change Institute,"ILLUME Advising, LLC",,
1145,"Norwalk, Connecticut, United States",Sr R&D Manager - Simple Skincare at Unilever,Sr R&D Manager - Consumer Technical Insights (CTI)  at Unilever,Brown University School of Engineering,Chemical and Biomolecular Engineering,Brown University,41.117597,-73.407897,Connecticut,Fairfield,Norwalk,9001.0,Unilever,Unilever,561499 Videoconferencing services,561499 Videoconferencing services
1146,"Boston, Massachusetts, United States","Vice President, Strategy and Marketing at Thermo Fisher Scientific","Vice President, Corporate Strategy at Thermo Fisher Scientific",Harvard Business School,Electrical Engineering,Brown University,42.360253,-71.058291,Massachusetts,Suffolk,Boston,25025.0,Thermo Fisher Scientific,Thermo Fisher Scientific,335999 UPS (uninterruptible power supplies) manufacturing,335999 UPS (uninterruptible power supplies) manufacturing
1147,New York City  ,Chief Growth Officer at The Acceleration Project,Chief Operating Officer at The Acceleration Project,Columbia University - Columbia Business School,Marketing and Finance,Brown University,40.712728,-74.006015,New York,,New York,36061.0,The Acceleration Project,The Acceleration Project,,
1148,"Houston, Texas, United States",Director of Procurement - North America at Fives,Sr. Manager - Global Strategic Sourcing at Hewlett Packard Enterprise,Massachusetts Institute of Technology,Supply Chain Management & Logistics,Brown University,29.758938,-95.367697,Texas,Harris,Houston,48201.0,Fives,Hewlett Packard Enterprise,423830 Woodworking machinery merchant wholesalers,"334112 Tape storage units (e.g., drive backups), computer peripheral equipment, manufacturing"
1149,Kenya,"Co-Founder, Chief Technology and Risk Officer at Lendable Marketplace",Systems Design and Text Programming at A Piece of Work,Brown University,Computer Science,Brown University,1.441968,38.431398,,,,,Lendable Marketplace,A Piece of Work,,
1150,"Tucson, Arizona, United States",Senior Vice President Of Technology at pMD,Vice President of Software Engineering at pMD,Brown University,Computer Science,Brown University,32.222876,-110.974848,Arizona,Pima,Tucson,4019.0,pMD,pMD,999990,999990
1151,United States,"Managing Director, Chief Operating Officer at Vestar Capital Partners",,Brown University,,Brown University,39.78373,-100.445882,,,,,Vestar Capital Partners,,523910 Viatical settlement companies,
1152, Seattle ,Chief Product Officer at HubSpot,"Senior Director, Google Ads at Google",Brown University,,Brown University,47.603832,-122.330062,Washington,King,Seattle,53033.0,HubSpot,Google,"511210 Utility software, computer, packaged","541512 Systems integration design services, computer"
1153,"Los Angeles, California, United States",Co-Founder at Heirloom,Business Development & Operations at Hulu,Harvard Business School,,Brown University,34.053691,-118.242766,California,Los Angeles,Los Angeles,6037.0,Heirloom,Hulu,424910 Vegetable dusts and sprays merchant wholesalers,213111 Workover of oil and gas wells on a contract basis
1154,San Francisco Bay ,Head of Marketing at Touch of Modern,"Principal at Wehmann Consulting, LLC",Brown University,Political Science,Brown University,37.714029,-122.307794,California,San Mateo,,6081.0,Touch of Modern,"Wehmann Consulting, LLC",,
1155, Boston,"Vice President, Business Development & Strategy at Stealth BioTherapeutics","Executive & Senior Director, Business Development & New Product Planning at Stealth BioTherapeutics",University of Virginia - Darden Graduate School of Business Administration,Biology,Brown University,42.360253,-71.058291,Massachusetts,Suffolk,Boston,25025.0,Stealth BioTherapeutics,Stealth BioTherapeutics,325412 Zinc oxide medicinal preparations manufacturing,325412 Zinc oxide medicinal preparations manufacturing
1156, Boston,Director Q/A Engineering at Akamai Technologies,Sr. Manager Q/A Engineering at Akamai Technologies,+ 1 more,Computer Science,Brown University,42.360253,-71.058291,Massachusetts,Suffolk,Boston,25025.0,Akamai Technologies,Akamai Technologies,518210 Web hosting,518210 Web hosting
1157,"Glencoe, Illinois, United States","Vice President, Global Marketing, Home Storage (Ziploc) and Global Shoe Care  at SC Johnson","Vice President, Consumer Insights & Business Analytics at SC Johnson",2002–2004,,Brown University,42.135027,-87.758119,Illinois,Cook,,17031.0,SC Johnson,SC Johnson,325412 Zinc oxide medicinal preparations manufacturing,325412 Zinc oxide medicinal preparations manufacturing
1158,"Mumbai, Maharashtra, India",Founder at Kool Kanya,Intern for the Strategy sector at McKinsey & Company,Brown University,"B.A. Political Science, International and Comparative Track",Brown University,19.07599,72.877393,Maharashtra,,Mumbai,,Kool Kanya,McKinsey & Company,,541611 Strategic planning consulting services
1159,"New York, New York, United States",President & CEO at Hunter Douglas North America,President & CEO at The Robert Allen Group,Harvard Business School,Business Management,Brown University,40.712728,-74.006015,New York,,New York,36061.0,Hunter Douglas North America,The Robert Allen Group,,451130 Upholstery materials stores
1160,"New York, New York, United States","Vice President, Machine Learning Center of Excellence at JPMorgan Chase & Co.",Quantitative Associate at JPMorgan Chase & Co.,Brown University,Theoretical Physics,Brown University,40.712728,-74.006015,New York,,New York,36061.0,JPMorgan Chase & Co.,JPMorgan Chase & Co.,522291 Student loan companies,522291 Student loan companies
1161,New York City  ,Managing Director and Chief Innovation Officer at Burford Capital,Chief Process & Innovation Officer at Burford Capital,Harvard Law School,Law and Public Policy,Brown University,40.712728,-74.006015,New York,,New York,36061.0,Burford Capital,Burford Capital,522298 Short-term inventory credit lending,522298 Short-term inventory credit lending
1162,"San Francisco, California, United States","VP, ESG Strategy and Engagement at Salesforce","Senior Director, Global Impact at Salesforce",Brown University,Sustainable Management,Brown University,37.779026,-122.419906,California,,San Francisco,6075.0,Salesforce,Salesforce,"541511 Web (i.e., Internet) page design services, custom","541511 Web (i.e., Internet) page design services, custom"
1163,"Madrid, Community of Madrid, Spain",Vice President Operations at Itaú,Bank Branch Manager at BBVA,Brown University,Economics,Brown University,40.416705,-3.703582,Comunidad de Madrid,Área metropolitana de Madrid y Corredor del,Madrid,,Itaú,BBVA,522110 State commercial banks,551112 Public utility holding companies
1164,"Edmonds, Washington, United States","Director, Data Analytics at WW (formerly Weight Watchers)",Data Scientist at Facebook,University of Pennsylvania,Experimental Psychology,Brown University,47.810574,-122.377495,Washington,Snohomish,,53061.0,WW (formerly Weight Watchers),Facebook,,"541512 Systems integration design services, computer"
1165,Dallas-Fort Worth ,Chief Revenue Officer (CRO) at JS Group,Vice President of Sales at Cytracom,Brown University,,Brown University,32.745316,-97.327831,Texas,Tarrant,Fort Worth,48439.0,JS Group,Cytracom,722513 Take out eating places,"334210 Wide area network communications equipment (e.g., bridges, gateways, routers) manufacturing"
1166,"Fort Collins, Colorado, United States",President at Pathways Hospice,Senior Director of Patient & Family Support Services at Care Dimensions,1998–2000,Social Work,Brown University,40.550853,-105.066808,Colorado,Larimer,Fort Collins,8069.0,Pathways Hospice,Care Dimensions,621610 Visiting nurse associations,623110 Skilled nursing facilities
1167, Boston,"RVP, Growth & Mid-Market Customer Success at Segment","Senior Director, Customer Success at Segment",Brown University,"Commerce, Organizations, and Entrepreneurship",Brown University,42.360253,-71.058291,Massachusetts,Suffolk,Boston,25025.0,Segment,Segment,999990,999990
1168,"Hong Kong, Hong Kong SAR",General Manager - Asia Pacific  at Supergoop!,"General Manager, Asia Pacific at Charlotte Tilbury Beauty",INSEAD,"Business Administration and Management, General",Brown University,22.279328,114.162813,香港 Hong Kong,,香港島 Hong Kong Island,,Supergoop!,Charlotte Tilbury Beauty,"325620 Towelettes, premoistened, manufacturing",
1169,"New York, New York, United States",Director Of Data Science at CenterBook Partners LP,Quantitative Risk Analyst at Third Point LLC,Brown University,Computer Science,Brown University,40.712728,-74.006015,New York,,New York,36061.0,CenterBook Partners LP,Third Point LLC,,
1170,"Santa Monica, California, United States","Senior Vice President, Strategy & Growth at Golden West Food Group","Senior Advisor & Vice President, Strategy at Golden West Food Group",University of Pennsylvania - The Wharton School,Strategic Management,Brown University,34.01947,-118.491227,California,Los Angeles,Santa Monica,6037.0,Golden West Food Group,Golden West Food Group,"311615 Turkeys, slaughtering and dressing","311615 Turkeys, slaughtering and dressing"
1171,Denver  ,"Partner at Varana Capital, LLC",Board Member at Fortress Paper Ltd.,1995–1999,Economics,Brown University,39.739236,-104.984862,Colorado,,Denver,8031.0,"Varana Capital, LLC",Fortress Paper Ltd.,,
1172,"New York, New York, United States",Sr. Director at Capsule,Senior Director of Operations at S'well,Brown University,"International Relations, Economics",Brown University,40.712728,-74.006015,New York,,New York,36061.0,Capsule,S'well,424490 Yeast merchant wholesalers,
1173,New York City  ,"AVP, Experience Design Strategy at MetLife","Director, Experience Strategy at MetLife",Brown University,International Relations,Brown University,40.712728,-74.006015,New York,,New York,36061.0,MetLife,MetLife,524126 Workers' compensation insurance underwriting,524126 Workers' compensation insurance underwriting
1174, Chicago ,Managing Director at Equity International,Associate at HSBC Securities,The University of Chicago - Booth School of Business,"Mathematical Economics, Hispanic Studies",Brown University,41.875562,-87.624421,Illinois,Cook,Chicago,17031.0,Equity International,HSBC Securities,"423690 Video tapes, blank, merchant wholesalers",522110 State commercial banks
1175,"Vero Beach, Florida, United States",President at CAE Healthcare,"SVP, Head of Strategy & Technology at L3 Technologies",Brown University,,Brown University,27.638716,-80.39754,Florida,Indian River,,12061.0,CAE Healthcare,L3 Technologies,339112 Veterinarians' instruments and apparatus manufacturing,"334511 Wheel position indicators and transmitters, aircraft, manufacturing"
1176,"Brooklyn, New York, United States",CEO and Co-Founder at Thine,"Founder | Owner at SJL Attorney Search, LLC",Georgetown University Law Center,Law,Brown University,40.652601,-73.949721,New York,,,,Thine,"SJL Attorney Search, LLC",519190 Title search services (except real estate),
1177,"Roseland, New Jersey, United States",Director Of Product Development at ADP,"Principal Application Architect, Data Analytics at ADP",New York University - Leonard N. Stern School of Business,Product Management; Entrepreneurship & Innovation,Brown University,40.820656,-74.29376,New Jersey,Essex,,34013.0,ADP,ADP,541214 Talent payment services,541214 Talent payment services
1178,San Francisco Bay ,Director of Sales at LinkedIn,Director of Sales Operations at LinkedIn,Brown University,"English, Economics",Brown University,37.714029,-122.307794,California,San Mateo,,6081.0,LinkedIn,LinkedIn,561499 Videoconferencing services,561499 Videoconferencing services
