,current_location,current_work,previous_work,latest_Education,major,search_school,current_company,previous_company,current_company_industry,previous_company_industry,current_NAICS,previous_NAICS,current_NAICS_title,current_avg_salary,previous_NAICS_title,latitude,longitude,state,county,city,fips
519,"San Francisco, California, United States","Managing Director, Technology Investment Banking at Rothschild & Co","Managing Director, Technology Investment Banking and Mergers & Acquisitions at Bank of America Merrill Lynch",2002–2004,Economics and Finance,Northwestern University,Rothschild & Co,Bank of America Merrill Lynch,,522110 State commercial banks,,52,,,Finance and Insurance,37.779026,-122.419906,California,,San Francisco,06075
520,"San Diego, California, United States","Graduate School Adjunct Faculty -  Data Science, Management, and Business Strategy (Part-Time) at Northwestern University",Product Owner (People Development Lead) at ResMed,Northwestern University,Information Design and Strategy (Data Analytics Concentration),Northwestern University,Northwestern University,ResMed,611310 Universities,"511210 Utility software, computer, packaged",61,51,Educational Services,67390.465,Information,32.71742,-117.162773,California,San Diego,San Diego,06073
521, Chicago ,"Director of Marketing, North America at TAWI – A brand by Piab Group | North America",Marketing Manager - Americas Industrial Automation  at Norgren,Northwestern University,,Northwestern University,TAWI – A brand by Piab Group | North America,Norgren,,423830 Woodworking machinery merchant wholesalers,,42,,,Wholesale Trade,41.875562,-87.624421,Illinois,Cook,Chicago,17031
522, Boston,Senior Strategic Process Manager at Crop One Holdings (FreshBox Farms),Sr. Business Program Manager & Process Improvement Lead - Operations & Supply Chain at Boston Beer Company,Northwestern University,"International Relations, Sculpture",Northwestern University,Crop One Holdings (FreshBox Farms),Boston Beer Company,,312120 Stout brewing,,31-33,,,Manufacturing,42.360253,-71.058291,Massachusetts,Suffolk,Boston,25025
523,"Seattle, Washington, United States","Vice President, Digital Product Management at Aritzia","Sr. Director, Digital Product Management at Aritzia",Northwestern University,,Northwestern University,Aritzia,Aritzia,,"551111 Holding companies, bank (except managing)",,55,,,Management of Companies and Enterprises,47.603832,-122.330062,Washington,King,Seattle,53033
524, Minneapolis-St. Paul ,Director at Expel,Director at CrowdStrike,Stanford University,Computer Science,Northwestern University,Expel,CrowdStrike,,"541519 Software installation services, computer",,54,,,"Professional, Scientific, and Technical Services",44.878019,-93.220928,Minnesota,Hennepin,Minneapolis,27053
525,New York City  ,Data & AI Healthcare Provider CTO & Principal Data Scientist at IBM at IBM,Senior Data Scientist at IBM,Northwestern University,Industrial Engineering & Management Sciences,Northwestern University,IBM,IBM,,518210 Web hosting,,51,,,Information,40.712728,-74.006015,New York,,New York,36061
526,"Los Angeles County, California, United States","CEO at Netki, Inc.",Member Board Of Directors at Adra Match,1991–1994,Computer Science,Northwestern University,"Netki, Inc.",Adra Match,,,,,,,,34.315507,-118.209681,California,Los Angeles,,06037
527, Chicago ,CEO at TeamWorks Media,Producer/Associate Producer at Fox Sports Net Chicago,Northwestern University,"R/TV/F, History",Northwestern University,TeamWorks Media,Fox Sports Net Chicago,,,,,,,,41.875562,-87.624421,Illinois,Cook,Chicago,17031
528,"Evanston, Illinois, United States",Chief Technology Officer at Katalyst Technologies,Vice President IT at Katalyst Technologies,"Quinlan School of Business, Loyola University Chicago",Electrical Engineering,Northwestern University,Katalyst Technologies,Katalyst Technologies,,,,,,,,42.044739,-87.693046,Illinois,Cook,,17031
529,"Berkeley, California, United States",CEO at Descript,Co-founder at Detour.com,1999–2003,,Northwestern University,Descript,Detour.com,,,,,,,,37.87535,-122.239634,California,Alameda,Berkeley,06001
530,"Chicago, Illinois, United States",Managing Director at ATI Advisory,Vice President at The Lewin Group,Northwestern University - Kellogg School of Management,"Healthcare Enterprise Management, Operations, Decision Sciences, Strategy",Northwestern University,ATI Advisory,The Lewin Group,,,,,,,,41.875562,-87.624421,Illinois,Cook,Chicago,17031
531,"Cambridge, Massachusetts, United States",CEO & Founder at Lucy Therapeutics,Executive Director Medicinal Chemistry IDSU at WuXi AppTec,Scripps Research,Chemistry,Northwestern University,Lucy Therapeutics,WuXi AppTec,,,,,,,,42.3751,-71.105616,Massachusetts,Middlesex,Cambridge,25017
533,"Naperville, Illinois, United States","Global Director of Digital & Connectivity at Foot Locker, Inc.",Program Manager - Digital at American Medical Association,University of Illinois at Chicago,Management Information Systems,Northwestern University,"Foot Locker, Inc.",American Medical Association,,813910 Wholesalers' associations,,81,,,Other Services (except Public Administration),41.77287,-88.147928,Illinois,DuPage,Naperville,17043
534, Chicago ,"Director, Technology & Developer Solutions at Skillsoft",Senior Account Executive at IHS Markit | Technology,Carthage College,Business Administration,Northwestern University,Skillsoft,IHS Markit | Technology,,,,,,,,41.875562,-87.624421,Illinois,Cook,Chicago,17031
535,"San Francisco, California, United States",CEO & Co-Founder (We're Hiring!) at Stealth Startup,CEO & Co-Founder at Think Inc,University of Michigan,Pharmaceutical Engineering,Northwestern University,Stealth Startup,Think Inc,,,,,,,,37.779026,-122.419906,California,,San Francisco,06075
536,"San Francisco, California, United States",CTO & Co-founder at Whole Biome,Senior Staff Scientist at Pacific Biosciences,"University of California, Berkeley",Biostatistics,Northwestern University,Whole Biome,Pacific Biosciences,,,,,,,,37.779026,-122.419906,California,,San Francisco,06075
537,Los Angeles  ,CTO at Zest AI,Chief Product Officer at Kinetic Social,Northwestern University,Computer Science,Northwestern University,Zest AI,Kinetic Social,,,,,,,,34.053691,-118.242766,California,Los Angeles,Los Angeles,06037
538,"Chicago, Illinois, United States",Vice President of Growth at OverlayAnalytics,"Sales Team Lead, US Midwest  at Darktrace",Northwestern University,Integrated Marketing Communications,Northwestern University,OverlayAnalytics,Darktrace,,,,,,,,41.875562,-87.624421,Illinois,Cook,Chicago,17031
539, Chicago ,"Chief Operating Officer at MDLIVE, Inc.","Vice President, Customer Offer Development at Walgreens",2005–2007,Finance and Real Estate Management,Northwestern University,"MDLIVE, Inc.",Walgreens,,446110 Pharmacies,,44-45,,,Retail Trade,41.875562,-87.624421,Illinois,Cook,Chicago,17031
540,"Boston, Massachusetts, United States",Chief Product Officer at Embark Veterinary,Vice President Of Product Development at Embark Veterinary,Yale University - Yale School of Management,Marketing Strategy and Operations,Northwestern University,Embark Veterinary,Embark Veterinary,,541940 Veterinary testing laboratories,,54,,,"Professional, Scientific, and Technical Services",42.360253,-71.058291,Massachusetts,Suffolk,Boston,25025
541,"Pleasant Prairie, Wisconsin, United States",Chief Executive Officer at OCCUPRO,CEO at Sports Physical Therapy & Rehab Specialists,Northwestern University,Physical Therapy/Therapist,Northwestern University,OCCUPRO,Sports Physical Therapy & Rehab Specialists,,"621340 Voice pathologists' offices (e.g., centers, clinics)",,62,,,Health Care and Social Assistance,42.526972,-87.854457,Wisconsin,Kenosha,,55059
542,"San Francisco, California, United States",Senior UX Researcher at Turo,UX Researcher at Flexport,Northwestern University,Journalism,Northwestern University,Turo,Flexport,,,,,,,,37.779026,-122.419906,California,,San Francisco,06075
543,"New York, New York, United States","Head of VC & Startup Ecosystem, Americas, Google Cloud at Google",Entrepreneur in Residence in Fintech at Techstars,"New York University, Stern School of Business","Finance, Strategy, and Marketing",Northwestern University,Google,Techstars,,523910 Viatical settlement companies,,52,,,Finance and Insurance,40.712728,-74.006015,New York,,New York,36061
544,"Indianapolis, Indiana, United States",Vice President of Brand Marketing at Pacers Sports & Entertainment,SVP of Marketing at Green Thumb Industries (GTI),Northwestern University,,Northwestern University,Pacers Sports & Entertainment,Green Thumb Industries (GTI),,,,,,,,39.768333,-86.15835,Indiana,Marion,Indianapolis,18097
546, Chicago ,Chief Financial Officer at InProduction,"Vice President, Finance at Nurture Life",Northwestern University,Communication Studies,Northwestern University,InProduction,Nurture Life,,311422 Spaghetti canning,,31-33,,,Manufacturing,41.875562,-87.624421,Illinois,Cook,Chicago,17031
547,Los Angeles  ,Senior Director of Marketing at Intrivo,Director of Marketing  at Intrivo,Northwestern University - Kellogg School of Management,"Human Development and Psychological Services, Integrated Marketing Communications",Northwestern University,Intrivo,Intrivo,,,,,,,,34.053691,-118.242766,California,Los Angeles,Los Angeles,06037
549, Chicago ,Procurement Manager at Northern Trust Corporation,"Buyer, IT Procurement at The Kraft Heinz Company",Northwestern University,"Political Science and Government, Earth and Planetary Science",Northwestern University,Northern Trust Corporation,The Kraft Heinz Company,,,,,,,,41.875562,-87.624421,Illinois,Cook,Chicago,17031
550,New York City  ,"Head, Sustainability & Digital Transition for Private Equity at Amazon Web Services (AWS)","Managing Director,  Sustainability & Impact Investing at SUN Group Global",Northwestern University,"Finance, Marketing, Strategy",Northwestern University,Amazon Web Services (AWS),SUN Group Global,,,,,,,,40.712728,-74.006015,New York,,New York,36061
551,San Francisco Bay ,Lead Product Manager at Lime,Senior Product Manager at Lime,University of Pennsylvania - The Wharton School,Entrepreneurial Management,Northwestern University,Lime,Lime,,,,,,,,37.714029,-122.307794,California,San Mateo,,06081
552,New York City  ,Director of Workplace Transformation and Employee Experience at PepsiCo,Workplace leader at Honeywell,2008–2010,Social-Organizational Psychology,Northwestern University,PepsiCo,Honeywell,,,,,,,,40.712728,-74.006015,New York,,New York,36061
553,"Excelsior, Minnesota, United States",,Interim Chief Product Officer at Kaleidoscope,Northwestern University - Kellogg School of Management,Marketing & Organization Design,Northwestern University,,Kaleidoscope,,,,,,,,44.903296,-93.566346,Minnesota,Hennepin,,27053
554,"Chicago, Illinois, United States",CEO at CartoFront,Director Corporate Communications at McDonald's Corporation,Northwestern University,Communication,Northwestern University,CartoFront,McDonald's Corporation,,533110 Trademark licensing,,53,,,Real Estate and Rental and Leasing,41.875562,-87.624421,Illinois,Cook,Chicago,17031
555,"Grand Rapids, Michigan, United States",President at Workbox Staffing,"PeopleReady Senior Vice President, Operations  at TrueBlue Inc.",Northwestern University,,Northwestern University,Workbox Staffing,TrueBlue Inc.,,561320 Temporary staffing services,,56,,,Administrative and Support and Waste Management and Remediation Services,42.96324,-85.667864,Michigan,Kent,Grand Rapids,26081
556, Chicago ,Chief Revenue Officer at Plastic Ingenuity,Chief Marketing Officer at Plastic Ingenuity,Northwestern University - Kellogg School of Management,"Marketing/Marketing Management, General",Northwestern University,Plastic Ingenuity,Plastic Ingenuity,,,,,,,,41.875562,-87.624421,Illinois,Cook,Chicago,17031
557,"Atlanta, Georgia, United States",President at The Owens Group International,President & COO at Leapfrog Services,Northwestern University,Engineering Management,Northwestern University,The Owens Group International,Leapfrog Services,,,,,,,,33.748992,-84.390264,Georgia,Fulton,Atlanta,13121
558,"Menlo Park, California, United States",Board of Directors at Adaptive Biotechnologies Corp.,"Board of Directors at Cardiovascular Systems, Inc.","Haas School of Business, UC Berkeley",,Northwestern University,Adaptive Biotechnologies Corp.,"Cardiovascular Systems, Inc.",,,,,,,,37.451967,-122.177993,California,San Mateo,,06081
559,New York City  ,Senior Director of Growth at obé Fitness,"Director, Growth Marketing at Splice",Education (same page),"Communication Studies, International Studies",Northwestern University,obé Fitness,Splice,,,,,,,,40.712728,-74.006015,New York,,New York,36061
560,"Beverly Hills, California, United States",Chief Executive Officer at National CineMedia (NCM),CEO & Founder at Energi Entertainment,Northwestern University,,Northwestern University,National CineMedia (NCM),Energi Entertainment,,,,,,,,34.06965,-118.396306,California,Los Angeles,,06037
561,"Tempe, Arizona, United States",Chief Executive Officer at Intercollegiate Tennis Association,Professor at Arizona State University,The Ohio State University,Music Education,Northwestern University,Intercollegiate Tennis Association,Arizona State University,,,,,,,,33.425506,-111.940009,Arizona,Maricopa,Tempe,04013
562,"Providence, Rhode Island, United States",Senior Director Digital at CVS Health,Senior Director Digital at CVS Health,1999–2001,"Marketing, Technology",Northwestern University,CVS Health,CVS Health,,,,,,,,41.823989,-71.412834,Rhode Island,Providence,Providence,44007
563, Chicago ,Chief Executive Officer at Jewish Federation of Greater Indianapolis,Managing Director at DJLM Services,Northwestern University,Sociology,Northwestern University,Jewish Federation of Greater Indianapolis,DJLM Services,,,,,,,,41.875562,-87.624421,Illinois,Cook,Chicago,17031
564,"Nashville, Tennessee, United States",CEO at Bargain Hunt,Chief Operating Officer at Bargain Hunt,Harvard Business School,Political Science and Government,Northwestern University,Bargain Hunt,Bargain Hunt,,,,,,,,36.162277,-86.774298,Tennessee,Davidson,Nashville-Davidson,47037
565,"Mountain View, California, United States",Co-Founder / CEO at Blueberry Medical,"Product Manager, Mobile Google Display Network at Google",2006–2010,Computer Engineering,Northwestern University,Blueberry Medical,Google,,,,,,,,37.389389,-122.08321,California,Santa Clara,Mountain View,06085
566, Chicago ,"Vice President, Growth Strategy at GoHealth",Associate Partner at McKinsey & Company,Northwestern University - Kellogg School of Management,"Finance, Strategy",Northwestern University,GoHealth,McKinsey & Company,,,,,,,,41.875562,-87.624421,Illinois,Cook,Chicago,17031
567,"Oakland, California, United States",Founder & Director at Solaria Corporation,CEO at Solaria Corporation,Northwestern University,Mathematics and Statistics,Northwestern University,Solaria Corporation,Solaria Corporation,,,,,,,,37.804456,-122.271356,California,Alameda,Oakland,06001
568, Chicago ,Founder and CEO at RevMethods,Interim VP of Sales & Marketing at Phone2Action,1997–1999,Finance and International Business,Northwestern University,RevMethods,Phone2Action,,,,,,,,41.875562,-87.624421,Illinois,Cook,Chicago,17031
569, Chicago ,Chief Information Officer at Trustmark Companies,Senior Vice President and CIO at CNO Financial Group,1992–1995,Marketing,Northwestern University,Trustmark Companies,CNO Financial Group,,,,,,,,41.875562,-87.624421,Illinois,Cook,Chicago,17031
571, Chicago ,CEO & Managing Partner  at Troy Business Advisors,M&A at Gottesman Company,Northwestern University,"Management Science, Applied Mathematics",Northwestern University,Troy Business Advisors,Gottesman Company,,,,,,,,41.875562,-87.624421,Illinois,Cook,Chicago,17031
572,"Los Angeles County, California, United States",Chief Executive Officer at ActivTape,Chief Executive Officer at Kiron Labs,Washington University in St. Louis,"English, Biochemistry",Northwestern University,ActivTape,Kiron Labs,,,,,,,,34.315507,-118.209681,California,Los Angeles,,06037
573,"Sayville, New York, United States","VP, Data & Analytics at Eden Health","Director, Business Analytics at Quartet Health",Northwestern University,Predictive Analytics,Northwestern University,Eden Health,Quartet Health,,,,,,,,40.744708,-73.084188,New York,Suffolk,,36103
575,New York City  ,VP & Head of AI at WorkFusion,"Executive Director, NLP at Morgan Stanley",Northwestern University,Joint degree in Computer Science & Communication Studies,Northwestern University,WorkFusion,Morgan Stanley,,,,,,,,40.712728,-74.006015,New York,,New York,36061
576,"San Diego, California, United States",CTO & Co-Founder at Forage,Principal Software Engineer at TreeStack,Northwestern University,"Psychology, Environmental Policy & Culture",Northwestern University,Forage,TreeStack,,,,,,,,32.71742,-117.162773,California,San Diego,San Diego,06073
577, Chicago ,Chief Technology Officer at Advanced Contextual,NLP/ML Consultant at Hearst,Northwestern University,Computer Science,Northwestern University,Advanced Contextual,Hearst,,,,,,,,41.875562,-87.624421,Illinois,Cook,Chicago,17031
579,"Chicago, Illinois, United States","Exec VP, CIO at MedPoint Digital, Inc.","Exec VP, CTO at MedPoint Digital, Inc.",Northwestern University,English,Northwestern University,"MedPoint Digital, Inc.","MedPoint Digital, Inc.",,,,,,,,41.875562,-87.624421,Illinois,Cook,Chicago,17031
580,"Westwood, Massachusetts, United States",Chief Experience Officer at Citizens Bank,Chief Marketing Officer  - EVP at Citizens Bank,Stanford University Graduate School of Business,Economics and MMSS,Northwestern University,Citizens Bank,Citizens Bank,,,,,,,,42.213987,-71.224499,Massachusetts,Norfolk,,25021
581,"Nashville, Tennessee, United States","Executive Vice President, Chief Data Officer at Mercury Healthcare (formerly Healthgrades)",Data Science & Data Engineering for ATS at Amazon,Northwestern University,Predictive Analytics,Northwestern University,Mercury Healthcare (formerly Healthgrades),Amazon,,,,,,,,36.162277,-86.774298,Tennessee,Davidson,Nashville-Davidson,47037
583,Detroit  ,Director - DEI External Partnerships at General Motors,Director - Global Diversity and Inclusion Strategies at General Motors Company,University of Michigan - Stephen M. Ross School of Business,Marketing and Human Resource Management,Northwestern University,General Motors,General Motors Company,,,,,,,,42.331551,-83.04664,Michigan,Wayne,Detroit,26163
584,New York City  ,Director of Digital Strategy & Marketing at Columbia University Irving Medical Center,Director of Public Relations and Social Media at Nuvolum,Northwestern University,Predictive Analytics,Northwestern University,Columbia University Irving Medical Center,Nuvolum,,,,,,,,40.712728,-74.006015,New York,,New York,36061
587,"San Diego, California, United States",President at Borrego Solar,,1997–2001,Economics,Northwestern University,Borrego Solar,,,,,,,,,32.71742,-117.162773,California,San Diego,San Diego,06073
588,"Dallas, Texas, United States",President at QBA LLC - Quantitative Business Analytics,Partner at IBM Global Services,Northwestern University,History,Northwestern University,QBA LLC - Quantitative Business Analytics,IBM Global Services,,,,,,,,32.776272,-96.796856,Texas,Dallas,Dallas,48113
589,"Minneapolis, Minnesota, United States",Owner and President at Minneapolis Glass Company,,University of Saint Thomas - School of Business,"Business Administration and Management, General",Northwestern University,Minneapolis Glass Company,,,,,,,,,44.9773,-93.265469,Minnesota,Hennepin,Minneapolis,27053
590,"Chicago, Illinois, United States",Director of Data Science at Early Warning®,"Sr. Manager, Data Science at Early Warning®",Northwestern University,Electrical Engineering,Northwestern University,Early Warning®,Early Warning®,,,,,,,,41.875562,-87.624421,Illinois,Cook,Chicago,17031
591, Chicago ,"Associate Director, Trial Management at Taysha Gene Therapies",Clinical Trial Manager at Ayala Pharmaceuticals,University of Wisconsin-Madison,Biology,Northwestern University,Taysha Gene Therapies,Ayala Pharmaceuticals,,,,,,,,41.875562,-87.624421,Illinois,Cook,Chicago,17031
592,"Derry, New Hampshire, United States",Managing Director at RMF Foundation,Digital Marketing Manager - Corporate at HomeWell Care Services,Northeastern University,Management,Northwestern University,RMF Foundation,HomeWell Care Services,,,,,,,,42.880868,-71.326449,New Hampshire,Rockingham,,33015
593,"Ennis, Texas, United States",Engineering Maintenance Manager at US Auto Recycling,Plant Engineering Manager at Dart Container,Northwestern University,Management,Northwestern University,US Auto Recycling,Dart Container,,,,,,,,32.329311,-96.625268,Texas,Ellis,,48139
594,"Los Angeles, California, United States","SVP, Chief Strategy Officer at Isobar","Senior Director, Global Brand Strategy & Insights at Indeed.com",1998–2002,Communication Studies; Sociology,Northwestern University,Isobar,Indeed.com,,,,,,,,34.053691,-118.242766,California,Los Angeles,Los Angeles,06037
596,"Los Angeles, California, United States","Director, Data Science and Engineering - Netflix Studio at Netflix","VP, Revenue Analytics and Data Science at Cardlytics, Inc.",Georgia Institute of Technology,Industrial Engineering,Northwestern University,Netflix,"Cardlytics, Inc.",,,,,,,,34.053691,-118.242766,California,Los Angeles,Los Angeles,06037
597, Chicago ,Director HR Digital Transformation  at Microsoft,"Director, Business Program Management - Learning & Development and Organizational Transformation at Microsoft",Pepperdine University,Organizational Transformation & Learning Technologies,Northwestern University,Microsoft,Microsoft,,,,,,,,41.875562,-87.624421,Illinois,Cook,Chicago,17031
598,"Durham, North Carolina, United States",Chief Innovation Officer at GrowPath,Administration at Newark Community Church (NCC),Northwestern University,Public Policy and Administration,Northwestern University,GrowPath,Newark Community Church (NCC),,,,,,,,35.98257,-78.909187,North Carolina,Durham,Durham,37063
599,San Francisco Bay ,Partner at Accel,Head of Strategic Partnerships at Faire,Stanford University Graduate School of Business,,Northwestern University,Accel,Faire,,,,,,,,37.714029,-122.307794,California,San Mateo,,06081
600,"New York, New York, United States","Managing Director, Operations, Rise at Schmidt Futures",Director of Education Strategy and Initiatives at World Science Festival,Northwestern University,Human Development and Social Policy,Northwestern University,Schmidt Futures,World Science Festival,,,,,,,,40.712728,-74.006015,New York,,New York,36061
601,"New York, New York, United States",Chief Financial Officer at Pontera,"VP, Head of Finance at CommonBond.co",University of Pennsylvania - The Wharton School,Finance,Northwestern University,Pontera,CommonBond.co,,,,,,,,40.712728,-74.006015,New York,,New York,36061
602,Salt Lake City  ,Sr. Vice President of Business Operations at ConsultNet,Vice President of Business Operations at ConsultNet,Northwestern,Architectural Design,Northwestern University,ConsultNet,ConsultNet,,,,,,,,40.75962,-111.886798,Utah,Salt Lake,Salt Lake City,49035
603,"Westwood, Massachusetts, United States","VP, Strategic Initiatives and New Ventures at Talbots",GM | Global Apparel: Performance + Field of Play at New Balance,The Tuck School of Business at Dartmouth,"Marketing/Marketing Management, General",Northwestern University,Talbots,New Balance,,,,,,,,42.213987,-71.224499,Massachusetts,Norfolk,,25021
604,"West Palm Beach, Florida, United States",Director of Digital & Marketing Analytics at TBC Corporation,Director Of Services at HiConversion,Northwestern University,Predictive Analytics,Northwestern University,TBC Corporation,HiConversion,,,,,,,,26.715364,-80.053294,Florida,Palm Beach,West Palm Beach,12099
605,"Dallas, Texas, United States","Lead Director, Analytics & Behavior Change - Data Engineering at CVS Health",Head of Analytics at ISN,Brown University,Public & Private Sector Organizations,Northwestern University,CVS Health,ISN,,,,,,,,32.776272,-96.796856,Texas,Dallas,Dallas,48113
606,"San Francisco, California, United States","General Manager I Partnerships, Sales Strategy & New Product Development at Leyton",Head of International Partnerships I Partner Operations and Management at Lob,Northwestern University,Political Science and Government,Northwestern University,Leyton,Lob,,,,,,,,37.779026,-122.419906,California,,San Francisco,06075
607,"New York, New York, United States",Co-founder & CEO at Roster,Entrepreneur-in-Residence at FJ Labs,Harvard Business School,"Economics, Political Science",Northwestern University,Roster,FJ Labs,,,,,,,,40.712728,-74.006015,New York,,New York,36061
608,"Dallas, Texas, United States",COO at Bear Creek Family Dentistry,President / COO at Little Spurs Pediatric Urgent Care,Northwestern University - Kellogg School of Management,"Management and Strategy, Marketing",Northwestern University,Bear Creek Family Dentistry,Little Spurs Pediatric Urgent Care,,"621111 Walk-in physicians' offices (e.g., centers, clinics)",,62,,,Health Care and Social Assistance,32.776272,-96.796856,Texas,Dallas,Dallas,48113
609,"Lafayette, Colorado, United States","Vice President Marketing at ReedGroup, a Guardian® Company","Chief Marketing Officer, B2B Marketing at DELVE | Data Action Company",Northwestern University,,Northwestern University,"ReedGroup, a Guardian® Company",DELVE | Data Action Company,,,,,,,,39.993596,-105.089706,Colorado,Boulder,Lafayette,08013
610,New York City  ,"Vice President, Technology Strategy at American Securities",Senior Engagement Manager at McKinsey & Company,+ 1 more,"Economics, Business",Northwestern University,American Securities,McKinsey & Company,,,,,,,,40.712728,-74.006015,New York,,New York,36061
