,current_location,current_work,previous_work,latest_Education,major,search_school,current_company,previous_company,current_company_industry,previous_company_industry,current_NAICS,previous_NAICS,current_NAICS_title,current_avg_salary,previous_NAICS_title,latitude,longitude,state,county,city,fips
1175,"Menlo Park, California, United States",CIO at Away,"VP, Supply Chain Technolgy at Away",1981–1985,Economics and Asian Studies,Northwestern University,Away,Away,,,,,,,,37.451967,-122.177993,California,San Mateo,,06081
1176,"Houston, Texas, United States",CEO and Co-Founder at EarthBridge Energy LLC,Project Manager / Senior Scientist - Brazil Operations at ExxonMobil,Northwestern University,Earth and Planetary Sciences,Northwestern University,EarthBridge Energy LLC,ExxonMobil,,,,,,,,29.758938,-95.367697,Texas,Harris,Houston,48201
1177,"Wayland, Massachusetts, United States",CEO at Curriculum Associates,Operating Executive at Berkshire Partners,Harvard Business School,American Studies,Northwestern University,Curriculum Associates,Berkshire Partners,,,,,,,,42.363206,-71.360672,Massachusetts,Middlesex,,25017
1178,San Francisco Bay ,Global Vice President of Product at Onclusive,Vice President of Product at Onclusive,Harvard University,,Northwestern University,Onclusive,Onclusive,,,,,,,,37.714029,-122.307794,California,San Mateo,,06081
1179,"San Francisco, California, United States",Founder and CEO at A.I. Insurance Inc.,Cognitive Software Engineer (w/ a bit of Technical Product Management) at IBM,Y Combinator,Communications Studies & Computer Science Double Major,Northwestern University,A.I. Insurance Inc.,IBM,,,,,,,,37.779026,-122.419906,California,,San Francisco,06075
1180,"Austin, Texas, United States",Lead User Experience Researcher / Head of UX Research at Handshake,Senior UX Researcher/UX Research Manager at Indeed.com,2001–2003,"Computer Science (Project in HCI, Haptics and Tangible User Interfaces)",Northwestern University,Handshake,Indeed.com,,,,,,,,30.271129,-97.7437,Texas,Travis,Austin,48453
1181,"New York, New York, United States",Chief Operating Officer at Stitcher,"General Manager, Stitcher Premium at Stitcher",Northwestern University,Communication and Media Studies,Northwestern University,Stitcher,Stitcher,,,,,,,,40.712728,-74.006015,New York,,New York,36061
1182,"Houston, Texas, United States","AVP, Marketing at HCA","Vice President, Digital at Edelman",+ 1 more,Integrated Marketing Communications,Northwestern University,HCA,Edelman,,,,,,,,29.758938,-95.367697,Texas,Harris,Houston,48201
1183,"Seattle, Washington, United States",Chief Operating Officer at Amira Learning,"Principal at Porsch Consulting, LLC",Yale Law School,Mathematical Methods in the Social Sciences,Northwestern University,Amira Learning,"Porsch Consulting, LLC",,,,,,,,47.603832,-122.330062,Washington,King,Seattle,53033
1184,"San Diego, California, United States","Chief Commercial Officer at Shadowbox, Inc.","Senior Vice President, Commercial Operations at Codex DNA",Albert Einstein College of Medicine,Biochemistry & Biophysics,Northwestern University,"Shadowbox, Inc.",Codex DNA,,,,,,,,32.71742,-117.162773,California,San Diego,San Diego,06073
1186,"Roselle, Illinois, United States","Sr. Director, Technology Infrastructure and Operations at Crate and Barrel","Director, IT Infrastructure at OCC",Northwestern University,MSIT - Business / I.T.,Northwestern University,Crate and Barrel,OCC,,,,,,,,41.98499,-88.079718,Illinois,DuPage,,17043
1188,"Brookline, Massachusetts, United States",CEO at Statera,Digital Health Director at ADK Group,Harvard Business School,"Spanish Lang & Lit, European Cultural Studies",Northwestern University,Statera,ADK Group,,,,,,,,42.331764,-71.121164,Massachusetts,Norfolk,,25021
1189,San Francisco Bay ,"Data Science Director, Analytics - Marketing and Growth at Next Insurance","Manager, Decision Science at Facebook",Northwestern University,Predictive Analytics,Northwestern University,Next Insurance,Facebook,,,,,,,,37.714029,-122.307794,California,San Mateo,,06081
1190,"Seattle, Washington, United States",President & Co-founder at Landed,MBA Summer Associate at Forest City,Stanford University Graduate School of Business,Business in China,Northwestern University,Landed,Forest City,,,,,,,,47.603832,-122.330062,Washington,King,Seattle,53033
1191, Chicago ,"President/CEO at CHOi Design, Inc.",,2005–2005,Product Development,Northwestern University,"CHOi Design, Inc.",,,,,,,,,41.875562,-87.624421,Illinois,Cook,Chicago,17031
1192,"Chicago, Illinois, United States","Global Digital Innovation Lab, Managing Director North America at Kimberly-Clark","World Traveler – Asia, Middle East, Caribbean, North America at Personal Journey",University of Michigan - Stephen M. Ross School of Business,"Marketing, Organizational Strategy",Northwestern University,Kimberly-Clark,Personal Journey,,,,,,,,41.875562,-87.624421,Illinois,Cook,Chicago,17031
1193,"Glencoe, Illinois, United States",Vice President and Chief Analytics Officer at Navistar Inc,"Vice President - Global Compensation, Benefits, & Metrics at Navistar Inc",The University of Chicago - Booth School of Business,"Finance, Strategy",Northwestern University,Navistar Inc,Navistar Inc,,,,,,,,42.135027,-87.758119,Illinois,Cook,,17031
1194,"Sioux Falls, South Dakota, United States",Associate Chief Medical Information Officer at Avera Health,Chief Of Staff at Avera McKennan Hospital & University Health Center,Washington University in St. Louis,Internal Medicine Residency Program,Northwestern University,Avera Health,Avera McKennan Hospital & University Health Center,,,,,,,,43.546059,-96.731393,South Dakota,Minnehaha,Sioux Falls,46099
1197,"San Francisco, California, United States",Chief Platform Officer at Treasury Prime,VP of Strategy + Business Development at Treasury Prime,Northwestern University,Product Design and Development,Northwestern University,Treasury Prime,Treasury Prime,,,,,,,,37.779026,-122.419906,California,,San Francisco,06075
1198,"Chicago, Illinois, United States","Vice President, Director Operations and Engineering at ViacomCBS","Manager, Studio and Production Operations at NBCUniversal, Inc.",Columbia College Chicago,Television Production,Northwestern University,ViacomCBS,"NBCUniversal, Inc.",,,,,,,,41.875562,-87.624421,Illinois,Cook,Chicago,17031
1199, Boston,Chief Marketing Officer at SplitMetrics,"Fractional CMO, Marketing Advisor at B2B SaaS Companies",Harvard Business School Online,Management,Northwestern University,SplitMetrics,B2B SaaS Companies,,,,,,,,42.360253,-71.058291,Massachusetts,Suffolk,Boston,25025
1200,"Atlanta, Georgia, United States",Usher's New Look Chief Marketing Officer at Usher's New Look,Vice President Marketing at Intralot,1996–1997,,Northwestern University,Usher's New Look,Intralot,,,,,,,,33.748992,-84.390264,Georgia,Fulton,Atlanta,13121
1201,"Kennett Square, Pennsylvania, United States",Sr. Director Insight & Analytics - Specialty at Endo Pharmaceuticals,Brand Insight Director - Cardiovascular at AstraZeneca,Northwestern University,Data Science,Northwestern University,Endo Pharmaceuticals,AstraZeneca,,,,,,,,39.846741,-75.7117,Pennsylvania,Chester,,42029
1202,Raleigh-Durham-Chapel Hill ,"System Director, ISD Digital Health and Innovation at UNC Health Care",Partner at Qual-Smart,Northwestern University,Medical Informatics,Northwestern University,UNC Health Care,Qual-Smart,,,,,,,,35.855048,-78.84066,North Carolina,Wake,,37183
1203,"Homer Glen, Illinois, United States",VP of Technology at MHW,"Director, Software Development at Cloud5 Communications",Northwestern University,Information Technology,Northwestern University,MHW,Cloud5 Communications,,,,,,,,41.600032,-87.938111,Illinois,Will,,17197
1204, Chicago ,"Vice President, Innovation & Business Development at KAFKO INTERNATIONAL LTD.","Director, Innovation & Insights  at Cubii",Northwestern University,Product Management,Northwestern University,KAFKO INTERNATIONAL LTD.,Cubii,,,,,,,,41.875562,-87.624421,Illinois,Cook,Chicago,17031
1205,"Philadelphia, Pennsylvania, United States",Chief Learning Officer at Merck,"Vice President, Learning Portfolio Strategy, Comcast University at Comcast",Northwestern University,,Northwestern University,Merck,Comcast,,,,,,,,39.952724,-75.163526,Pennsylvania,Philadelphia,Philadelphia,42101
1206, Chicago ,"Vice President, Brand Strategy and Partnerships  at Influential","Sr. Social Engagement Manager - Brand, Influencers and Experience  at McDonald's",Northwestern University,"Interactive Media, Journalism",Northwestern University,Influential,McDonald's,,,,,,,,41.875562,-87.624421,Illinois,Cook,Chicago,17031
1207,"Chicago, Illinois, United States",Head Of Strategy at U.S. Soccer Federation,"Director, Global Strategy & Innovation at National Basketball Association (NBA)",Northwestern University,Liberal Studies,Northwestern University,U.S. Soccer Federation,National Basketball Association (NBA),,,,,,,,41.875562,-87.624421,Illinois,Cook,Chicago,17031
1208,"Chicago, Illinois, United States","Data Scientist, Analytics at IRI",RetailAnalyticsCouncil Researcher at Northwestern University,Northwestern University,,Northwestern University,IRI,Northwestern University,,,,,,,,41.875562,-87.624421,Illinois,Cook,Chicago,17031
1209,"Austin, Texas, United States",Head of Analytics and Data Science at PMG Digital Agency,"Senior Director, Analytics at PMG - Digital Agency",Kellogg School of Management,"Marketing Strategy, Management and Organizations",Northwestern University,PMG Digital Agency,PMG - Digital Agency,,,,,,,,30.271129,-97.7437,Texas,Travis,Austin,48453
1211, Chicago ,"President, Lemont at RR Donnelley","Director, North American Packaging Sales at RR Donnelley",Northwestern University,"Marketing, Finance",Northwestern University,RR Donnelley,RR Donnelley,,,,,,,,41.875562,-87.624421,Illinois,Cook,Chicago,17031
1213,"Minneapolis, Minnesota, United States","Director, Data Science at Target",Principal Data Scientist -- Data Sciences and Analytics at Target,Northwestern University,Master's of Science in Data Science,Northwestern University,Target,Target,,,,,,,,44.9773,-93.265469,Minnesota,Hennepin,Minneapolis,27053
1214,Denver  ,Director of Brand Strategy at Vail Resorts,Marketing Director at Anheuser-Busch InBev,Northwestern University,"Integrated Marketing Communications, History",Northwestern University,Vail Resorts,Anheuser-Busch InBev,,,,,,,,39.739236,-104.984862,Colorado,,Denver,08031
1215,"Columbus, Ohio, United States","Vice President, CFP® at Bernstein Private Wealth Management",Director - Community Development Real Estate Banking at Citi,Northwestern University,"Investments, Insurance Planning, Estate Planning, Employee Benefits, Retirement Planning",Northwestern University,Bernstein Private Wealth Management,Citi,,,,,,,,39.96226,-83.000706,Ohio,Franklin,Columbus,39049
1216,"Chicago, Illinois, United States","Vice President, Target Engagement at GE Healthcare",Global Brand and Advertising at Boeing,Northwestern University,History,Northwestern University,GE Healthcare,Boeing,,,,,,,,41.875562,-87.624421,Illinois,Cook,Chicago,17031
1217,"Austin, Texas, United States",Executive Vice President - Planning and Development at Capital Metro,"Senior Planning Manager - Planning and Environment Manager, Northern California Region at WSP USA",University of Illinois at Chicago,Urban Planning and Policy,Northwestern University,Capital Metro,WSP USA,,,,,,,,30.271129,-97.7437,Texas,Travis,Austin,48453
1218,New York City  ,Product Manager at American Express,Product Owner at American Express,Northwestern University,Product Management & Product Marketing,Northwestern University,American Express,American Express,,,,,,,,40.712728,-74.006015,New York,,New York,36061
1219,"Kenilworth, Illinois, United States",Senior Vice President and Chief Scientist at UL,"VP and Chief Technology Officer, Honeywell Advanced Materials at Honeywell",The University of Chicago Booth School of Business,Finance,Northwestern University,UL,Honeywell,,,,,,,,42.089473,-87.71493,Illinois,Cook,,17031
1220, Chicago ,"Vice President & General Manager, Hillrom Canada at Baxter International Inc.","Vice President and General Manager, Canada at Hillrom",Northwestern University,,Northwestern University,Baxter International Inc.,Hillrom,,,,,,,,41.875562,-87.624421,Illinois,Cook,Chicago,17031
1221,Dallas-Fort Worth ,Senior Director Human Resources and Employment Counsel at Atos,"Americas Employee Relations Partner, Vice President at JPMorgan Chase & Co.",Northwestern University Pritzker School of Law,Political Science,Northwestern University,Atos,JPMorgan Chase & Co.,,,,,,,,32.745316,-97.327831,Texas,Tarrant,Fort Worth,48439
1222,"Eden Prairie, Minnesota, United States",Associate Director at 360 Security Services,EVP Business Development at Crotega,St. Mary's University of Minnesota,Public Safety Administration,Northwestern University,360 Security Services,Crotega,,,,,,,,44.854686,-93.470786,Minnesota,Hennepin,Eden Prairie,27053
1223,"Chicago, Illinois, United States","Senior Manager, Content at StockX",Global Communications & Marketing Operations Lead at Micron Technology,Northwestern University,Journalism,Northwestern University,StockX,Micron Technology,,,,,,,,41.875562,-87.624421,Illinois,Cook,Chicago,17031
1224,"New York, New York, United States","Vice President, Real Estate Acquisitions at Triangle Capital Group, LLC","Associate, Real Estate Acquisitions at Silverpeak",NYU Stern School of Business,Specialization in Real Estate,Northwestern University,"Triangle Capital Group, LLC",Silverpeak,,,,,,,,40.712728,-74.006015,New York,,New York,36061
1228,"Houston, Texas, United States",EVP & CFO at Sysco,President - Sally Beauty Supply & CFO at Sally Beauty,Harvard Law School,,Northwestern University,Sysco,Sally Beauty,,,,,,,,29.758938,-95.367697,Texas,Harris,Houston,48201
1229, Chicago ,"Chief Product & Strategy Officer, Experience at NovusNorth","Chief Of Staff, Office of the CEO at Rightpoint",Northwestern University,"SCS, Information Systems Project Management",Northwestern University,NovusNorth,Rightpoint,,,,,,,,41.875562,-87.624421,Illinois,Cook,Chicago,17031
1230,Raleigh-Durham-Chapel Hill ,"Associate Director, Global Categories Procurement at Charles River Laboratories","Senior Manager, Global Categories Procurement at Charles River Laboratories",Northwestern University,Chemical Engineering,Northwestern University,Charles River Laboratories,Charles River Laboratories,,,,,,,,35.855048,-78.84066,North Carolina,Wake,,37183
1231,"Winston-Salem, North Carolina, United States","Vice President, Global Brand Marketing, Hanes brand at Hanesbrands Inc.","Executive Producer, Brand Design at Samsung Electronics America",Northwestern University - Kellogg School of Management,Marketing and General Management,Northwestern University,Hanesbrands Inc.,Samsung Electronics America,,,,,,,,36.099813,-80.244052,North Carolina,Forsyth,Winston-Salem,37067
1232,"McLean, Virginia, United States","co-founder, CEO at Owl Peak Labs",Executive Director at MKM Partners,University of Virginia Darden School of Business,Drug and Medical Device Development: A Strategic Approach,Northwestern University,Owl Peak Labs,MKM Partners,,,,,,,,38.93174,-77.167062,Virginia,Fairfax,,51059
1233, Chicago ,"Chief Operating Officer at Ridy, Inc.",Private Client Banker at JPMorgan Chase & Co.,Northwestern University,Organizational Behavior Studies,Northwestern University,"Ridy, Inc.",JPMorgan Chase & Co.,,,,,,,,41.875562,-87.624421,Illinois,Cook,Chicago,17031
1234,"Chicago, Illinois, United States",Co-Founder | Chief Growth Officer at Sonara Health,Researcher (Plastic & Reconstructive Surgery) at UT Southwestern Medical Center,Northwestern University,,Northwestern University,Sonara Health,UT Southwestern Medical Center,,,,,,,,41.875562,-87.624421,Illinois,Cook,Chicago,17031
1235, Tampa Bay ,Founder & CEO at Rebel,Head of Research & Strategy at Accomplice LLC.,Northwestern University,Predictive Analytics,Northwestern University,Rebel,Accomplice LLC.,,,,,,,,27.688642,-82.572319,Florida,Hillsborough,,12057
1236,"Las Vegas, Nevada, United States","Vice President - Analytics & Informatics, IT at Credit One Bank",Vice President | Business Intelligence & Innovation at Sands China,Northwestern University,Analytics (Applied Statistics / Data Science),Northwestern University,Credit One Bank,Sands China,,,,,,,,36.167256,-115.148516,Nevada,Clark,Las Vegas,32003
1237, Chicago ,Co-Founder & CEO at Marketplace.city,"Chief Executive Officer, North America at AvePoint",1999–2003,Political Science/International Studies,Northwestern University,Marketplace.city,AvePoint,,,,,,,,41.875562,-87.624421,Illinois,Cook,Chicago,17031
1238,"Fairfield, Connecticut, United States",Chief Technology Officer at Subway,"VP, IT Enterprise Applications - Reservations & Distribution at Marriott International",Northwestern University,Mechnical Engineering - Intelligent Mechanical Systems,Northwestern University,Subway,Marriott International,,,,,,,,41.141208,-73.263726,Connecticut,Fairfield,,09001
1239,"Richmond, Virginia, United States","Chief Technology Officer at Spring Oaks Capital, LLC",Vice President - Center for Machine Learning at Capital One,Northwestern University,,Northwestern University,"Spring Oaks Capital, LLC",Capital One,,,,,,,,37.538509,-77.43428,Virginia,,Richmond,51159
1240,San Francisco Bay ,Co-founder / President & Chief Content Officer at Hello Divorce,President & Chief Content Officer at BestReviews,Northwestern University,Journalism & Digital Media,Northwestern University,Hello Divorce,BestReviews,,,,,,,,37.714029,-122.307794,California,San Mateo,,06081
1241, Chicago ,"Director, Global Digital Experience at Gallagher",Director Digital Marketing and Customer Experience at CME Group,Loyola University of Chicago,Finance,Northwestern University,Gallagher,CME Group,,,,,,,,41.875562,-87.624421,Illinois,Cook,Chicago,17031
1242,New York City  ,Managing Partner at Sagewind Capital,President at CI Capital Partners,Northwestern University - Kellogg School of Management,Accounting and Finance,Northwestern University,Sagewind Capital,CI Capital Partners,,,,,,,,40.712728,-74.006015,New York,,New York,36061
1243, Chicago ,Director of Product Marketing - Competitive Intelligence at E2open,Market Intelligence Lead at West Monroe,Northwestern University,"Economics, with a minor in Computer Science",Northwestern University,E2open,West Monroe,,,,,,,,41.875562,-87.624421,Illinois,Cook,Chicago,17031
1244,"Chicago, Illinois, United States",Senior Director-Digital Business & Technology Consulting; Digital CX Practice Lead at Cognizant,Senior Director-Customer Strategy & Analytics; Midwest Region Lead at Strativity Group,The University of Chicago Booth School of Business,Strategy & Behavioral Economics,Northwestern University,Cognizant,Strativity Group,,,,,,,,41.875562,-87.624421,Illinois,Cook,Chicago,17031
1245,"Winnetka, Illinois, United States",Vice President - Pricing at Uline,Vice President (Divisional): E-Commerce / Pricing at True Value Company,+ 1 more,"Finance, Marketing",Northwestern University,Uline,True Value Company,,,,,,,,42.10807,-87.736529,Illinois,Cook,,17031
1246,San Diego  ,Global Head of Insights - Printing Services & Solutions at HP,SVP Head of Strategy at MullenLowe U.S.,Northwestern University,Integrated Marketing Communications,Northwestern University,HP,MullenLowe U.S.,,,,,,,,32.71742,-117.162773,California,San Diego,San Diego,06073
1247,"New York, New York, United States",Founder and President at American Insight & Strategy,"EVP Strategy & Insights, NBCU Corporate at NBCUniversal Media, LLC",+ 1 more,Television and Film Studies,Northwestern University,American Insight & Strategy,"NBCUniversal Media, LLC",,,,,,,,40.712728,-74.006015,New York,,New York,36061
1248,"Boston, Massachusetts, United States","Founder & CEO at Tremor Technologies, Inc.","Director, Product Management at AOL",Brown University,,Northwestern University,"Tremor Technologies, Inc.",AOL,,,,,,,,42.360253,-71.058291,Massachusetts,Suffolk,Boston,25025
1249,New York City  ,Head of Marketing Technology & Partnerships at Twitter,Head of Strategy & Partnerships at VidMob,Northwestern University,Communication Studies,Northwestern University,Twitter,VidMob,,,,,,,,40.712728,-74.006015,New York,,New York,36061
1250,"San Diego, California, United States","Head of Loyalty & Digital Experience at Rubio's Restaurants, Inc.","Director, Digital Experience & Media at Qdoba Restaurant Corporation",Northwestern University,Journalism,Northwestern University,"Rubio's Restaurants, Inc.",Qdoba Restaurant Corporation,"722511 Steak houses, full service",,72,,Accommodation and Food Services,44945.819,,32.71742,-117.162773,California,San Diego,San Diego,06073
1252, Chicago ,Chief Executive Officer at TeleRay TeleHealth,President/CEO at Nautilus Medical,+ 2 more,Psychology,Northwestern University,TeleRay TeleHealth,Nautilus Medical,,,,,,,,41.875562,-87.624421,Illinois,Cook,Chicago,17031
1253, Chicago ,Founder & President at Ritz Communications,,Northwestern University,Journalism,Northwestern University,Ritz Communications,,,,,,,,,41.875562,-87.624421,Illinois,Cook,Chicago,17031
1254, Chicago ,Co-Founder at Master B2B Ecommerce,Co-Founder at B2B Next,Northwestern University,"Integrated Marketing Communications, The Medill School",Northwestern University,Master B2B Ecommerce,B2B Next,,,,,,,,41.875562,-87.624421,Illinois,Cook,Chicago,17031
1255,"Minneapolis, Minnesota, United States",Founder and CEO at Umani Studio,Senior Director - Ignite Innovation at Salesforce,University of Pennsylvania - The Wharton School,,Northwestern University,Umani Studio,Salesforce,,,,,,,,44.9773,-93.265469,Minnesota,Hennepin,Minneapolis,27053
1256,New York City  ,Senior VP of Marketing and Innovation (CMO) at Bush Brothers & Company,Principal at Ahzul,Northwestern University,Board and CEO Roles,Northwestern University,Bush Brothers & Company,Ahzul,,,,,,,,40.712728,-74.006015,New York,,New York,36061
1257, Chicago ,Co-Founder & Managing Director at CMD Global Partners,Managing Director at XMS Capital Partners,1978–1980,Finance and Accounting,Northwestern University,CMD Global Partners,XMS Capital Partners,,,,,,,,41.875562,-87.624421,Illinois,Cook,Chicago,17031
1258,"Mill Valley, California, United States",Co-Founder & Chief Operating Officer  at blip energy,Real Estate Investor  at Brothers Cobb Investments,Northwestern University,"Leadership for Creative Enterprises, Minor in Entrepreneurship",Northwestern University,blip energy,Brothers Cobb Investments,,,,,,,,37.906037,-122.544976,California,Marin,,06041
1259,"New York, New York, United States",Co-Founder at Transport Marketing,"VP, Sales Marketing and Client Solutions at McClatchy",2007–2008,Integrated Marketing Communications,Northwestern University,Transport Marketing,McClatchy,,,,,,,,40.712728,-74.006015,New York,,New York,36061
1260,"Chicago, Illinois, United States","Senior Vice President, Strategy & Partnerships at PowerReviews",Vice President Enterprise Sales at PowerReviews,Northwestern University,"History, Organizational Studies",Northwestern University,PowerReviews,PowerReviews,,,,,,,,41.875562,-87.624421,Illinois,Cook,Chicago,17031
1261, Minneapolis-St. Paul ,Executive Vice President and Chief Financial Officer at Andersen Corporation,Various at Armstrong World Industries,Northwestern University,,Northwestern University,Andersen Corporation,Armstrong World Industries,,,,,,,,44.878019,-93.220928,Minnesota,Hennepin,Minneapolis,27053
1262,"San Rafael, California, United States",Chief Executive Officer at Youth Enrichment Brands,Executive Vice President of Growth & Development at US Sports Camps,Northwestern University,"History, Business, Economics",Northwestern University,Youth Enrichment Brands,US Sports Camps,,,,,,,,37.973535,-122.531087,California,Marin,San Rafael,06041
1263,"Columbia, Maryland, United States",CEO & Co-Founder at Vheda Health,"Senior Manager, Clinical Strategy and Innovation at Anthem, Inc.",Northwestern University,Medical Informatics,Northwestern University,Vheda Health,"Anthem, Inc.",,,,,,,,39.193843,-76.864609,Maryland,Howard,Columbia,24027
1264,"San Francisco, California, United States",COO & Co-founder at Found,Entrepreneur in Residence at Atomic,Northwestern University,"Marketing/Marketing Management, General",Northwestern University,Found,Atomic,,,,,,,,37.779026,-122.419906,California,,San Francisco,06075
1265, Boston,CSO and Co-Founder at Treeline Biosciences,Global Head Oncology at Novartis Institutes for BioMedical Research (NIBR),Albert Einstein College of Medicine,Molecular Pharmacology,Northwestern University,Treeline Biosciences,Novartis Institutes for BioMedical Research (NIBR),,,,,,,,42.360253,-71.058291,Massachusetts,Suffolk,Boston,25025
1266,"Chicago, Illinois, United States",Co-Founder at Closing Media,Guest Lecturer at Stanford University,Northwestern University,Economics and English,Northwestern University,Closing Media,Stanford University,,,,,,,,41.875562,-87.624421,Illinois,Cook,Chicago,17031
1267,"New York, New York, United States","Founder / CEO at Wagmo, Inc.","Vice President at BlackRock, Financial Institutions Group",Harvard Business School,Economics,Northwestern University,"Wagmo, Inc.","BlackRock, Financial Institutions Group",,,,,,,,40.712728,-74.006015,New York,,New York,36061
1268,"Los Angeles, California, United States",President and Chief Executive Officer at UMMA COMMUNITY CLINIC,Chief Operating Officer  at UMMA COMMUNITY CLINIC,University of La Verne,Organizational Leadership,Northwestern University,UMMA COMMUNITY CLINIC,UMMA COMMUNITY CLINIC,,,,,,,,34.053691,-118.242766,California,Los Angeles,Los Angeles,06037
1269,"Denver, Colorado, United States",VP of Technology at DispatchHealth,Part-time Instructor at General Assembly,Northwestern University,,Northwestern University,DispatchHealth,General Assembly,,,,,,,,39.739236,-104.984862,Colorado,,Denver,08031
