,current_location,current_work,previous_work,latest_Education,major,search_school,current_company,previous_company,current_company_industry,previous_company_industry,current_NAICS,previous_NAICS,current_NAICS_title,current_avg_salary,previous_NAICS_title,latitude,longitude,state,county,city,fips
1754,"Carol Stream, Illinois, United States",CEO at A.J. Antunes & Co.,,University of Cincinnati,Elementary Education and Teaching,Northwestern University,A.J. Antunes & Co.,,,,,,,,,41.912529,-88.134793,Illinois,DuPage,,17043
1755,"Denver, Colorado, United States","Co-Founder, CEO at Stealth Startup","Senior Director, Customer Strategy & Planning at Outrider","University of California, Berkeley, Haas School of Business",Economics,Northwestern University,Stealth Startup,Outrider,,,,,,,,39.739236,-104.984862,Colorado,,Denver,08031
1756,"Philadelphia, Pennsylvania, United States",Chief Executive Officer at Muna Therapeutics,"Global Head, Rare and Neurologic Diseases Therapeutic Area at Sanofi",Washington University in St. Louis School of Medicine,Neuroscience,Northwestern University,Muna Therapeutics,Sanofi,,,,,,,,39.952724,-75.163526,Pennsylvania,Philadelphia,Philadelphia,42101
1757,"Chicago, Illinois, United States",Chief Growth Officer at Braviant Holdings,"EVP, Retail Banking at TCF Bank",Northwestern University,Integrated Marketing Communications,Northwestern University,Braviant Holdings,TCF Bank,,,,,,,,41.875562,-87.624421,Illinois,Cook,Chicago,17031
1758,"Albany, New York, United States",CEO at ZEPHYRx,VP Products at CommerceHub,Kellogg Graduate School of Management,"Marketing, Management Information Sciences",Northwestern University,ZEPHYRx,CommerceHub,,,,,,,,42.651167,-73.754968,New York,Albany,Albany,36001
1759,"Minneapolis, Minnesota, United States",Chief Technology Officer at Player's Health,Senior Enterprise Architect at MentorMate,Northwestern University,,Northwestern University,Player's Health,MentorMate,,,,,,,,44.9773,-93.265469,Minnesota,Hennepin,Minneapolis,27053
1760,"Portland, Oregon, United States",CEO at DevelopmentNow,"Co-Founder, CTO at Streamline Media Partners",Northwestern University - The Feinberg School of Medicine,Medicine,Northwestern University,DevelopmentNow,Streamline Media Partners,,,,,,,,45.520247,-122.674195,Oregon,Multnomah,Portland,41051
1761,"Santa Barbara, California, United States","Director, IT, Cardiac Rhythm Management at Abbott",Senior Data Scientist at Southern California Edison (SCE),The George Washington University,Cybersecurity Analytics,Northwestern University,Abbott,Southern California Edison (SCE),,,,,,,,34.422132,-119.702667,California,Santa Barbara,Santa Barbara,06083
1762,"Dallas, Texas, United States","Director, Digital Products at DallasNews Corporation",Program Management at Yahoo! Inc.,The Graduate School at Northwestern University,Media Management,Northwestern University,DallasNews Corporation,Yahoo! Inc.,,,,,,,,32.776272,-96.796856,Texas,Dallas,Dallas,48113
1764,"San Diego, California, United States",Digital Innovation and Data Director at NAVWAR,IT Capabilities and Services Director at NAVWAR,San Diego State University-California State University,Learning and Organizational Change,Northwestern University,NAVWAR,NAVWAR,,,,,,,,32.71742,-117.162773,California,San Diego,San Diego,06073
1765,"Chicago, Illinois, United States","Director, Digital Delivery at ATI Physical Therapy","IT Product Director, Clinical and Revenue Cycle Applications at ATI Physical Therapy",Northwestern University,"Psychology, Science In Human Culture, Economics",Northwestern University,ATI Physical Therapy,ATI Physical Therapy,,,,,,,,41.875562,-87.624421,Illinois,Cook,Chicago,17031
1766,New York City  ,Founder & CEO at Koala,Founder & CEO at Fuzz,1994–1998,Computer Science,Northwestern University,Koala,Fuzz,,,,,,,,40.712728,-74.006015,New York,,New York,36061
1767,"New York, New York, United States","VP, Marketing Analytics at Disney Streaming","VP, Data and Insight (Brand + Marketing) at The New York Times",Northwestern University,"Political Science, International Studies",Northwestern University,Disney Streaming,The New York Times,,,,,,,,40.712728,-74.006015,New York,,New York,36061
1768,"Loveland, Ohio, United States",President & CEO at Pro Mach Inc,General Manager at Tyler Refrigeration,1992–1994,Management,Northwestern University,Pro Mach Inc,Tyler Refrigeration,,,,,,,,39.26768,-84.274604,Ohio,Hamilton,,39061
1770,"Milwaukee, Wisconsin, United States",Chief Operating Officer at SKYGEN USA,Senior Vice President Operations at SKYGEN USA,1982–1987,Business Administration,Northwestern University,SKYGEN USA,SKYGEN USA,,,,,,,,43.034993,-87.922497,Wisconsin,Milwaukee,Milwaukee,55079
1771,"San Francisco, California, United States",COO at Picsart,Advisor at Rakuten,Northwestern University,Journalism & Economics,Northwestern University,Picsart,Rakuten,,,,,,,,37.779026,-122.419906,California,,San Francisco,06075
1772,"Napa, California, United States",Chief Operating Officer at Johnson Brothers,EVP of Operations and Chief Strategy Officer at Johnson Brothers Liquor Co,Northwestern University,Materials Science,Northwestern University,Johnson Brothers,Johnson Brothers Liquor Co,,,,,,,,38.297137,-122.285529,California,Napa,Napa,06055
1773,New York City  ,Senior Vice President Product Management at fuboTV,Head of Product at Hearst,Brooklyn College,History,Northwestern University,fuboTV,Hearst,,,,,,,,40.712728,-74.006015,New York,,New York,36061
1774, Chicago ,"Co-Founder, CEO at Aligned Modern Health",Managing Director at LaSalle Capital Group,2005,,Northwestern University,Aligned Modern Health,LaSalle Capital Group,,,,,,,,41.875562,-87.624421,Illinois,Cook,Chicago,17031
1775,San Francisco Bay ,Global Chief Marketing Officer (CMO) at Cornershop by Uber,VP International Business (+ VP International Marketing) at Ancestry,Northwestern University,Economics,Northwestern University,Cornershop by Uber,Ancestry,,,,,,,,37.714029,-122.307794,California,San Mateo,,06081
1776,"Austin, Texas, United States",President at Motiv,VP of Services at SFCG,Northwestern University,Economics & Art History,Northwestern University,Motiv,SFCG,,,,,,,,30.271129,-97.7437,Texas,Travis,Austin,48453
1777,"Dallas, Texas, United States","Vice President Supply Chain Management and Procurement at Trinity Industries, Inc.","Director, Supply Chain Center of Excellence at Tata Consultancy Services",1992–1996,Industrial Engineering,Northwestern University,"Trinity Industries, Inc.",Tata Consultancy Services,,,,,,,,32.776272,-96.796856,Texas,Dallas,Dallas,48113
1778,"Columbus, Ohio  ","President, Transportation at DHL Supply Chain","Vice President, Supply Chain at England Logistics",Northwestern University,Transportation,Northwestern University,DHL Supply Chain,England Logistics,,,,,,,,39.96226,-83.000706,Ohio,Franklin,Columbus,39049
1779,"Grapevine, Texas, United States",President and Chief Executive Officer at 4Refuel,President and Chief Executive Officer at Consolidated Fastfrate Group of Companies and its subsidiaries,Northwestern University,Finance and Financial Management Services,Northwestern University,4Refuel,Consolidated Fastfrate Group of Companies and its subsidiaries,,,,,,,,32.933738,-97.078875,Texas,Tarrant,Grapevine,48439
1780, Chicago ,"Director, Corporate Strategy & Insights at Constellation Brands","Director, Innovation at Constellation Brands",University of Pennsylvania - The Wharton School,Dual major in Marketing and Operations Management,Northwestern University,Constellation Brands,Constellation Brands,,,,,,,,41.875562,-87.624421,Illinois,Cook,Chicago,17031
1781,Atlanta  ,Chief Product Officer at OncoHealth,SVP of Product Management at OncoHealth,Emory University - Goizueta Business School,Epidemiology,Northwestern University,OncoHealth,OncoHealth,,,,,,,,33.748992,-84.390264,Georgia,Fulton,Atlanta,13121
1782,"Portland, Oregon, United States","Director, Digital Consumer Experience at adidas","Senior Manager, Journey Optimization (eCommerce)  at adidas",Northwestern University,"Communication Studies, Business Institutions Minor, Integrated Marketing Communications Certificate",Northwestern University,adidas,adidas,,,,,,,,45.520247,-122.674195,Oregon,Multnomah,Portland,41051
1783,"Dallas, Texas, United States",Data Science Manager at PepsiCo,Vice President - Analytic Consultant at Wells Fargo,Northwestern University,Data Science,Northwestern University,PepsiCo,Wells Fargo,,,,,,,,32.776272,-96.796856,Texas,Dallas,Dallas,48113
1784,"Chicago, Illinois, United States",President and CEO at SP+ (SP Plus),President and COO at SP+ (SP Plus),+ 1 more,,Northwestern University,SP+ (SP Plus),SP+ (SP Plus),,,,,,,,41.875562,-87.624421,Illinois,Cook,Chicago,17031
1785, Chicago ,SVP/Head of Digital at Beacon Media,Vice President Digital Media at AL Media Strategy,Northwestern University,New Media,Northwestern University,Beacon Media,AL Media Strategy,,,,,,,,41.875562,-87.624421,Illinois,Cook,Chicago,17031
1786, Chicago ,"VP, Digital Strategy at Day One Agency","VP, Business & Account at SOCIALDEVIANT",University of Wisconsin-Madison,Life Sciences Communication,Northwestern University,Day One Agency,SOCIALDEVIANT,,,,,,,,41.875562,-87.624421,Illinois,Cook,Chicago,17031
1787,"Cupertino, California, United States",VP of Products at RelicX,"Product Management Leader, Infrastructure & Cloud at Uber",University of Pennsylvania - The Wharton School,Technology Management,Northwestern University,RelicX,Uber,,,,,,,,37.322893,-122.03229,California,Santa Clara,Cupertino,06085
1788,San Francisco Bay ,Director of Engineering - Data at Thirty Madison,Sr. Engineering Manager at 23andMe,Northwestern University,Predictive Analytics,Northwestern University,Thirty Madison,23andMe,,,,,,,,37.714029,-122.307794,California,San Mateo,,06081
1789, Chicago ,"Director, Global Procurement, IT Services and Infrastructure at Astellas Pharma","Associate Director, Strategic Sourcing and Procurement at Astellas Pharma",Northwestern University,Learning and Organizational Change,Northwestern University,Astellas Pharma,Astellas Pharma,,,,,,,,41.875562,-87.624421,Illinois,Cook,Chicago,17031
1790,"Austin, Texas, United States",Chief Operations Officer at M3 Design,Chief Operations Officer and Director of Engineering at M3 Design,Northwestern University,"Biomedical Engineering, Specialization in Biomechanics",Northwestern University,M3 Design,M3 Design,,,,,,,,30.271129,-97.7437,Texas,Travis,Austin,48453
1792,"New York, New York, United States",Chief Data & Analytics Officer at CVS Health,"Chief Analytics Officer, Aetna & CVS Caremark at Aetna, a CVS Health Company",Columbia University - Columbia Business School,Mathematics,Northwestern University,CVS Health,"Aetna, a CVS Health Company",,,,,,,,40.712728,-74.006015,New York,,New York,36061
1793,"New York, New York, United States",GTM Strategy & Operations Manager at Miro,Sales Strategy & Operations Manager at Miro,Northwestern University,MatSE - Materials Science and Engineering,Northwestern University,Miro,Miro,,,,,,,,40.712728,-74.006015,New York,,New York,36061
1795, Chicago ,Senior Director of Digital Product and UX at MillerKnoll,Director of Digital Product at MillerKnoll,Harvard Business Analytics Program,Alternative Design,Northwestern University,MillerKnoll,MillerKnoll,,,,,,,,41.875562,-87.624421,Illinois,Cook,Chicago,17031
1796,"Elgin, Illinois, United States",Founder and CEO at AidmyAgency.com,Founder and CEO at Halcon Insurance Agency Inc,Northwestern University,"Biology, General",Northwestern University,AidmyAgency.com,Halcon Insurance Agency Inc,,,,,,,,42.03726,-88.281099,Illinois,Kane,Elgin,17089
1797,"Miami, Florida, United States",Senior Vice President & Chief Strategy Officer at CSX,Founding Partner at Lynwood Partners,1991–1993,"Management, Marketing, Finance and Transportation",Northwestern University,CSX,Lynwood Partners,,,,,,,,25.774173,-80.19362,Florida,Miami-Dade,Miami,12086
1798, Chicago ,Vice President of Strategy at Fairbanks Morse,Senior Manager at Bain & Company,Columbia University - Columbia Business School,Economics,Northwestern University,Fairbanks Morse,Bain & Company,,,,,,,,41.875562,-87.624421,Illinois,Cook,Chicago,17031
1799,"New York, New York, United States","Director, Brand Marketing & Promotions - NBCU Entertainment Networks at NBCUniversal Media, LLC","Director, Strategic Marketing Initiatives - NBCU Corporate Symphony at NBCUniversal Media, LLC",Northwestern University,Integrated Marketing Communication,Northwestern University,"NBCUniversal Media, LLC","NBCUniversal Media, LLC",,,,,,,,40.712728,-74.006015,New York,,New York,36061
1800,"Oak Park, Illinois, United States","Founder, Head of SEO at SEO Logic",In-house SEO Consultant at OppLoans,The Graduate School at Northwestern University,Learning Disabilities,Northwestern University,SEO Logic,OppLoans,,,,,,,,41.887814,-87.788762,Illinois,Cook,,17031
1801, Chicago ,"Senior Director, Global Data Analytics and Innovation at Kimberly-Clark","Vice President, Digital Analytics and Media Planning at Epsilon",Northwestern University,Integrated Marketing,Northwestern University,Kimberly-Clark,Epsilon,,,,,,,,41.875562,-87.624421,Illinois,Cook,Chicago,17031
1802,"Burlingame, California, United States",Strategic Fundraising Consultant │ Founder of Donor Boom | San Francisco Bay Area at Donor Boom,Director of Development at Feminist Majority Foundation,1996–1998,Marketing,Northwestern University,Donor Boom,Feminist Majority Foundation,,,,,,,,37.584103,-122.366082,California,San Mateo,Burlingame,06081
1804,"Santa Fe, New Mexico, United States",CoFounder | Chief Operating Officer at REALTY GIFT FUND,CoFounder | Chief Operating Officer at Realty Gift Fund,Education (same page),Political Science and Art History,Northwestern University,REALTY GIFT FUND,Realty Gift Fund,,,,,,,,35.68761,-105.938457,New Mexico,Santa Fe,Santa Fe,35049
1806, Chicago ,President at Periscope,President at MARC USA,2001–2002,Marketing,Northwestern University,Periscope,MARC USA,,,,,,,,41.875562,-87.624421,Illinois,Cook,Chicago,17031
1807,"Evanston, Illinois, United States","Director Data Science, Operations Research at Grubhub",Lead Decision Scientist at Grubhub,Northwestern University,Physics,Northwestern University,Grubhub,Grubhub,,,,,,,,42.044739,-87.693046,Illinois,Cook,,17031
1808,"San Francisco, California, United States",Director Of Product Design at Brex,Product Design Manager at Facebook,Vanderbilt University,Music Performance,Northwestern University,Brex,Facebook,,,,,,,,37.779026,-122.419906,California,,San Francisco,06075
1809,"Dallas, Texas, United States",Vice President - Marketing at The Arnold Companies,"Chief Marketing Officer at Pullbutton, Inc.",Northwestern University,Integrated Marketing Communications - Advertising,Northwestern University,The Arnold Companies,"Pullbutton, Inc.",,,,,,,,32.776272,-96.796856,Texas,Dallas,Dallas,48113
1810,"Dearborn, Michigan, United States",Technical Leader Additive Manufacturing Research at Ford Motor Company,Team Leader Plastics Research at Ford Motor Company,"University of California, Berkeley",Chemical Engineering,Northwestern University,Ford Motor Company,Ford Motor Company,532112 Van (passenger) leasing,,53,,Real Estate and Rental and Leasing,60268.137,,42.32226,-83.176314,Michigan,Wayne,Dearborn,26163
1811, Chicago ,CFO at MoLo Solutions,COO at HubTran,Northwestern University,Information Technology,Northwestern University,MoLo Solutions,HubTran,,,,,,,,41.875562,-87.624421,Illinois,Cook,Chicago,17031
1813,Dallas-Fort Worth ,Director of Advanced Analytics/Data Science at Samsung Electronics America,Predictive Analytics / Data Science Director at Lenovo,Northwestern University,Master of Science in Predictive Analytics,Northwestern University,Samsung Electronics America,Lenovo,,,,,,,,32.745316,-97.327831,Texas,Tarrant,Fort Worth,48439
1814,"New York, New York, United States",Chief Financial Officer at Civis Analytics,Troubled Asset Relief Program (TARP) at U.S. Department of the Treasury,Northwestern University,Economics,Northwestern University,Civis Analytics,U.S. Department of the Treasury,,,,,,,,40.712728,-74.006015,New York,,New York,36061
1815,"Raleigh, North Carolina, United States","Director, Machine Learning at ConnectWise","Manager, Data Science & Analytics at ConnectWise",Northwestern University,Data Science,Northwestern University,ConnectWise,ConnectWise,,,,,,,,35.780398,-78.639099,North Carolina,Wake,Raleigh,37183
1816,San Francisco Bay ,Sr. Director Marketing Operations and Analytics at Databricks,"Sr. Director Marketing, Chief of Staff to the CMO at Khoros",Northwestern University,Communications and Psychology,Northwestern University,Databricks,Khoros,,,,,,,,37.714029,-122.307794,California,San Mateo,,06081
1817,"Charlotte, North Carolina, United States",Senior Strategic Partner Marketing Manager at Root Inc.,Digital Marketing at Wells Fargo,Northwestern University,Integrated Marketing Communications (IMC),Northwestern University,Root Inc.,Wells Fargo,,,,,,,,35.227209,-80.843083,North Carolina,Mecklenburg,Charlotte,37119
1820,"Del Mar, California, United States","Director, Marketing & Communications at Seres Therapeutics","Associate Director, Donor Recruitment at Seres Therapeutics",Washington University in St. Louis School of Law,Law,Northwestern University,Seres Therapeutics,Seres Therapeutics,,,,,,,,32.959489,-117.265315,California,San Diego,,06073
1821,"Orlando, Florida, United States",Chief Operating Officer at Fortress Information Security,Chief of Staff at Exelon,Northwestern University,Public Policy Administration,Northwestern University,Fortress Information Security,Exelon,,,,,,,,28.542111,-81.37903,Florida,Orange,Orlando,12095
1822,San Francisco Bay ,Vice President Business Operations at Sesame,"Consultant, Operations at Hewlett Packard Enterprise",Northwestern University - Kellogg School of Management,"Marketing, Management & Strategy, Operations and Logistics",Northwestern University,Sesame,Hewlett Packard Enterprise,,,,,,,,37.714029,-122.307794,California,San Mateo,,06081
1823, Philadelphia,"Director of Data Science at Scoir, Inc.",Staff Data Scientist at Sidecar,Northwestern University,Predictive Analysis,Northwestern University,"Scoir, Inc.",Sidecar,,,,,,,,39.952724,-75.163526,Pennsylvania,Philadelphia,Philadelphia,42101
1824,"New York, New York, United States",Vice President at Advent International,MBA Candidate at The Wharton School,Northwestern University,"Industrial Engineering, Economics",Northwestern University,Advent International,The Wharton School,,,,,,,,40.712728,-74.006015,New York,,New York,36061
1825, Boston,"Manager, Corporate Strategy at Aptiv",Senior Consultant II at Roland Berger,Northwestern University - Kellogg School of Management,Management Studies,Northwestern University,Aptiv,Roland Berger,,,,,,,,42.360253,-71.058291,Massachusetts,Suffolk,Boston,25025
1826,"Chicago, Illinois, United States","Senior Vice President, Head of Performance Analytics at Weber Shandwick","Vice President, Digital Performance Analytics Lead at Weber Shandwick",Northwestern University,Integrated Marketing Communications,Northwestern University,Weber Shandwick,Weber Shandwick,,,,,,,,41.875562,-87.624421,Illinois,Cook,Chicago,17031
1827,"Mountain View, California, United States",Director of Product Management at Clipboard Health,Senior Product Manager at Clipboard Health,Northwestern University,Economics,Northwestern University,Clipboard Health,Clipboard Health,,,,,,,,37.389389,-122.08321,California,Santa Clara,Mountain View,06085
1829,"Newport Beach, California, United States",Investment Advisor & Head of Business Development at The Clark Group Asset Management,Financial Advisor at Merrill Lynch,Northwestern University,"Communication and Media Studies, Minor in Business",Northwestern University,The Clark Group Asset Management,Merrill Lynch,,,,,,,,33.617009,-117.92944,California,Orange,Newport Beach,06059
1830,"Portland, Oregon, United States","Senior Director, Global Diversity, Equity, & Inclusion at Nike","Senior Director - Head of Global Diversity, Inclusion, & Belonging at Levi Strauss & Co.",Northwestern University,Inclusive and Authentic Leadership Certification,Northwestern University,Nike,Levi Strauss & Co.,,,,,,,,45.520247,-122.674195,Oregon,Multnomah,Portland,41051
1831,"San Francisco, California, United States",Managing Director at LionTree LLC,Managing Director at Code Advisors,Instituto Internacional de Madrid,Spanish,Northwestern University,LionTree LLC,Code Advisors,,,,,,,,37.779026,-122.419906,California,,San Francisco,06075
1832, Chicago ,Owner at Data Managers Inc,Electrical Engineer at Federal Mogul,Northwestern University,Engineering Management,Northwestern University,Data Managers Inc,Federal Mogul,,,,,,,,41.875562,-87.624421,Illinois,Cook,Chicago,17031
1833,Denver  ,Director of Information Technology Swedish Medical Center at HealthONE,Sr Director IT & S at Medical City Healthcare (Formerly HCA North Texas),Northwestern University,Medical Informatics,Northwestern University,HealthONE,Medical City Healthcare (Formerly HCA North Texas),,,,,,,,39.739236,-104.984862,Colorado,,Denver,08031
1834,"New York, New York, United States",Founder  and Executive Director at Collective Agency,CEO at VirtualArtsTV,Northwestern University,Theater,Northwestern University,Collective Agency,VirtualArtsTV,,,,,,,,40.712728,-74.006015,New York,,New York,36061
1835,Dallas-Fort Worth ,COO at Wonder Works Studio,WW Mixed Reality Delivery Lead at Microsoft,Northwestern University,Linguistics,Northwestern University,Wonder Works Studio,Microsoft,,,,,,,,32.745316,-97.327831,Texas,Tarrant,Fort Worth,48439
1836,San Francisco Bay ,Founder & CEO at Everyplace Labs,Founder & CEO at Voyant Diagnostics,Northwestern University,Electrical Engineering,Northwestern University,Everyplace Labs,Voyant Diagnostics,,,,,,,,37.714029,-122.307794,California,San Mateo,,06081
1839,"South San Francisco, California, United States","Director, Global R&D Operations (Biologics) at Amgen","Director, Biologics at Catalent Pharma Solutions",Duke University - The Fuqua School of Business,"Finance, Global Business",Northwestern University,Amgen,Catalent Pharma Solutions,,,,,,,,37.65354,-122.416866,California,San Mateo,South San Francisco,06081
1840,"Marco, Florida, United States",President/Founder at Marco Elite Consulting,Vice President Electronic Engineering at Marmon Foodservice Technologies,Northwestern University - Kellogg School of Management,"Business Strategy, Finance, M&A, Marketing, Organizational leadership and Transformation",Northwestern University,Marco Elite Consulting,Marmon Foodservice Technologies,,,,,,,,26.712158,-81.214797,Florida,Hendry,,12051
1841,"New York, New York, United States",Co-Founder at Whipped Cream PBC,Co-Founder & CEO at Bonobos,Stanford University Graduate School of Business,,Northwestern University,Whipped Cream PBC,Bonobos,,,,,,,,40.712728,-74.006015,New York,,New York,36061
1843,New York City  ,Founder & CEO at Proof of Talent,Business Development at AirSwap,Northwestern University,Information Systems,Northwestern University,Proof of Talent,AirSwap,,,,,,,,40.712728,-74.006015,New York,,New York,36061
1844,"Seattle, Washington, United States",President at ACI Mechanical & HVAC Sales,Vice President & General Manager - Ruskin at Johnson Controls,1985–1987,Human Factors Engineering,Northwestern University,ACI Mechanical & HVAC Sales,Johnson Controls,,,,,,,,47.603832,-122.330062,Washington,King,Seattle,53033
1845,"San Jose, California, United States",Chief Marketing Officer at solo.io,Chief Marketing Officer at Puppet,Stanford University Graduate School of Business,SEP 2016,Northwestern University,solo.io,Puppet,,,,,,,,37.33619,-121.890583,California,Santa Clara,San Jose,06085
1846,"New York, New York, United States",President & CEO at Fetch by The Dodo,"Board Member at Nutrisystem, Inc.",Northwestern University,Advertising,Northwestern University,Fetch by The Dodo,"Nutrisystem, Inc.",,,,,,,,40.712728,-74.006015,New York,,New York,36061
1847,"Winston-Salem, North Carolina, United States",Chief Executive Officer at Unbox the Dress,"Manager, Agency Relations at The Rojek Consulting Group",Northwestern University,"Integrated Marketing Communications (Medill), Film and Media Studies Minor",Northwestern University,Unbox the Dress,The Rojek Consulting Group,,,,,,,,36.099813,-80.244052,North Carolina,Forsyth,Winston-Salem,37067
1848, Seattle ,Chief Executive Officer at Wecruiter,President North America at ATG,+ 3 more,"Finance, Strategy, Operations",Northwestern University,Wecruiter,ATG,,,,,,,,47.603832,-122.330062,Washington,King,Seattle,53033
1849,"Lake Wales, Florida, United States",Chief Operating Officer at Florida's Natural Growers,Chief Marketing Officer at Florida's Natural Growers,Northwestern University,Economics and Hispanic Studies,Northwestern University,Florida's Natural Growers,Florida's Natural Growers,,,,,,,,27.901413,-81.58591,Florida,Polk,,12105
1850,"Houston, Texas, United States",CEO at BrainCheck,VP of Ecommerce at JW Player,Princeton University,Collective Behavior in Biological Systems; Biological Informatics,Northwestern University,BrainCheck,JW Player,,,,,,,,29.758938,-95.367697,Texas,Harris,Houston,48201
1851,"Libertyville, Illinois, United States","Founder & Chief Executive Officer at Cotinuum, LLC","Vice President, Enterprise Sales Enablement at Trustmark",Northwestern University,Latin American Studies,Northwestern University,"Cotinuum, LLC",Trustmark,,,,,,,,42.283079,-87.95313,Illinois,Lake,,17097
1852,"Chicago, Illinois, United States","Vice President Strategic Operations at American Orthopedic Partners, LLC",Vice President - Business Systems and Finance Operations at Advocate Health Care,2020–2020,Artificial Intelligence:  Strategies for Leading Business Transformation,Northwestern University,"American Orthopedic Partners, LLC",Advocate Health Care,,,,,,,,41.875562,-87.624421,Illinois,Cook,Chicago,17031
