,current_location,current_work,previous_work,latest_Education,major,search_school,current_company,previous_company,current_company_industry,previous_company_industry,current_NAICS,previous_NAICS,current_NAICS_title,current_avg_salary,previous_NAICS_title,latitude,longitude,state,county,city,fips
0,Los Angeles  ,Vice President Global People Business Partnerships at IMAX,Global Chief People Officer at Electrosonic,+ 6 more,Organizational Design for Digital Transformation,Northwestern University,IMAX,Electrosonic,541420 Tool industrial design services,"711510 Writers, independent (freelance)",54,71,"Professional, Scientific, and Technical Services",77645.346,"Arts, Entertainment, and Recreation",34.053691,-118.242766,California,Los Angeles,Los Angeles,06037
1,"Chicago, Illinois, United States",Vice President at Linden Capital Partners,Investment Professional at The World Bank,Harvard Business School,General Management,Northwestern University,Linden Capital Partners,The World Bank,523910 Viatical settlement companies,"522293 Trade financing, international",52,52,Finance and Insurance,80163.492,Finance and Insurance,41.875562,-87.624421,Illinois,Cook,Chicago,17031
2, Chicago ,"Director, Program Management (Innovation) at Walgreens","Engagement Manager, Health & Life Sciences at Oliver Wyman",Northwestern University,,Northwestern University,Walgreens,Oliver Wyman,446110 Pharmacies,541611 Strategic planning consulting services,44-45,54,Retail Trade,56013.266,"Professional, Scientific, and Technical Services",41.875562,-87.624421,Illinois,Cook,Chicago,17031
4,"Chicago, Illinois, United States",Content Marketing Manager  at Collective Health,Member Engagement Marketing at Maestro Health,Northwestern University,"Journalism, Medill School of Journalism",Northwestern University,Collective Health,Maestro Health,"523991 Trust companies, nondepository",524114 Medical service plans without providing health care services,52,52,Finance and Insurance,80163.492,Finance and Insurance,41.875562,-87.624421,Illinois,Cook,Chicago,17031
5, Chicago ,"Vice President, Planning Director at Cramer-Krasselt",Brand Planning Director at Cramer-Krasselt,Northwestern University,Integrated Marketing Communications,Northwestern University,Cramer-Krasselt,Cramer-Krasselt,541820 Public relations services,541820 Public relations services,54,54,"Professional, Scientific, and Technical Services",77645.346,"Professional, Scientific, and Technical Services",41.875562,-87.624421,Illinois,Cook,Chicago,17031
6, Chicago ,Strategic Partner Manager at BullsEye Telecom,Channel Development Manager at Intrado,Northwestern University,History,Northwestern University,BullsEye Telecom,Intrado,517911 Wireless telecommunication resellers (except satellite),518210 Web hosting,51,51,Information,73855.595,Information,41.875562,-87.624421,Illinois,Cook,Chicago,17031
7,Atlanta  ,"Director, Health Solutions, North America at CTG",Executive Vice President Of Sales & RCM at CompuGroup Medical US,Duke University,Healthcare Innovation,Northwestern University,CTG,CompuGroup Medical US,221310 Water treatment plants,,22,,Utilities,84207.831,,33.748992,-84.390264,Georgia,Fulton,Atlanta,13121
8,"Melbourne, Florida, United States","Senior Director, Learning and Development at Precision Medicine Group","Senior Associate, Learning and Talent Development at Booz Allen Hamilton",University of Florida,Communications,Northwestern University,Precision Medicine Group,Booz Allen Hamilton,561110 Office management services,541611 Strategic planning consulting services,56,54,Administrative and Support and Waste Management and Remediation Services,64366.438,"Professional, Scientific, and Technical Services",28.106471,-80.637151,Florida,Brevard,Melbourne,12009
9,"San Francisco, California, United States","SVP, Revenue at Sonder Inc.","GM / SVP - New Business & Strategic Partnerships (Acquired Booking Holdings) at Rocket Travel, Inc, a Booking Holdings Company",Stanford University,,Northwestern University,Sonder Inc.,"Rocket Travel, Inc, a Booking Holdings Company",721110 Tourist lodges,,72,,Accommodation and Food Services,44945.819,,37.779026,-122.419906,California,,San Francisco,06075
10,"Saratoga, California, United States","Executive Vice President and GM, Data Center Group at Xilinx","Executive Vice President, Software and IP Products at Xilinx",1991–1996,"Computer Science, EDA",Northwestern University,Xilinx,Xilinx,"511210 Utility software, computer, packaged","511210 Utility software, computer, packaged",51,51,Information,73855.595,Information,37.263832,-122.023015,California,Santa Clara,,06085
11,"San Diego, California, United States","President, CEO and Board Member  at Sarcos Technology and Robotics Corporation",Global Head of Internet of Things and Automotive  at Ericsson,Northwestern University,Information Technology,Northwestern University,Sarcos Technology and Robotics Corporation,Ericsson,"423990 Wood products (e.g., chips, posts, shavings, ties) merchant wholesalers",561499 Videoconferencing services,42,56,Wholesale Trade,68623.359,Administrative and Support and Waste Management and Remediation Services,32.71742,-117.162773,California,San Diego,San Diego,06073
12,"San Diego, California, United States","President at Nautilus General Contractors, Inc.",,Northwestern University,Finance and Marketing,Northwestern University,"Nautilus General Contractors, Inc.",,"236116 Residential construction, multifamily, general contractors",,23,,Construction,64648.972,,32.71742,-117.162773,California,San Diego,San Diego,06073
13,"Buffalo, New York, United States",Sr. VP & Chief Information Officer at Catholic Health System,Chief Medical Information Officer at Catholic Health System,Northwestern University,Master of Medical Informatics,Northwestern University,Catholic Health System,Catholic Health System,"621111 Walk-in physicians' offices (e.g., centers, clinics)","621111 Walk-in physicians' offices (e.g., centers, clinics)",62,62,Health Care and Social Assistance,76373.049,Health Care and Social Assistance,42.886717,-78.878392,New York,Erie,Buffalo,36029
14, Chicago ,"Senior Director, Product Management, Hotel, Meetings & Events at CWT","Senior Director, Product Marketing at RoomIt by CWT",1994–1998,Computer Engineering,Northwestern University,CWT,RoomIt by CWT,522320 U.S. Central Credit Union,,52,,Finance and Insurance,80163.492,,41.875562,-87.624421,Illinois,Cook,Chicago,17031
15, Seattle ,Senior Director - CRM/Salesforce at Slalom,Practice Area Lead - CRM/Salesforce at Slalom,Northwestern University,Communication Studies,Northwestern University,Slalom,Slalom,541611 Strategic planning consulting services,541611 Strategic planning consulting services,54,54,"Professional, Scientific, and Technical Services",77645.346,"Professional, Scientific, and Technical Services",47.603832,-122.330062,Washington,King,Seattle,53033
16,San Francisco Bay ,Industry Partnerships  at Coursera,"VP, Marketing & Partnerships at Kanopy",Northwestern University,Design Thinking,Northwestern University,Coursera,Kanopy,"511210 Utility software, computer, packaged","339950 Signs and signboards (except paper, paperboard) manufacturing",51,31-33,Information,73855.595,Manufacturing,37.714029,-122.307794,California,San Mateo,,06081
17,Grand Rapids  ,Director - People Analytics at Allstate,Director - Strategic Workforce Planning at Allstate,Northwestern University,Predictive Analytics,Northwestern University,Allstate,Allstate,525110 Union pension funds,525110 Union pension funds,52,52,Finance and Insurance,80163.492,Finance and Insurance,42.96324,-85.667864,Michigan,Kent,Grand Rapids,26081
18,"New Albany, Ohio, United States","AVP, Procurement, Bath & Body Works at Bath & Body Works","AVP, Procurement Finance, Travel and Events at Limited Brands at L Brands",1990–1994,,Northwestern University,Bath & Body Works,L Brands,"325620 Towelettes, premoistened, manufacturing",446120 Perfume stores,31-33,44-45,Manufacturing,69174.562,Retail Trade,40.081174,-82.808786,Ohio,Franklin,,39049
19,Atlanta  ,President & Managing Director at Energy Assurance LLC,COO & Investor at Freeze Sleeve,1992–1996,Graduated with Honors,Northwestern University,Energy Assurance LLC,Freeze Sleeve,561110 Office management services,,56,,Administrative and Support and Waste Management and Remediation Services,64366.438,,33.748992,-84.390264,Georgia,Fulton,Atlanta,13121
20,"Elmhurst, Illinois, United States",Vice President Sales Planning & Operations at CDW Corporation,Vice President Business Development at CDW Corporation,+ 1 more,Finance & Marketing,Northwestern University,CDW Corporation,CDW Corporation,454110,454110,44-45,44-45,Retail Trade,56013.266,Retail Trade,41.899474,-87.940342,Illinois,DuPage,,17043
21,"Baltimore, Maryland, United States",President at The Center for Healthcare Innovation,Chief Medical Information Officer at GBMC HealthCare,Cleveland Clinic Foundation,Lung Transplantation,Northwestern University,The Center for Healthcare Innovation,GBMC HealthCare,621999 Stop smoking clinics,623110 Skilled nursing facilities,62,62,Health Care and Social Assistance,76373.049,Health Care and Social Assistance,39.290882,-76.610759,Maryland,,Baltimore,24005
22,Los Angeles  ,Corporate Communications Manager at Match Group,Marketing Communications Manager at Osmo,Northwestern University,Journalism,Northwestern University,Match Group,Osmo,812990 Wedding planning services,"423990 Wood products (e.g., chips, posts, shavings, ties) merchant wholesalers",81,42,Other Services (except Public Administration),57824.628,Wholesale Trade,34.053691,-118.242766,California,Los Angeles,Los Angeles,06037
23, Seattle ,Vice President of Global Business Development at PharmaJet,Senior Vice President: Access and Innovation at SightLife,University of Washington,Medical Engineering,Northwestern University,PharmaJet,SightLife,"423450 X-ray machines and parts, medical and dental, merchant wholesalers","541512 Systems integration design services, computer",42,54,Wholesale Trade,68623.359,"Professional, Scientific, and Technical Services",47.603832,-122.330062,Washington,King,Seattle,53033
24, Chicago ,"Vice President at Eckhart, Inc.","General Manager at Autocraft, Inc.",Massachusetts Institute of Technology,Engineering,Northwestern University,"Eckhart, Inc.","Autocraft, Inc.",541611 Strategic planning consulting services,441310 Used automotive parts stores,54,44-45,"Professional, Scientific, and Technical Services",77645.346,Retail Trade,41.875562,-87.624421,Illinois,Cook,Chicago,17031
25,San Francisco Bay ,"Senior Vice President, Corporate Strategy and Business Operations and Chief of Staff to the CEO at Western Digital","Senior Vice President, Business Operations and Strategy for Networking and Security Business at Cisco",Northwestern University - Kellogg School of Management,"Analytical Finance, Marketing, and Accounting",Northwestern University,Western Digital,Cisco,"334112 Tape storage units (e.g., drive backups), computer peripheral equipment, manufacturing","541512 Systems integration design services, computer",31-33,54,Manufacturing,69174.562,"Professional, Scientific, and Technical Services",37.714029,-122.307794,California,San Mateo,,06081
26,Los Angeles  ,Director Of Sustainability at Niagara Bottling,Sustainability Advisor at Independent,Presidio School of Management-San Francisco Bay,Sustainability,Northwestern University,Niagara Bottling,Independent,"312112 Water, naturally carbonated, purifying and bottling",445110 Supermarkets,31-33,44-45,Manufacturing,69174.562,Retail Trade,34.053691,-118.242766,California,Los Angeles,Los Angeles,06037
27,"Los Angeles, California, United States",Vice President of Marketing at Nissin Foods,DIrector of Marketing at Nissin Foods,University of Michigan - Stephen M. Ross School of Business,"Business Administration and Management, General",Northwestern University,Nissin Foods,Nissin Foods,424490 Yeast merchant wholesalers,424490 Yeast merchant wholesalers,42,42,Wholesale Trade,68623.359,Wholesale Trade,34.053691,-118.242766,California,Los Angeles,Los Angeles,06037
28,"Austin, Texas  ",Chief Product Officer  at CipherHealth,Chief Product Officer at RapidDeploy,2005–2007,Finance,Northwestern University,CipherHealth,RapidDeploy,"541511 Web (i.e., Internet) page design services, custom","541511 Web (i.e., Internet) page design services, custom",54,54,"Professional, Scientific, and Technical Services",77645.346,"Professional, Scientific, and Technical Services",30.271129,-97.7437,Texas,Travis,Austin,48453
29,"New York, New York, United States","Director, Data & Analytics at BetterCloud","Senior Manager, Data & Analytics at BetterCloud",2009–2013,"Mathematical Methods in the Social Sciences, Economics",Northwestern University,BetterCloud,BetterCloud,"541511 Web (i.e., Internet) page design services, custom","541511 Web (i.e., Internet) page design services, custom",54,54,"Professional, Scientific, and Technical Services",77645.346,"Professional, Scientific, and Technical Services",40.712728,-74.006015,New York,,New York,36061
30, Chicago ,CEO and Chairman at Agentis,"Cofounder and Board member at Sertifi, Inc.",1984–1989,Engineering,Northwestern University,Agentis,"Sertifi, Inc.","424990 Yarns, industrial, merchant wholesalers","541511 Web (i.e., Internet) page design services, custom",42,54,Wholesale Trade,68623.359,"Professional, Scientific, and Technical Services",41.875562,-87.624421,Illinois,Cook,Chicago,17031
31,Los Angeles  ,Sr Director Product & Data Engineering  at Wabtec Corporation,Sr. Product Manager at GE Transportation,2006–2010,"Industrial Engineering, Economics",Northwestern University,Wabtec Corporation,GE Transportation,336510 Subway cars manufacturing,"541512 Systems integration design services, computer",31-33,54,Manufacturing,69174.562,"Professional, Scientific, and Technical Services",34.053691,-118.242766,California,Los Angeles,Los Angeles,06037
32,"Indianapolis, Indiana, United States","Sr. Director of Channel Management, Omnichannel Marketing Hub at Eli Lilly and Company","Chief Marketing & Communications Officer, Ascension St. Vincent Health at Ascension",Northwestern University,Integrated Marketing Communications,Northwestern University,Eli Lilly and Company,Ascension,325412 Zinc oxide medicinal preparations manufacturing,446110 Pharmacies,31-33,44-45,Manufacturing,69174.562,Retail Trade,39.768333,-86.15835,Indiana,Marion,Indianapolis,18097
33,"Richmond, Virginia, United States","Director, Strategy and Business Development at Altria","Director - Strategy, Consumer & Marketplace Insights at Altria",Northwestern University,,Northwestern University,Altria,Altria,"312130 Wines, cooking, manufacturing","312130 Wines, cooking, manufacturing",31-33,31-33,Manufacturing,69174.562,Manufacturing,37.538509,-77.43428,Virginia,,Richmond,51159
34,"Denver, Colorado, United States",Head of Strategy & Operations at GoCart,"Strategy & Operations Manager - GoCart Venture, Innovation at FIS",Northwestern University,Industrial Engineering and Economics,Northwestern University,GoCart,FIS,999990,"511210 Utility software, computer, packaged",99,51,"Federal, State, and Local Government, excluding state and local schools and hospitals and the U.S. Postal Service (OEWS Designation)",69671.738,Information,39.739236,-104.984862,Colorado,,Denver,08031
36,"Los Angeles, California, United States",VP of Fan Engagement at 300 Entertainment,"Director, Ecommerce Licensing at Jukin Media",Northwestern University,Communication and Media Studies,Northwestern University,300 Entertainment,Jukin Media,"711510 Writers, independent (freelance)",711320 Wrestling event promoters without facilities,71,71,"Arts, Entertainment, and Recreation",51732.192,"Arts, Entertainment, and Recreation",34.053691,-118.242766,California,Los Angeles,Los Angeles,06037
37,"Winston-Salem, North Carolina, United States","SVP Supply Chain, Lab, Imaging & CPO at Atrium Health","Senior Vice President, Business Services at Wake Forest Baptist Health",2004–2006,Communications,Northwestern University,Atrium Health,Wake Forest Baptist Health,621610 Visiting nurse associations,622110 Osteopathic hospitals,62,62,Health Care and Social Assistance,76373.049,Health Care and Social Assistance,36.099813,-80.244052,North Carolina,Forsyth,Winston-Salem,37067
38,New York City  ,Vice President Marketing at Dealpath,"Sr. Director Demand Generation- Interim at VTS, Inc.",Northwestern University - Kellogg School of Management,Marketing & Strategy,Northwestern University,Dealpath,"VTS, Inc.","541512 Systems integration design services, computer",561510 Travel agencies,54,56,"Professional, Scientific, and Technical Services",77645.346,Administrative and Support and Waste Management and Remediation Services,40.712728,-74.006015,New York,,New York,36061
39,"Oakland, California, United States","Vice President, IT Business Information Officer, Chief of Staff to CIO at Kaiser Permanente",Director at Kaiser Permanente,1986–2000,Electrical Engineering,Northwestern University,Kaiser Permanente,Kaiser Permanente,524114 Medical service plans without providing health care services,524114 Medical service plans without providing health care services,52,52,Finance and Insurance,80163.492,Finance and Insurance,37.804456,-122.271356,California,Alameda,Oakland,06001
40,"New York, New York, United States",Head of Ad Marketing at Roku Inc.,"Head of Marketing, Adaptly at Accenture",Northwestern University,Communication Studies,Northwestern University,Roku Inc.,Accenture,512120 Television show syndicators,541330 Traffic engineering consulting services,51,54,Information,73855.595,"Professional, Scientific, and Technical Services",40.712728,-74.006015,New York,,New York,36061
42,"Phoenix, Arizona, United States","Vice President, Product Marketing & Strategy at Noodle","Senior Vice President, Product and Portfolio Strategy at HotChalk, Inc.",University of Arizona - Eller College of Management,Business Administration,Northwestern University,Noodle,"HotChalk, Inc.",311211 Wheat germ manufacturing,"611699 Yoga instruction, camps, or schools",31-33,61,Manufacturing,69174.562,Educational Services,33.448437,-112.074142,Arizona,Maricopa,Phoenix,04013
43, Chicago ,"Vice President Operations at Silva International, Inc.","Director Of Operations at Silva International, Inc.",Purdue University,Fisheries and Aquatic Science,Northwestern University,"Silva International, Inc.","Silva International, Inc.",424490 Yeast merchant wholesalers,424490 Yeast merchant wholesalers,42,42,Wholesale Trade,68623.359,Wholesale Trade,41.875562,-87.624421,Illinois,Cook,Chicago,17031
44, Boston,"VP, Operations at Ginkgo Bioworks, Inc.",Senior Fellow at New Politics,Harvard Business School,"Economics, History",Northwestern University,"Ginkgo Bioworks, Inc.",New Politics,325414 Virus vaccines manufacturing,,31-33,,Manufacturing,69174.562,,42.360253,-71.058291,Massachusetts,Suffolk,Boston,25025
45,"Pleasant Prairie, Wisconsin, United States",Director of Corporate Purchasing at Uline,Director of Operations at Shorr Packaging,Northwestern University,,Northwestern University,Uline,Shorr Packaging,424130 Wrapping paper (except giftwrap) merchant wholesalers,,42,,Wholesale Trade,68623.359,,42.526972,-87.854457,Wisconsin,Kenosha,,55059
46,"Wayzata, Minnesota, United States","President & COO, Optum at UnitedHealth Group","Chief Executive Officer, OptumRx at UnitedHealth Group",Northwestern University - Kellogg School of Management,,Northwestern University,UnitedHealth Group,UnitedHealth Group,"621111 Walk-in physicians' offices (e.g., centers, clinics)","621111 Walk-in physicians' offices (e.g., centers, clinics)",62,62,Health Care and Social Assistance,76373.049,Health Care and Social Assistance,44.970759,-93.511947,Minnesota,Hennepin,,27053
47,"San Francisco, California, United States",Director of Global Privacy Operations at Facebook,Privacy and Data Security Counsel at Stripe,Columbia University School of Law,,Northwestern University,Facebook,Stripe,"541512 Systems integration design services, computer","523991 Trust companies, nondepository",54,52,"Professional, Scientific, and Technical Services",77645.346,Finance and Insurance,37.779026,-122.419906,California,,San Francisco,06075
48,"Glencoe, Illinois, United States",Senior Director of Growth at NOCD,"Director, Strategy at SMS Assist, L.L.C.",DePaul University,Accounting and Finance,Northwestern University,NOCD,"SMS Assist, L.L.C.","621111 Walk-in physicians' offices (e.g., centers, clinics)",561720 Window cleaning services,62,56,Health Care and Social Assistance,76373.049,Administrative and Support and Waste Management and Remediation Services,42.135027,-87.758119,Illinois,Cook,,17031
49, Chicago ,Chief Revenue Officer (CRO) at GoodData,Vice President Enterprise Sales at Salesforce,1994–1999,Industrial Engineering,Northwestern University,GoodData,Salesforce,"611699 Yoga instruction, camps, or schools","541511 Web (i.e., Internet) page design services, custom",61,54,Educational Services,67390.465,"Professional, Scientific, and Technical Services",41.875562,-87.624421,Illinois,Cook,Chicago,17031
52,"San Francisco, California, United States",Senior Vice President of Strategy at Alteryx,Chief Product Officer at ClearStory Data,Stanford University,Management Science and Engineering,Northwestern University,Alteryx,ClearStory Data,"511210 Utility software, computer, packaged","511210 Utility software, computer, packaged",51,51,Information,73855.595,Information,37.779026,-122.419906,California,,San Francisco,06075
53,"Austin, Texas, United States",Head of Global Technology Communications at Wayfair,Director Of Communications And Public Relations at Indeed.com,Northwestern University,,Northwestern University,Wayfair,Indeed.com,454110,,44-45,,Retail Trade,56013.266,,30.271129,-97.7437,Texas,Travis,Austin,48453
54,"Los Angeles, California, United States",Chief Development Officer / Head of Corporate Development and M&A at System1,"Head of Video and Distribution Partnerships, Senior Director at Yahoo! Inc.",Northwestern University,Political Science,Northwestern University,System1,Yahoo! Inc.,"541910 Sampling services, statistical",999990,54,99,"Professional, Scientific, and Technical Services",77645.346,"Federal, State, and Local Government, excluding state and local schools and hospitals and the U.S. Postal Service (OEWS Designation)",34.053691,-118.242766,California,Los Angeles,Los Angeles,06037
55, Phoenix ,"Executive Vice President at McCarthy Building Companies, Inc.","Senior Vice President at McCarthy Building Companies, Inc.",Northwestern University,Business,Northwestern University,"McCarthy Building Companies, Inc.","McCarthy Building Companies, Inc.",236210 Waste disposal plant (except sewage treatment) construction,236210 Waste disposal plant (except sewage treatment) construction,23,23,Construction,64648.972,Construction,33.448437,-112.074142,Arizona,Maricopa,Phoenix,04013
56,San Francisco Bay ,Director of Business Operations and Strategy at Imprint,Commercial Manager at Venmo,Northwestern University,Learning & Organizational Change,Northwestern University,Imprint,Venmo,"322299 Trays, food, molded pulp, manufacturing",522298 Short-term inventory credit lending,31-33,52,Manufacturing,69174.562,Finance and Insurance,37.714029,-122.307794,California,San Mateo,,06081
57,New York City  ,Senior Site Optimization Associate at UrbanStems,Ecommerce Analyst at Burt's Bees Baby,Northwestern University,Integrated Marketing Communications,Northwestern University,UrbanStems,Burt's Bees Baby,454110,,44-45,,Retail Trade,56013.266,,40.712728,-74.006015,New York,,New York,36061
58, Chicago ,Head of Data & Analytics at Harris Associates,Head of Front Office Technology at Harris Associates,University of Chicago,Computer Science,Northwestern University,Harris Associates,Harris Associates,"523930 Investment advisory services, customized, fees paid by client","523930 Investment advisory services, customized, fees paid by client",52,52,Finance and Insurance,80163.492,Finance and Insurance,41.875562,-87.624421,Illinois,Cook,Chicago,17031
59,"New York, New York, United States","Executive Director, Brand Marketing at The New York Times",Executive Strategy Director at The New York Times,Northwestern University,Communication Studies and Sociology,Northwestern University,The New York Times,The New York Times,515120 Television broadcasting stations,515120 Television broadcasting stations,51,51,Information,73855.595,Information,40.712728,-74.006015,New York,,New York,36061
60,"Miami, Florida, United States","Director, Strategy & Market Insights at Scopely","Sr. Manager, Corporate Development at Scopely",Northwestern University - Kellogg School of Management,"Marketing, Finance, and Management & Organizations",Northwestern University,Scopely,Scopely,"511210 Utility software, computer, packaged","511210 Utility software, computer, packaged",51,51,Information,73855.595,Information,25.774173,-80.19362,Florida,Miami-Dade,Miami,12086
61,New York City  ,Product Director at Instacart,"Product Director at Harry's, Inc.",NYU Stern,History and Political Science,Northwestern University,Instacart,"Harry's, Inc.",999990,446110 Pharmacies,99,44-45,"Federal, State, and Local Government, excluding state and local schools and hospitals and the U.S. Postal Service (OEWS Designation)",69671.738,Retail Trade,40.712728,-74.006015,New York,,New York,36061
62,"Miami, Florida, United States",President of Owner Services at Aegis Project Controls,Director of Owners Rep Services at Aegis Project Controls,Tufts University,History,Northwestern University,Aegis Project Controls,Aegis Project Controls,541330 Traffic engineering consulting services,541330 Traffic engineering consulting services,54,54,"Professional, Scientific, and Technical Services",77645.346,"Professional, Scientific, and Technical Services",25.774173,-80.19362,Florida,Miami-Dade,Miami,12086
