current_location,current_work,previous_work,latest_Education,major,search_school,current_company,previous_company,current_company_industry,previous_company_industry,current_NAICS,previous_NAICS,current_NAICS_title,current_avg_salary,previous_NAICS_title,latitude,longitude,state,county,city,fips
"Los Angeles, California, United States","Co-Founder at Black Yeti Beverage, Inc.",Chief Brand Officer & Neuromodulation Director  at Mind & Body Treatment and Research Institute,2020–Present,Clinical Psychology,"University of California, Riverside","Black Yeti Beverage, Inc.",Mind & Body Treatment and Research Institute,,,,,,,,34.053691,-118.242766,California,Los Angeles,Los Angeles,06037
"Newport Beach, California, United States",CEO at US Business Funding,"Director of app only division / Small ticket Equipment leasing & Financing at Global Finance Group, Inc.","University of California, Riverside",,"University of California, Riverside",US Business Funding,"Global Finance Group, Inc.",541618 Utilities management consulting services,522320 U.S. Central Credit Union,54,52,"Professional, Scientific, and Technical Services",77645.346,Finance and Insurance,33.617009,-117.92944,California,Orange,Newport Beach,06059
"San Francisco, California, United States","CEO at Empiric, Inc.",Sales at DAQRI,ArtCenter College of Design,Product Design,"University of California, Riverside","Empiric, Inc.",DAQRI,621999 Stop smoking clinics,"541511 Web (i.e., Internet) page design services, custom",62,54,Health Care and Social Assistance,76373.049,"Professional, Scientific, and Technical Services",37.779026,-122.419906,California,,San Francisco,06075
"Allen, Texas, United States",Co-Founder at TitaniusBots,Customer Representative & Sales II at Bank of America,"University of California, Riverside",Multi/Interdisciplinary Studies,"University of California, Riverside",TitaniusBots,Bank of America,,522110 State commercial banks,,52,,,Finance and Insurance,33.103174,-96.67055,Texas,Collin,,48085
"Coppell, Texas, United States",Chief Executive Officer at Kings III Emergency Communications,"President at SoloProtect, A Division of Kings III Emergency Communications",University of Califonia Riverside,Mathmatics,"University of California, Riverside",Kings III Emergency Communications,"SoloProtect, A Division of Kings III Emergency Communications",,,,,,,,32.95526,-97.01557,Texas,Dallas,,48113
"El Segundo, California, United States",Chief Executive Officer at ONYX Motorbikes,Prototyping | Design Technologist | Software Development Engineer  at Amazon Lab126,"University of California, Riverside",Arts,"University of California, Riverside",ONYX Motorbikes,Amazon Lab126,,,,,,,,33.917028,-118.415634,California,Los Angeles,,06037
"Olympia, Washington, United States",Founder and CEO at Townsend Security,Senior Consultant at Patrick Townsend & Associates,"University of California, Riverside","Sociology, Education","University of California, Riverside",Townsend Security,Patrick Townsend & Associates,443142 Video tape stores,,44-45,,Retail Trade,56013.266,,47.045102,-122.895008,Washington,Thurston,Olympia,53067
Los Angeles  ,Founder & CEO at KATSH DIGITAL ID,Co-Founder at LifeNow.TV,"University of California, Riverside","Product Fit and Market Research, I-Corps Program","University of California, Riverside",KATSH DIGITAL ID,LifeNow.TV,,,,,,,,34.053691,-118.242766,California,Los Angeles,Los Angeles,06037
San Francisco Bay ,Head Of Information Technology at Guardant Health,Head Of Information Technology at Credit Karma,"University of California, Riverside",Computer Science,"University of California, Riverside",Guardant Health,Credit Karma,621511 Urinalysis laboratories,522320 U.S. Central Credit Union,62,52,Health Care and Social Assistance,76373.049,Finance and Insurance,37.714029,-122.307794,California,San Mateo,,06081
"Santa Monica, California, United States",Chief Executive Officer at RadiaBeam Technologies,Accelerator Engineer at SureBeam Corporation,"University of California, Los Angeles",Physics,"University of California, Riverside",RadiaBeam Technologies,SureBeam Corporation,443142 Video tape stores,,44-45,,Retail Trade,56013.266,,34.01947,-118.491227,California,Los Angeles,Santa Monica,06037
"Los Angeles, California, United States",Supply Chain Manager at VS Tees,Business Consultant at 7-Eleven,University of Southern California - Marshall School of Business,Economics,"University of California, Riverside",VS Tees,7-Eleven,,533110 Trademark licensing,,53,,,Real Estate and Rental and Leasing,34.053691,-118.242766,California,Los Angeles,Los Angeles,06037
,CEO at Krishnan & Associates,Senior Accountant at General Electric (GE),"University of California, Riverside",Business,"University of California, Riverside",Krishnan & Associates,General Electric (GE),,,,,,,,,,,,,nan
"New York, New York, United States",CEO at Runit Systems,"Co-Founder, President & CEO at Hyrian [An award winning, leading national provider of Recruitment Outsourcing services]",1987–1991,Political Science and Administrative Studies (Business Administration),"University of California, Riverside",Runit Systems,"Hyrian [An award winning, leading national provider of Recruitment Outsourcing services]",,,,,,,,40.712728,-74.006015,New York,,New York,36061
San Francisco Bay ,Vice President Digital Transformation - Technology Group at QuEST Global,Assc. Managing Director -Technology Group at Accenture,"University of California, Riverside",Political Science,"University of California, Riverside",QuEST Global,Accenture,551112 Public utility holding companies,541330 Traffic engineering consulting services,55,54,Management of Companies and Enterprises,82055.219,"Professional, Scientific, and Technical Services",37.714029,-122.307794,California,San Mateo,,06081
 Paris  ,Co-Founder at Yuccan Lead,Information Technology Infrastructure Engineer at CMS Francis Lefebvre Avocats,"University of California, Riverside",Business Management,"University of California, Riverside",Yuccan Lead,CMS Francis Lefebvre Avocats,,541110 Tax law attorneys' private practices,,54,,,"Professional, Scientific, and Technical Services",48.85889,2.320041,Île-de-France,Paris,,nan
"San Francisco, California, United States",Co-Founder & CTO at CloudTrucks,Senior Engineering Manager at Lob,"University of California, Riverside",Computer Science,"University of California, Riverside",CloudTrucks,Lob,,"454310 Liquefied petroleum gas (LPG) dealers, direct selling",,44-45,,,Retail Trade,37.779026,-122.419906,California,,San Francisco,06075
"Greystones, County Wicklow, Ireland",Digital strategy manager at CRH,IT Group services Manager at CRH,Trinity College Dublin,"Business Administration and Management, General","University of California, Riverside",CRH,CRH,561499 Videoconferencing services,561499 Videoconferencing services,56,56,Administrative and Support and Waste Management and Remediation Services,64366.438,Administrative and Support and Waste Management and Remediation Services,53.14489,-6.063218,,County,,nan
"Pune, Maharashtra, India",Co-Founder and CEO at Sensing Self Pte Ltd,Founder and CEO at Swipe Technologies Pvt Ltd,"University of California, Riverside","Bio-Nanotechnology, BioScience, Molecular Diagnostics","University of California, Riverside",Sensing Self Pte Ltd,Swipe Technologies Pvt Ltd,,,,,,,,18.521428,73.854454,Maharashtra,Pune,Pune,nan
"Orange County, California, United States",Director Of Operations at Alleyoop,Retail Compliance Manager - North America at DSV - Global Transport and Logistics,"University of California, Irvine - The Paul Merage School of Business","Logistics, Materials, and Supply Chain Management & Operations","University of California, Riverside",Alleyoop,DSV - Global Transport and Logistics,,,,,,,,33.750038,-117.870493,California,Orange,,06059
 Madrid  ,Co-Founder at Trucksters,Consultant at BTS,IE University,,"University of California, Riverside",Trucksters,BTS,,485999 Vanpool operation,,48-49,,,Transportation and Warehousing,40.416705,-3.703582,Comunidad de Madrid,Área metropolitana de Madrid y Corredor del,Madrid,nan
"Los Angeles, California, United States",Chief Operations Officer at Company 3,"Senior Vice President, Global Business Operations at Deluxe Entertainment Services Group",2001–2003,Emphasis Finance,"University of California, Riverside",Company 3,Deluxe Entertainment Services Group,561110 Office management services,"541840 Television advertising representatives (i.e., independent of media owners)",56,54,Administrative and Support and Waste Management and Remediation Services,64366.438,"Professional, Scientific, and Technical Services",34.053691,-118.242766,California,Los Angeles,Los Angeles,06037
"Riverside, California, United States","Co-Founder at Brand Purpose, LLC","Instructor, Marketing and Business Writing at University of Redlands","University of California, Riverside",Liberal Studies (Chemistry and Psychology),"University of California, Riverside","Brand Purpose, LLC",University of Redlands,,611310 Universities,,61,,,Educational Services,33.945941,-117.410244,California,Riverside,Riverside,06065
"Belo Horizonte, Minas Gerais, Brazil",CEO at MIP CONSTRUTORA,Board Member at MIP ENGENHARIA S/A,IBGC - Instituto Brasileiro de Governança Corporativa,Corporate Governance,"University of California, Riverside",MIP CONSTRUTORA,MIP ENGENHARIA S/A,,,,,,,,-19.922732,-43.945095,Minas Gerais,Região Metropolitana de Belo,Belo Horizonte,nan
"Münster, North Rhine-Westphalia, Germany",Founder & COO at BitBurst GmbH,Dualer Student at Saint-Gobain Weber,FOM Hochschule für Oekonomie & Management,Master Business Consulting & Digital Management (MS),"University of California, Riverside",BitBurst GmbH,Saint-Gobain Weber,,"327390 Ties, concrete, railroad, manufacturing",,31-33,,,Manufacturing,51.96251,7.625188,Nordrhein-Westfalen,,Münster,nan
"Los Angeles, California, United States",Co-Founder at Stealth Startup,Sales Executive at NEXT Trucking,"University of California, Riverside",Psychology,"University of California, Riverside",Stealth Startup,NEXT Trucking,,"493110 Warehousing and storage, general merchandise",,48-49,,,Transportation and Warehousing,34.053691,-118.242766,California,Los Angeles,Los Angeles,06037
"Downey, California, United States",Executive Vice President Of Operations at TBD,Vice President of operations at FiveStar Gourmet Foods,"University of California, Riverside",6 sigma - Black Belt,"University of California, Riverside",TBD,FiveStar Gourmet Foods,541380 X-ray inspection services,,54,,"Professional, Scientific, and Technical Services",77645.346,,33.942215,-118.123565,California,Los Angeles,Downey,06037
"Santa Monica, California, United States",Director of E-Commerce at JAXXON,Digital Asset Management Coordinator at RPA,General Assembly,UX Design,"University of California, Riverside",JAXXON,RPA,,"221118 Power generation, tidal electric",,22,,,Utilities,34.01947,-118.491227,California,Los Angeles,Santa Monica,06037
"Newport Beach, California, United States",President & CEO at Vino Vault LLC,Founder/Business Unit Leader at Iron Mountain Entertainment Services,"University of California, Riverside",International Business,"University of California, Riverside",Vino Vault LLC,Iron Mountain Entertainment Services,,,,,,,,33.617009,-117.92944,California,Orange,Newport Beach,06059
Los Angeles  ,Chief Operating Officer at IT Retail,Product Manager at IT Retail,"University of California, Riverside",Marketing,"University of California, Riverside",IT Retail,IT Retail,,,,,,,,34.053691,-118.242766,California,Los Angeles,Los Angeles,06037
 Chicago ,"VP, Chief Marketing Officer at DemandTec by Acoustic",Chief Marketing Officer at GrocerKey,1997–2001,Political Science,"University of California, Riverside",DemandTec by Acoustic,GrocerKey,,,,,,,,41.875562,-87.624421,Illinois,Cook,Chicago,17031
"Riverside, California, United States",Vice President of Operations/Chief Operating Officer at Riverside Community Health Foundation,Health Care Social Worker at Riverside County Department of Public Health,California Baptist University,Sociology/Ethnic Studies Joint Major,"University of California, Riverside",Riverside Community Health Foundation,Riverside County Department of Public Health,523910 Viatical settlement companies,,52,,Finance and Insurance,80163.492,,33.945941,-117.410244,California,Riverside,Riverside,06065
"Los Angeles, California, United States",Co-Founder at Infura,Director of Site Reliability Engineering at KEYPR,Education (same page),Computer Science,"University of California, Riverside",Infura,KEYPR,,,,,,,,34.053691,-118.242766,California,Los Angeles,Los Angeles,06037
Los Angeles  ,CEO / Director of Additive Testing at ASTRO Mechanical Testing Laboratory,"Associate Professor of Engineering, Computer Science & Technology at California State University, Los Angeles",University of Southern California,Astronautical Engineering,"University of California, Riverside",ASTRO Mechanical Testing Laboratory,"California State University, Los Angeles",,"923110 University regents or boards, government",,92,,,,34.053691,-118.242766,California,Los Angeles,Los Angeles,06037
"San Diego, California, United States",Chairman and CEO at ECG Management Consultants,Director at Sharp HealthCare,1995–1997,Economics,"University of California, Riverside",ECG Management Consultants,Sharp HealthCare,,524114 Medical service plans without providing health care services,,52,,,Finance and Insurance,32.71742,-117.162773,California,San Diego,San Diego,06073
"Los Angeles, California, United States",Co-Founder at Zentap,Chief Marketing Officer at Zentap,Yellow,Strategie d'Entreprise,"University of California, Riverside",Zentap,Zentap,,,,,,,,34.053691,-118.242766,California,Los Angeles,Los Angeles,06037
Los Angeles  ,Chief Sales Officer (CSO) at Hawaiian Host Group,Senior Vice President Of Sales at Hawaiian Host Group,"Pepperdine University, The George L. Graziadio School of Business and Management",Environmental Engineering,"University of California, Riverside",Hawaiian Host Group,Hawaiian Host Group,,,,,,,,34.053691,-118.242766,California,Los Angeles,Los Angeles,06037
"Anaheim, California, United States",Director of Marketing at Texas Ballet Theater,Mentor at M ACCELERATOR,1998–2000,Organization/Strategy,"University of California, Riverside",Texas Ballet Theater,M ACCELERATOR,611610 Voice instruction,541810 Advertising agency consulting services,61,54,Educational Services,67390.465,"Professional, Scientific, and Technical Services",33.834752,-117.911732,California,Orange,Anaheim,06059
"Orange County, California, United States",Global Digital Marketing Project Manager at Moxa,"Internet and E-Commerce Specialist at Moxa Americas, Inc.",2007,Business Administration,"University of California, Riverside",Moxa,"Moxa Americas, Inc.","423430 Software, computer, packaged, merchant wholesalers","334118 Terminals, computer, manufacturing",42,31-33,Wholesale Trade,68623.359,Manufacturing,33.750038,-117.870493,California,Orange,,06059
"Los Angeles, California, United States",CFO at SKIMS,Private Equity CFO at Private Equity,University of Southern California,Theology/Theological Studies,"University of California, Riverside",SKIMS,Private Equity,,"621111 Walk-in physicians' offices (e.g., centers, clinics)",,62,,,Health Care and Social Assistance,34.053691,-118.242766,California,Los Angeles,Los Angeles,06037
 Sydney ,Head of Digital Analytics & Optimisation at Coles,"Senior Manager, Insights & Analytics at Woolworths Supermarkets",Universidad Rey Juan Carlos,"Business Administration, Bilingual","University of California, Riverside",Coles,Woolworths Supermarkets,561499 Videoconferencing services,,56,,Administrative and Support and Waste Management and Remediation Services,64366.438,,-33.854816,151.216454,New South Wales,,Sydney,nan
Los Angeles  ,Founding Engineer at Cleanlab,"Senior Director, Data Science & AI/ML at DIRECTV",Georgia Institute of Technology,Computer Science,"University of California, Riverside",Cleanlab,DIRECTV,,517312,,51,,,Information,34.053691,-118.242766,California,Los Angeles,Los Angeles,06037
"San Mateo, California, United States",Chief Information Security Officer - CISO at Coupa Software,VP of Infrastructure & CISO (various roles) at SurveyMonkey,UC Riverside,Business Administration,"University of California, Riverside",Coupa Software,SurveyMonkey,"511210 Utility software, computer, packaged",541110 Tax law attorneys' private practices,51,54,Information,73855.595,"Professional, Scientific, and Technical Services",37.496904,-122.333057,California,San Mateo,,06081
Memphis  ,Continuous Improvement Manager at Hunter Fan Company,"Technical Manager - Engineering, Quality Assurance, Extrusion & Thermoforming at A.L.P. Lighting Components",Carnegie Mellon University,Physics - Measurement & Control,"University of California, Riverside",Hunter Fan Company,A.L.P. Lighting Components,"335121 Yard Lights, residential electric, manufacturing",,31-33,,Manufacturing,69174.562,,35.133502,-89.966876,Tennessee,Shelby,Memphis,47157
"New York, New York, United States",Founder and CEO at Hairtelligence,MBA Intern at Seafair,The Wharton School,"Business Administration, Arts Management","University of California, Riverside",Hairtelligence,Seafair,,541820 Public relations services,,54,,,"Professional, Scientific, and Technical Services",40.712728,-74.006015,New York,,New York,36061
Los Angeles  ,"President at Accelerated Logistics LLC, AMAZON DSP",,University of Southern California,"Business Administration and Management, General","University of California, Riverside","Accelerated Logistics LLC, AMAZON DSP",,,,,,,,,34.053691,-118.242766,California,Los Angeles,Los Angeles,06037
Los Angeles  ,Head of Business Development at Shopmonkey,"Senior Director, Business Development & Partner Management at LegalZoom","University of California, Riverside",American History (United States),"University of California, Riverside",Shopmonkey,LegalZoom,541618 Utilities management consulting services,551112 Public utility holding companies,54,55,"Professional, Scientific, and Technical Services",77645.346,Management of Companies and Enterprises,34.053691,-118.242766,California,Los Angeles,Los Angeles,06037
San Francisco Bay ,"Senior Manager, Global Campaign Strategy and Integrated Marketing  at Splunk","Senior Manager, Competitive Campaign Marketing at Adobe","University of California, Riverside",focus on marketing,"University of California, Riverside",Splunk,Adobe,"511210 Utility software, computer, packaged","511210 Utility software, computer, packaged",51,51,Information,73855.595,Information,37.714029,-122.307794,California,San Mateo,,06081
"Boulder, Colorado, United States",Vice President Of Retail at Fjällräven North America,GM of Retail Operations at Rip Curl,University of Arizona,"Business Administration and Management, General","University of California, Riverside",Fjällräven North America,Rip Curl,,"451110 Uniform stores, athletic",,44-45,,,Retail Trade,40.014986,-105.270545,Colorado,Boulder,Boulder,08013
"Rancho Mirage, California, United States",Senior Director and Chief Medical Information Officer at Cerner Corporation,Physician Executive at Cerner Corporation,David Geffen School of Medicine at UCLA,Medicine,"University of California, Riverside",Cerner Corporation,Cerner Corporation,"541512 Systems integration design services, computer","541512 Systems integration design services, computer",54,54,"Professional, Scientific, and Technical Services",77645.346,"Professional, Scientific, and Technical Services",33.770859,-116.426874,California,Riverside,,06065
,"Web Team Manager, Web Developer at Sega of America, Inc.",Art Director at Darick Publishing,LearningFuze,Accelerated Web Development Course,"University of California, Riverside","Sega of America, Inc.",Darick Publishing,"423920 Vehicles, children's (except bicycles), merchant wholesalers",,42,,Wholesale Trade,68623.359,,,,,,,nan
"Santa Monica, California, United States",VP of Product at TigerConnect,"Sr. Director, Product Management at TigerConnect",Columbia University in the City of New York,Strategic Communications,"University of California, Riverside",TigerConnect,TigerConnect,"541519 Software installation services, computer","541519 Software installation services, computer",54,54,"Professional, Scientific, and Technical Services",77645.346,"Professional, Scientific, and Technical Services",34.01947,-118.491227,California,Los Angeles,Santa Monica,06037
"Kirkland, Washington, United States",Senior Global Brand Marketing Manager at Wizards of the Coast,Global Brand Marketing Manager Magic The Gathering at Wizards of the Coast,California State University-San Bernardino,"Marketing/Marketing Management, General","University of California, Riverside",Wizards of the Coast,Wizards of the Coast,"541511 Web (i.e., Internet) page design services, custom","541511 Web (i.e., Internet) page design services, custom",54,54,"Professional, Scientific, and Technical Services",77645.346,"Professional, Scientific, and Technical Services",47.685957,-122.192025,Washington,King,,53033
"San Jose, California, United States",Engineering Director at KLA,"Manager, Principal Optics Engineer at KLA",University of Arizona,Optical Sciences,"University of California, Riverside",KLA,KLA,"811219 Weighing equipment (e.g., balance, scales) repair and maintenance services","811219 Weighing equipment (e.g., balance, scales) repair and maintenance services",81,81,Other Services (except Public Administration),57824.628,Other Services (except Public Administration),37.33619,-121.890583,California,Santa Clara,San Jose,06085
Los Angeles  ,Sr. Director of Sales & Marketing at iBUYPOWER,Director of Sales & Marketing at iBUYPOWER,"University of California, Riverside","Business Administration and Management, General","University of California, Riverside",iBUYPOWER,iBUYPOWER,,,,,,,,34.053691,-118.242766,California,Los Angeles,Los Angeles,06037
"New York, New York, United States","Head of Partnerships, Lean In at Sheryl Sandberg & Dave Goldberg Family Foundation","Senior Director, Global Corporate Partnerships at Global Citizen",New York University,Liberal Arts and Sciences/Liberal Studies,"University of California, Riverside",Sheryl Sandberg & Dave Goldberg Family Foundation,Global Citizen,,"611710 Testing services, educational",,61,,,Educational Services,40.712728,-74.006015,New York,,New York,36061
"Los Angeles, California, United States",Owner and Founder at Andrews Family Law & Mediation Offices,"Co-Owner and Founding Partner at Jubelt & Andrews, A Professional Corporation",UC Davis,Law,"University of California, Riverside",Andrews Family Law & Mediation Offices,"Jubelt & Andrews, A Professional Corporation",,,,,,,,34.053691,-118.242766,California,Los Angeles,Los Angeles,06037
"Los Angeles, California, United States",Procurement Coordinator at Ruggable,Procurement Specialist at FastXchange Inc.,"University of California, Riverside",Economics / Administrative Studies,"University of California, Riverside",Ruggable,FastXchange Inc.,"314110 Weaving rugs, carpets, and mats","541512 Systems integration design services, computer",31-33,54,Manufacturing,69174.562,"Professional, Scientific, and Technical Services",34.053691,-118.242766,California,Los Angeles,Los Angeles,06037
"Mechanicsville, Virginia, United States",Director of Planning and Purchasing at CarrierEnterprise,Operation Manager at Invensys Controls,"University of California, Riverside",CPIM  CPM,"University of California, Riverside",CarrierEnterprise,Invensys Controls,,,,,,,,37.627692,-77.353813,Virginia,Hanover,,51085
"Columbus, Ohio  ",Sr Sourcing Manager at ascena,Sourcing Manager at ascena,2006–2007,Product Development,"University of California, Riverside",ascena,ascena,424330 Women's clothing merchant wholesalers,424330 Women's clothing merchant wholesalers,42,42,Wholesale Trade,68623.359,Wholesale Trade,39.96226,-83.000706,Ohio,Franklin,Columbus,39049
 Boston,Research Scientist II at Novartis Institutes for BioMedical Research (NIBR),Research Scientist I at Novartis Institutes for BioMedical Research (NIBR),Harvard Extension School,Bioengineering: Biotechnology,"University of California, Riverside",Novartis Institutes for BioMedical Research (NIBR),Novartis Institutes for BioMedical Research (NIBR),,,,,,,,42.360253,-71.058291,Massachusetts,Suffolk,Boston,25025
Los Angeles  ,Global Marketing Technology Program Manager at Apple,"Marketing Analytics Manager, Apple TV app at Apple","University of California, Riverside",Business Administration,"University of California, Riverside",Apple,Apple,"511210 Utility software, computer, packaged","511210 Utility software, computer, packaged",51,51,Information,73855.595,Information,34.053691,-118.242766,California,Los Angeles,Los Angeles,06037
"San Francisco, California, United States",Head of Sales Compensation at Fast,Head of Sales Compensation at Gusto,2008–2010,"Economics, Administrative Studies; Finance & Management Information Systems","University of California, Riverside",Fast,Gusto,517311,999990,51,99,Information,73855.595,"Federal, State, and Local Government, excluding state and local schools and hospitals and the U.S. Postal Service (OEWS Designation)",37.779026,-122.419906,California,,San Francisco,06075
"Los Angeles, California, United States",Member at Chief,"Sr. Principal Client Partner, Key Accounts at TripAdvisor",2000–2004,Management Information Systems,"University of California, Riverside",Chief,TripAdvisor,561499 Videoconferencing services,518210 Web hosting,56,51,Administrative and Support and Waste Management and Remediation Services,64366.438,Information,34.053691,-118.242766,California,Los Angeles,Los Angeles,06037
