current_location,current_work,previous_work,latest_Education,major,search_school,current_company,previous_company,current_company_industry,previous_company_industry,current_NAICS,previous_NAICS,current_NAICS_title,current_avg_salary,previous_NAICS_title,latitude,longitude,state,county,city,fips
"Fullerton, California, United States","Vice President for Information Technology / CIO at California State University, Fullerton",,KTH Royal Institute of Technology,Industrial Economic and Management,"University of California, Riverside","California State University, Fullerton",,611310 Universities,,61,,Educational Services,67390.465,,33.873938,-117.92434,California,Orange,,06059
"Danville, California, United States",Co-Founder at LGS Supplements,CEO and President at Algo Trading Inc.,"University of California, Berkeley",Health/Health Care Administration/Management,"University of California, Riverside",LGS Supplements,Algo Trading Inc.,,523120 Stock options brokerages,,52,,,Finance and Insurance,37.821593,-121.99996,California,Contra Costa,,06013
"Anaheim, California, United States","Director Of Information Technology at Mattel, Inc.","Senior Manager IT at Mattel, Inc.",1994–1996,"Marketing, Finance","University of California, Riverside","Mattel, Inc.","Mattel, Inc.","339930 Walkers, baby (vehicles), manufacturing","339930 Walkers, baby (vehicles), manufacturing",31-33,31-33,Manufacturing,69174.562,Manufacturing,33.834752,-117.911732,California,Orange,Anaheim,06059
"Portland, Oregon  ",Director Data Science at Nike,Senior Director Measurement Science at The Nielsen Company,Stanford University,Finance (PhD candidate) and Statistics,"University of California, Riverside",Nike,The Nielsen Company,"315240 Windbreakers, women's, girls', and infants', cut and sewn from purchased fabric (except apparel contractors)",523910 Viatical settlement companies,31-33,52,Manufacturing,69174.562,Finance and Insurance,45.520247,-122.674195,Oregon,Multnomah,Portland,41051
"Berkeley, California, United States",Chief Sustainability Officer at Coatue Management,Operating Partner - Sustainability at NextWorld Evergreen,"University of California, Riverside",Environmental Toxicology,"University of California, Riverside",Coatue Management,NextWorld Evergreen,561110 Office management services,,56,,Administrative and Support and Waste Management and Remediation Services,64366.438,,37.87535,-122.239634,California,Alameda,Berkeley,06001
"San Jose, California, United States","Chief Technology Officer at Dasher Technologies, A Converge Company",Sr. Account Executive at Dasher Technologies,"University of California, Riverside",Computer Science,"University of California, Riverside","Dasher Technologies, A Converge Company",Dasher Technologies,,"541511 Web (i.e., Internet) page design services, custom",,54,,,"Professional, Scientific, and Technical Services",37.33619,-121.890583,California,Santa Clara,San Jose,06085
"Grand Est, France",CEO & Founder at Winalist,Freelance Designer at Nicolas Manfredini - Webdesign & Creation,EBS Paris - European Business School,"International Business, Marketing, Advertizing","University of California, Riverside",Winalist,Nicolas Manfredini - Webdesign & Creation,,,,,,,,48.484516,6.113035,Grand Est,,,nan
"Marietta, Georgia, United States",Executive Vice President Of Operations at Nationwide Marketing Group,SVP Digital & Technology at Nationwide Marketing Group,"University of California, Riverside",Business,"University of California, Riverside",Nationwide Marketing Group,Nationwide Marketing Group,"423620 Video cameras, household-type, merchant wholesalers","423620 Video cameras, household-type, merchant wholesalers",42,42,Wholesale Trade,68623.359,Wholesale Trade,33.952847,-84.549615,Georgia,Cobb,Marietta,13067
,Digital Content Marketing Specialist at Korean Air,"Digital Marketing Coordinator at Dental Evolutions, Inc.","University of California, Riverside",Psychology,"University of California, Riverside",Korean Air,"Dental Evolutions, Inc.",481111 Scheduled air passenger transportation,,48-49,,Transportation and Warehousing,65503.789,,,,,,,nan
"Nanterre, Île-de-France, France",Head of digital & e-commerce  at Signify,Head Of Digital at TCL Communication,ICD Business School,Conseil et Stratégie Commerciale,"University of California, Riverside",Signify,TCL Communication,551112 Public utility holding companies,551112 Public utility holding companies,55,55,Management of Companies and Enterprises,82055.219,Management of Companies and Enterprises,48.892427,2.207127,Île-de-France,Hauts-de-Seine,,nan
San Francisco Bay ,EVP Chief Financial Officer at The Clorox Company,VP Global Finance at The Clorox Company,University of Rochester - Simon Business School,Finance,"University of California, Riverside",The Clorox Company,The Clorox Company,325320 Xanthone insecticides manufacturing,325320 Xanthone insecticides manufacturing,31-33,31-33,Manufacturing,69174.562,Manufacturing,37.714029,-122.307794,California,San Mateo,,06081
"San Gabriel, California, United States","Director, Growth Marketing at ViacomCBS","Senior Manager, Growth Marketing at Weedmaps","University of California, Riverside",Business Administration,"University of California, Riverside",ViacomCBS,Weedmaps,511130 University press publishers (except exclusive Internet publishing),,51,,Information,73855.595,,34.099073,-118.108568,California,Los Angeles,,06037
Los Angeles  ,Founder & CEO at iinventt,Executive Director of Manufacturing at Idea Planet,"University of California, Riverside",,"University of California, Riverside",iinventt,Idea Planet,,481219 Aviation clubs providing a variety of air transportation activities to the general public,,48-49,,,Transportation and Warehousing,34.053691,-118.242766,California,Los Angeles,Los Angeles,06037
"Los Angeles, California, United States",CTO at King Tide,"Vice President, Engineering at Crowdfunder, Inc.","University of California, Riverside",Computer Science,"University of California, Riverside",King Tide,"Crowdfunder, Inc.",,,,,,,,34.053691,-118.242766,California,Los Angeles,Los Angeles,06037
"Portland, Oregon  ",Sr. Director of Engineering - IT Infrastructure & Operations at The Standard,Engineering Director -  IT Solutions Delivery at The Standard,"University of California, Riverside",Information System Management,"University of California, Riverside",The Standard,The Standard,423510 Wire screening merchant wholesalers,423510 Wire screening merchant wholesalers,42,42,Wholesale Trade,68623.359,Wholesale Trade,45.520247,-122.674195,Oregon,Multnomah,Portland,41051
"Fremont, California, United States",Managing Director Global Enterprise Applications at Lam Research,Senior Director Global Enterprise Applications at Lam Research,1989–1994,Mathematics,"University of California, Riverside",Lam Research,Lam Research,334413 Wafers (semiconductor devices) manufacturing,,31-33,,Manufacturing,69174.562,,37.54827,-121.988571,California,Alameda,Fremont,06001
"Orange County, California, United States",Engineering Director | Division Lead at L3Harris Technologies,Engineering Director | Deputy Division Lead  at L3Harris Technologies,"University of California, Riverside",Electrical Engineering,"University of California, Riverside",L3Harris Technologies,L3Harris Technologies,334413 Wafers (semiconductor devices) manufacturing,334413 Wafers (semiconductor devices) manufacturing,31-33,31-33,Manufacturing,69174.562,Manufacturing,33.750038,-117.870493,California,Orange,,06059
Los Angeles  ,Director at Kaiser Permanente,Manager at Kaiser Permanente,Pepperdine Graziadio Business School,Business Administration (Marketing Emphasis),"University of California, Riverside",Kaiser Permanente,Kaiser Permanente,524114 Medical service plans without providing health care services,524114 Medical service plans without providing health care services,52,52,Finance and Insurance,80163.492,Finance and Insurance,34.053691,-118.242766,California,Los Angeles,Los Angeles,06037
Los Angeles  ,Infrastructure Engineer at Stripe,Senior Software Engineer at Tala (formerly InVenture),2006–2010,Electrical Engineering,"University of California, Riverside",Stripe,Tala (formerly InVenture),"523991 Trust companies, nondepository",,52,,Finance and Insurance,80163.492,,34.053691,-118.242766,California,Los Angeles,Los Angeles,06037
 Paris  ,Head of Start-up & Partnerships at FDJ - Française des jeux,Innovation Manager at FDJ - Française des jeux,EMLYON Business School,Entrepreneurship/Entrepreneurial Studies,"University of California, Riverside",FDJ - Française des jeux,FDJ - Française des jeux,,,,,,,,48.85889,2.320041,Île-de-France,Paris,,nan
"Ontario, California, United States",Senior Human Resources Manager at Ontario International Airport,"Human Resources Director at FRAZER, LLP",1992–1994,Human Resources,"University of California, Riverside",Ontario International Airport,"FRAZER, LLP",488119 Vacuuming of airport runways,"541211 Public accountants' (CPAs) private practices, certified",48-49,54,Transportation and Warehousing,65503.789,"Professional, Scientific, and Technical Services",34.065846,-117.64843,California,San Bernardino,Ontario,06071
,Supply Chain Associate at Fastenal Company,Recruiting Coordinator at MDstaffers,"University of California, Riverside",Management,"University of California, Riverside",Fastenal Company,MDstaffers,"332722 Washers, metal, manufacturing",,31-33,,Manufacturing,69174.562,,,,,,,nan
"Los Angeles, California, United States",Director Of Business Development at NextBranch,"Strategic Account Sales Manager, FX, Hedging, Financial Risk and Wealth Management Solutions at Refinitiv, an LSEG business",UC Riverside,Sociology/Psychology,"University of California, Riverside",NextBranch,"Refinitiv, an LSEG business",,,,,,,,34.053691,-118.242766,California,Los Angeles,Los Angeles,06037
"New York, New York, United States","Director of Product, Internal and External Platforms at The Princeton Review","Product Manager, Internal Tools & Online Content at The Princeton Review",Udemy Academy,The Ultimate MySQL Bootcamp,"University of California, Riverside",The Princeton Review,The Princeton Review,"611710 Testing services, educational","611710 Testing services, educational",61,61,Educational Services,67390.465,Educational Services,40.712728,-74.006015,New York,,New York,36061
"Union City, California, United States",Co-Founder/ VP of Business Development at Biologic Environmental Services & Waste Solutions,,"University of California, Riverside",,"University of California, Riverside",Biologic Environmental Services & Waste Solutions,,,,,,,,,37.596323,-122.08163,California,Alameda,,06001
"Long Beach, California, United States","Vice President, Operations and Strategic Initiatives at Better U",President at Patient Care Clinic,University of La Verne,Business Administration,"University of California, Riverside",Better U,Patient Care Clinic,445110 Supermarkets,"621111 Walk-in physicians' offices (e.g., centers, clinics)",44-45,62,Retail Trade,56013.266,Health Care and Social Assistance,33.769016,-118.191604,California,Los Angeles,Long Beach,06037
"Newport Beach, California, United States","Owner, Director Of Finance And Operations at TLC Domestic Agency",Senior Director Business Development at Sodexo,Chapman University,Economics,"University of California, Riverside",TLC Domestic Agency,Sodexo,,561720 Window cleaning services,,56,,,Administrative and Support and Waste Management and Remediation Services,33.617009,-117.92944,California,Orange,Newport Beach,06059
Los Angeles  ,Regional Vice President Of Operations at NFI,Senior Director Of Operations at NFI,"University of California, Riverside","Business Administration and Management, General","University of California, Riverside",NFI,NFI,"488490 Trucking terminals, independently operated","488490 Trucking terminals, independently operated",48-49,48-49,Transportation and Warehousing,65503.789,Transportation and Warehousing,34.053691,-118.242766,California,Los Angeles,Los Angeles,06037
"Redondo Beach, California, United States","President at Business Facilitators, Inc. dba Business Factors & Finance",,"Loyola Law School, Los Angeles",,"University of California, Riverside","Business Facilitators, Inc. dba Business Factors & Finance",,,,,,,,,33.845591,-118.388677,California,Los Angeles,,06037
"San Francisco, California, United States","Director, Enterprise Release Management at Williams-Sonoma, Inc.",Director of Delivery & Release at Macy's,+ 1 more,Wildlife and Park Management,"University of California, Riverside","Williams-Sonoma, Inc.",Macy's,454110,452210,44-45,44-45,Retail Trade,56013.266,Retail Trade,37.779026,-122.419906,California,,San Francisco,06075
"North Palm Beach, Florida, United States",Marketing Manager at NextEra Energy Resources,Project Manager at NextEra Energy Resources,"University of California, San Diego",International Business,"University of California, Riverside",NextEra Energy Resources,NextEra Energy Resources,,"221118 Power generation, tidal electric",,22,,,Utilities,26.823794,-80.055927,Florida,Palm Beach,,12099
United Kingdom,"Vice President, Sales/Business Operations, EMEA Expansion at iCIMS","Director, International PMO at Adobe",Regis University,Strategic Management,"University of California, Riverside",iCIMS,Adobe,"541511 Web (i.e., Internet) page design services, custom","511210 Utility software, computer, packaged",54,51,"Professional, Scientific, and Technical Services",77645.346,Information,54.702354,-3.276575,,,,nan
"Los Angeles, California, United States",Senior Content Marketing Manager at InMarket,Marketing Manager at InMarket,"University of California, Riverside",,"University of California, Riverside",InMarket,InMarket,"517919 VoIP service providers, using client-supplied telecommunications connections","517919 VoIP service providers, using client-supplied telecommunications connections",51,51,Information,73855.595,Information,34.053691,-118.242766,California,Los Angeles,Los Angeles,06037
"Seattle, Washington, United States",Customer Experience Manager at Youth To The People,Employment Program Representative at Employment Development Department,"University of California, Riverside",Business Administration with an emphasis in Marketing,"University of California, Riverside",Youth To The People,Employment Development Department,"325620 Towelettes, premoistened, manufacturing",,31-33,,Manufacturing,69174.562,,47.603832,-122.330062,Washington,King,Seattle,53033
San Francisco Bay ,"Vice President, General Manager at Pacific Scientific Energetic Materials Company","Director, Business Transformation at Meggitt",1986–1988,Corporate Administration,"University of California, Riverside",Pacific Scientific Energetic Materials Company,Meggitt,325920 Trinitrotoluene (TNT) manufacturing,334519 Wind direction indicators manufacturing,31-33,31-33,Manufacturing,69174.562,Manufacturing,37.714029,-122.307794,California,San Mateo,,06081
Los Angeles  ,Project Manager at Rare Genomics Institute,Cause 4 Life Program Manager at Joni and Friends,University of La Verne,Project Management,"University of California, Riverside",Rare Genomics Institute,Joni and Friends,,624120 Senior citizens centers,,62,,,Health Care and Social Assistance,34.053691,-118.242766,California,Los Angeles,Los Angeles,06037
"Pebble Beach, California, United States",President at Olsen & Olsen Insurance Services,Sr Account Manager at Hortica Insurance & Employee Benefits,Stanford University,Writing Certificate,"University of California, Riverside",Olsen & Olsen Insurance Services,Hortica Insurance & Employee Benefits,,,,,,,,36.567241,-121.944213,California,Monterey,,06053
San Francisco Bay ,"Senior Vice President Of Sales at Sunworks, Inc.",Vice President of EPC Sales at Borrego Solar Systems,"University of California, Berkeley - Walter A. Haas School of Business",Geographic Information Systems,"University of California, Riverside","Sunworks, Inc.",Borrego Solar Systems,334413 Wafers (semiconductor devices) manufacturing,238220 Water system balancing and testing contractors,31-33,23,Manufacturing,69174.562,Construction,37.714029,-122.307794,California,San Mateo,,06081
"Palo Alto, California, United States","Clinical Operations Leader, Global Clinical Development and Operations (Opthalmology) at Santen Pharmaceutical","Global Clinical Development Study Leader, Phase 0 - 1 (GI - Immuno-Oncology) at Amgen",+ 1 more,"Biology/Biological Sciences, General","University of California, Riverside",Santen Pharmaceutical,Amgen,339112 Veterinarians' instruments and apparatus manufacturing,325414 Virus vaccines manufacturing,31-33,31-33,Manufacturing,69174.562,Manufacturing,37.444329,-122.159846,California,Santa Clara,Palo Alto,06085
"Menlo Park, California, United States","Director, Marketing Strategy & Operations at Stanford University",Global Marketing Director at Evernote,"University of California, Riverside",Business Administration,"University of California, Riverside",Stanford University,Evernote,622110 Osteopathic hospitals,"541511 Web (i.e., Internet) page design services, custom",62,54,Health Care and Social Assistance,76373.049,"Professional, Scientific, and Technical Services",37.451967,-122.177993,California,San Mateo,,06081
"Ahmedabad, Gujarat, India",Director at KARAMAT - Food Solution (India) Limited,,"University of California, Riverside","Marketing/Marketing Management, General","University of California, Riverside",KARAMAT - Food Solution (India) Limited,,,,,,,,,23.021624,72.579707,Gujarat,Ahmedabad City,Ahmedabad,nan
,Information Technology Advisor at Alibaba Group,Investor / Financial Analyst at Pegasus Tech Ventures,"University of California, Berkeley",Digital Marketing,"University of California, Riverside",Alibaba Group,Pegasus Tech Ventures,551112 Public utility holding companies,523910 Viatical settlement companies,55,52,Management of Companies and Enterprises,82055.219,Finance and Insurance,,,,,,nan
"Dallas, Texas, United States",Senior Data Scientist at Walmart,"Research Assistant at University of California, Riverside","University of California, Riverside",Electrical Engineering,"University of California, Riverside",Walmart,"University of California, Riverside",452311,"923110 University regents or boards, government",44-45,92,Retail Trade,56013.266,,32.776272,-96.796856,Texas,Dallas,Dallas,48113
Los Angeles  ,"Managing Director, Founder at Vida Private Wealth","Wealth Management Advisor, Vice President at Merrill Lynch",Golden Gate University,Advanced Financial Planning,"University of California, Riverside",Vida Private Wealth,Merrill Lynch,,524210 Life insurance agencies,,52,,,Finance and Insurance,34.053691,-118.242766,California,Los Angeles,Los Angeles,06037
"Garden Grove, California, United States",Penetration Tester at EY,Information Security Engineer at Pacific Life,"University of California, Riverside",Computer Science,"University of California, Riverside",EY,Pacific Life,541213 Tax return preparation services,524210 Life insurance agencies,54,52,"Professional, Scientific, and Technical Services",77645.346,Finance and Insurance,33.774629,-117.946372,California,Orange,Garden Grove,06059
New York City  ,"VP, Client Strategy & Success at PERSUIT®","Director, Client Strategy and Success at PERSUIT®",Michigan State University - The Eli Broad College of Business,"Business Administration and Management, General","University of California, Riverside",PERSUIT®,PERSUIT®,,,,,,,,40.712728,-74.006015,New York,,New York,36061
San Francisco Bay ,Procurement Manager at California Water Service Company,Purchasing and Contracts Manager at Valley Water,"University of California, Riverside",Business Administration,"University of California, Riverside",California Water Service Company,Valley Water,221310 Water treatment plants,"221320 Waste collection, treatment, and disposal through a sewer system",22,22,Utilities,84207.831,Utilities,37.714029,-122.307794,California,San Mateo,,06081
"Walnut Creek, California, United States",Senior Director of Operations of Buyerlink / General Manager of MerchantCircle at BuyerLink,Business Development Manager / Product Manager at BuyerLink,+ 1 more,Business Administration,"University of California, Riverside",BuyerLink,BuyerLink,,,,,,,,37.902073,-122.06187,California,Contra Costa,,06013
Berlin  ,IT Manager Governance & Compliance at Bank of Scotland,PMO Manager Digital Delivery at Bank of Scotland,Heriot-Watt University,Strategic Project Management,"University of California, Riverside",Bank of Scotland,Bank of Scotland,522110 State commercial banks,522110 State commercial banks,52,52,Finance and Insurance,80163.492,Finance and Insurance,52.517036,13.38886,Berlin,,Berlin,nan
"Newport Beach, California, United States","Managing Partner at The Pun Group, LLP",Chair at CalCPA Governmental Accounting and Auditing Committee,1997–1999,Business Administration - Accounting,"University of California, Riverside","The Pun Group, LLP",CalCPA Governmental Accounting and Auditing Committee,,,,,,,,33.617009,-117.92944,California,Orange,Newport Beach,06059
"Azusa, California, United States",Vice President of Design and UX at East West Bank,Web Design Manager at BCBGMAXAZRIAGROUP,"University of California, Riverside",Liberal Arts and Sciences/Liberal Studies,"University of California, Riverside",East West Bank,BCBGMAXAZRIAGROUP,522110 State commercial banks,,52,,Finance and Insurance,80163.492,,34.133875,-117.905605,California,Los Angeles,,06037
Los Angeles  ,"VP, Hyundai Media Planning at INNOCEAN USA","Group Director, Communications Design at Initiative",1999–2003,Psychology,"University of California, Riverside",INNOCEAN USA,Initiative,,"541511 Web (i.e., Internet) page design services, custom",,54,,,"Professional, Scientific, and Technical Services",34.053691,-118.242766,California,Los Angeles,Los Angeles,06037
"Banning, California, United States","Sr. IT Manager II, App Dev at CUNA Mutual Group","IT Manager I, Cloud Infrastructure at CUNA Mutual Group",Western CUNA Management School (WCMS) - Pomona College,"Management of Credit Union, Leadership and Credit Union Philosophy","University of California, Riverside",CUNA Mutual Group,CUNA Mutual Group,"524113 Savings bank life insurance carriers, direct","524113 Savings bank life insurance carriers, direct",52,52,Finance and Insurance,80163.492,Finance and Insurance,33.925568,-116.875289,California,Riverside,Banning,06065
"Oakland, California, United States",CEO/President  at https://signaturesolutionscr.com,"Executive Vice Chancellor, Strategic Planning, Partnerships and Advancement at Peralta Community College District","University of California, Berkeley",Educational Administration,"University of California, Riverside",https://signaturesolutionscr.com,Peralta Community College District,,"611210 Schools, junior college vocational",,61,,,Educational Services,37.804456,-122.271356,California,Alameda,Oakland,06001
Los Angeles  ,Operations Manager at Best Buy,Executive Team Leader at Target,University of La Verne,Business Administration and Entrepreneurship,"University of California, Riverside",Best Buy,Target,"337110 Vanity tops, wood or plastics laminated on wood, manufacturing",445110 Supermarkets,31-33,44-45,Manufacturing,69174.562,Retail Trade,34.053691,-118.242766,California,Los Angeles,Los Angeles,06037
"Murrieta, California, United States",Owner and Principal Statistician - Providing Study Design and Data Analysis at Omega Statistics,,Texas A&M University,Applied Statistics,"University of California, Riverside",Omega Statistics,,,,,,,,,33.577752,-117.188454,California,Riverside,Murrieta,06065
,"Digital Marketing and Social Media Associate at Embodied, Inc.",Social Media and Community Associate at Etekcity,"University of California, Riverside",Accounting and Auditing,"University of California, Riverside","Embodied, Inc.",Etekcity,"541511 Web (i.e., Internet) page design services, custom","423690 Video tapes, blank, merchant wholesalers",54,42,"Professional, Scientific, and Technical Services",77645.346,Wholesale Trade,,,,,,nan
Los Angeles  ,Vice Chancellor of Human Resources at Coast Community College District,Assistant Superintendent Human Resources at Santa Clara,University of Southern California,"Educational Leadership and Administration, General","University of California, Riverside",Coast Community College District,Santa Clara,611310 Universities,"485111 Urban transit systems, mixed mode (e.g., bus, commuter rail, subway combinations)",61,48-49,Educational Services,67390.465,Transportation and Warehousing,34.053691,-118.242766,California,Los Angeles,Los Angeles,06037
"Los Angeles, California, United States",Application Software Engineer - Business Intelligence at Centene Corporation,Business Intelligence Analyst at PBS SoCal | KCET,University of Southern California,Data Science,"University of California, Riverside",Centene Corporation,PBS SoCal | KCET,621999 Stop smoking clinics,,62,,Health Care and Social Assistance,76373.049,,34.053691,-118.242766,California,Los Angeles,Los Angeles,06037
"Sacramento, California, United States",Lead Program Manager - Institutional Prime Services at Gemini,Director at Keadjian,"University of California, Riverside",Psychology,"University of California, Riverside",Gemini,Keadjian,"621111 Walk-in physicians' offices (e.g., centers, clinics)",,62,,Health Care and Social Assistance,76373.049,,38.581061,-121.493895,California,Sacramento,Sacramento,06067
"Santa Monica, California, United States","Senior Director, People  at TrueCar, Inc.","Director, People Business Partner at TrueCar, Inc.","University of California, Los Angeles",History,"University of California, Riverside","TrueCar, Inc.","TrueCar, Inc.",812990 Wedding planning services,812990 Wedding planning services,81,81,Other Services (except Public Administration),57824.628,Other Services (except Public Administration),34.01947,-118.491227,California,Los Angeles,Santa Monica,06037
