current_location,current_work,previous_work,latest_Education,major,search_school,current_company,previous_company,current_company_industry,previous_company_industry,current_NAICS,previous_NAICS,current_NAICS_title,current_avg_salary,previous_NAICS_title,latitude,longitude,state,county,city,fips
"Irvine, California, United States",Software Test Manager at Cue Health,Manager Software Engineering at Edwards Lifesciences,"University of California, Riverside",Computer Science,"University of California, Riverside",Cue Health,Edwards Lifesciences,334516 Ultraviolet-type analytical instruments manufacturing,"339113 Whirlpool baths (i.e., hydrotherapy equipment) manufacturing",31-33,31-33,Manufacturing,69174.562,Manufacturing,33.685697,-117.825982,California,Orange,Irvine,06059
San Francisco Bay ,Sr. Staff Research Scientist at Rivian,Research Scientist at Stealth Startup,"University of California, San Diego",Mathematics,"University of California, Riverside",Rivian,Stealth Startup,336111 Hearses assembling on chassis of own manufacture,,31-33,,Manufacturing,69174.562,,37.714029,-122.307794,California,San Mateo,,06081
"San Diego, California, United States",VP Marketing at WAXIE Sanitary Supply,General Manager at WAXIE Sanitary Supply,Cal State University San Bernardino,,"University of California, Riverside",WAXIE Sanitary Supply,WAXIE Sanitary Supply,,,,,,,,32.71742,-117.162773,California,San Diego,San Diego,06073
Los Angeles  ,Adjunct Faculty at Alliant International University,Sr. Commerce Analyst at BVA,DePaul University,Sociology,"University of California, Riverside",Alliant International University,BVA,611310 Universities,445110 Supermarkets,61,44-45,Educational Services,67390.465,Retail Trade,34.053691,-118.242766,California,Los Angeles,Los Angeles,06037
"Riverside, California, United States",CEO and Owner at Acorn Technology Services,Vice President of Sales and IT Services at Acorn Technology,"University of California, Riverside - A. Gary Anderson Graduate School of Management",Entrepreneurship/Entrepreneurial Studies,"University of California, Riverside",Acorn Technology Services,Acorn Technology,,517311,,51,,,Information,33.945941,-117.410244,California,Riverside,Riverside,06065
"Atlanta, Georgia, United States",Direct Strategy & Analytics at Chick-fil-A Corporate,Sr. GIS Manager at Chick-fil-A Corporate,UCLA,East Asian Studies,"University of California, Riverside",Chick-fil-A Corporate,Chick-fil-A Corporate,,,,,,,,33.748992,-84.390264,Georgia,Fulton,Atlanta,13121
Washington DC-Baltimore ,"CEO & Co-Founder at Create&, Launching Big Ideas",National Manager at American Association of State Colleges and Universities -- The Democracy Commitment,American University - Kogod School of Business,"Business Administration, Management and Operations","University of California, Riverside","Create&, Launching Big Ideas",American Association of State Colleges and Universities -- The Democracy Commitment,,,,,,,,38.918116,-76.942107,District of Columbia,Prince George's,Washington,nan
"Huntington Beach, California, United States",Vice President Digital Marketing and Business Development Solutions at International Code Council,"Vice President, Marketing at International Code Council",1993–1995,Marketing and Accounting,"University of California, Riverside",International Code Council,International Code Council,"813920 Standards review committees, professional","813920 Standards review committees, professional",81,81,Other Services (except Public Administration),57824.628,Other Services (except Public Administration),33.678334,-118.000017,California,Orange,Huntington Beach,06059
"San Diego, California, United States",Vice President of Strategic Development at Shanghai Freemen,Director of Business Development - Western Region at Shanghai Freemen,"University of California, Riverside",Business Finance,"University of California, Riverside",Shanghai Freemen,Shanghai Freemen,424690 Wood treating preparations merchant wholesalers,424690 Wood treating preparations merchant wholesalers,42,42,Wholesale Trade,68623.359,Wholesale Trade,32.71742,-117.162773,California,San Diego,San Diego,06073
"Pasadena, California, United States","Principal/Partner at Garrett & Tully, P.C.",Associate at Lewis Brisbois Bisgaard & Smith LLP,Pepperdine University School of Law,Political Science / Law and Society,"University of California, Riverside","Garrett & Tully, P.C.",Lewis Brisbois Bisgaard & Smith LLP,,541110 Tax law attorneys' private practices,,54,,,"Professional, Scientific, and Technical Services",34.147645,-118.144478,California,Los Angeles,Pasadena,06037
 Birmingham ,Plant Manager at NA Operation / Manufacturing / AL Division,Plant Manufacturing Superintendent at Operations Management,"University of California, Riverside","Studied Business Management, General","University of California, Riverside",NA Operation / Manufacturing / AL Division,Operations Management,,561110 Office management services,,56,,,Administrative and Support and Waste Management and Remediation Services,52.479699,-1.902691,England,West Midlands Combined,Birmingham,nan
"Tokyo, Tokyo, Japan",Finance Manager at Vpon,Assistant Accounting Manager at CEVA Logistics,1999–2003,,"University of California, Riverside",Vpon,CEVA Logistics,,488119 Vacuuming of airport runways,,48-49,,,Transportation and Warehousing,35.681091,139.767186,,,千代田区,nan
"San Diego, California, United States",Director of Product Management at Cordial Inc.,"Principal Product Manager, Platform, Tools & Engineering at Intuit","University of California, Riverside",Business Administration,"University of California, Riverside",Cordial Inc.,Intuit,541690 Security consulting services,"541511 Web (i.e., Internet) page design services, custom",54,54,"Professional, Scientific, and Technical Services",77645.346,"Professional, Scientific, and Technical Services",32.71742,-117.162773,California,San Diego,San Diego,06073
Las Vegas  ,"Vice President, Business Development at American Estate & Trust",Director Of Business Development at American Estate & Trust,"University of California, Riverside","Business, Management, Marketing, and Related Support Services","University of California, Riverside",American Estate & Trust,American Estate & Trust,,531110 Town house rental or leasing,,53,,,Real Estate and Rental and Leasing,36.167256,-115.148516,Nevada,Clark,Las Vegas,32003
"South Jordan, Utah, United States",Vice President Of Product Management at Momentive-AI (formerly SurveyMonkey),Group Manager Product Management  at Adobe,2009–2011,Social Psychology and Evaluation,"University of California, Riverside",Momentive-AI (formerly SurveyMonkey),Adobe,,"511210 Utility software, computer, packaged",,51,,,Information,40.558488,-111.936711,Utah,Salt Lake,South Jordan,49035
,"Associate Director, Connected Commerce at PHD","Associate Director, Paid Media at Edelman DXI","University of California, Riverside","B.S., Business Administration with concentration in Marketing","University of California, Riverside",PHD,Edelman DXI,541810 Advertising agency consulting services,,54,,"Professional, Scientific, and Technical Services",77645.346,,,,,,,nan
"San Jose, California, United States","Senior Manager, Process & Yield - Battery Manufacturing at QuantumScape","Manager, Global Product Marketing - Dielectric Deposition Products at Applied Materials",Cornell University,Engineering Leadership & Management,"University of California, Riverside",QuantumScape,Applied Materials,334413 Wafers (semiconductor devices) manufacturing,334413 Wafers (semiconductor devices) manufacturing,31-33,31-33,Manufacturing,69174.562,Manufacturing,37.33619,-121.890583,California,Santa Clara,San Jose,06085
"Danville, California, United States","Senior Manager, Product Security at Snowflake","Senior Director, Product Security at Splunk",2002–2005,Information Systems,"University of California, Riverside",Snowflake,Splunk,"511210 Utility software, computer, packaged","511210 Utility software, computer, packaged",51,51,Information,73855.595,Information,37.821593,-121.99996,California,Contra Costa,,06013
"Orange County, California, United States","Director, Managed Markets and Trade at Amicus Therapeutics","Director, National Accounts - Market Access at Coherus BioSciences","University of California, Riverside",,"University of California, Riverside",Amicus Therapeutics,Coherus BioSciences,325412 Zinc oxide medicinal preparations manufacturing,325414 Virus vaccines manufacturing,31-33,31-33,Manufacturing,69174.562,Manufacturing,33.750038,-117.870493,California,Orange,,06059
"Irvine, California, United States",Digital Marketing Strategist at Postclick,"Digital Marketing Consultant at Freelance, self-employed","University of California, Riverside",English,"University of California, Riverside",Postclick,"Freelance, self-employed",,,,,,,,33.685697,-117.825982,California,Orange,Irvine,06059
"Tulsa, Oklahoma, United States","Head of Banking Industry, Americas at ServiceNow","Global Markets, Commercial Banking AE Specialist Salesforce at Salesforce",San Jose State University,Business Administration,"University of California, Riverside",ServiceNow,Salesforce,"511210 Utility software, computer, packaged",,51,,Information,73855.595,,36.15568,-95.992911,Oklahoma,Tulsa,Tulsa,40143
"San Carlos, California, United States","Director, Strategic Alliances  at Quantum",Director of Strategic Alliances  at Snowflake,1987–1991,Business Adminstration,"University of California, Riverside",Quantum,Snowflake,212230,"511210 Utility software, computer, packaged",21,51,"Mining, Quarrying, and Oil and Gas Extraction",69910.58,Information,37.504936,-122.261823,California,San Mateo,San Carlos,06081
,Human Resources Coordinator at Munchkin,People Operations Coordinator at Scopely,"University of California, Riverside",Sociology,"University of California, Riverside",Munchkin,Scopely,453998 Trophy (including awards and plaques) shops,"511210 Utility software, computer, packaged",44-45,51,Retail Trade,56013.266,Information,,,,,,nan
"Oxnard, California, United States","Director, Learning Support Services/Chief Technology Officer at OXNARD UNION HIGH SCHOOL DISTRICT","Dean at Pleasant Valley School District, Camarillo",2000–2001,Education,"University of California, Riverside",OXNARD UNION HIGH SCHOOL DISTRICT,"Pleasant Valley School District, Camarillo","611110 Seminaries, below university grade",,61,,Educational Services,67390.465,,34.197631,-119.180382,California,Ventura,Oxnard,06111
,Graduate Counselor of Professional Programs at UC Irvine Donald Bren School of Information and Computer Sciences,Executive Chair at GBSSA,Gies College of Business - University of Illinois Urbana-Champaign,Global Business Challenges,"University of California, Riverside",UC Irvine Donald Bren School of Information and Computer Sciences,GBSSA,,,,,,,,,,,,,nan
"Madrid, Community of Madrid, Spain",Digital Marketing Specialist at AB Tasty,Media Coordinator at Quigley-Simpson,"University of California, Riverside","Marketing, Public Relations, and Applied Communication","University of California, Riverside",AB Tasty,Quigley-Simpson,,541830 Media buying services,,54,,,"Professional, Scientific, and Technical Services",40.416705,-3.703582,Comunidad de Madrid,Área metropolitana de Madrid y Corredor del,Madrid,nan
,Senior Product Manager at ViacomCBS,Product Manager at ViacomCBS,"University of California, Irvine - The Paul Merage School of Business",Marketing,"University of California, Riverside",ViacomCBS,ViacomCBS,511130 University press publishers (except exclusive Internet publishing),511130 University press publishers (except exclusive Internet publishing),51,51,Information,73855.595,Information,,,,,,nan
"Mountain View, California, United States",Senior Vice President at Samsung Electronics America,Vice President at Samsung Electronics,UC Riverside,"Business Administration and Management, General","University of California, Riverside",Samsung Electronics America,Samsung Electronics,"423620 Video cameras, household-type, merchant wholesalers","334220 Video camera (except household-type, television broadcast) manufacturing",42,31-33,Wholesale Trade,68623.359,Manufacturing,37.389389,-122.08321,California,Santa Clara,Mountain View,06085
"San Diego, California, United States","SVP Strategy & Marketing, Informa Markets Fashion at Informa Markets",Senior Vice President Marketing at Freeman Company,"University of California, Riverside",Psychology/Biology,"University of California, Riverside",Informa Markets,Freeman Company,"511110 Publishers, newspaper, combined with printing",561920 Trade show promoters,51,56,Information,73855.595,Administrative and Support and Waste Management and Remediation Services,32.71742,-117.162773,California,San Diego,San Diego,06073
"Tokyo, Tokyo, Japan",Digital Transformation Manager at SAP,Senior Global Account Manager at SAP,2001–2001,Economics,"University of California, Riverside",SAP,SAP,811212 Typewriter repair and maintenance services,811212 Typewriter repair and maintenance services,81,81,Other Services (except Public Administration),57824.628,Other Services (except Public Administration),35.681091,139.767186,,,千代田区,nan
"Orange County, California, United States","Executive Director, Operations and Capital Projects, Office of the Vice Chancellor, Health Affairs at UC Irvine","Director of Operations and Accreditation, School of Nursing at UC Irvine",Capella University,Health/Health Care Administration/Management,"University of California, Riverside",UC Irvine,UC Irvine,622110 Osteopathic hospitals,622110 Osteopathic hospitals,62,62,Health Care and Social Assistance,76373.049,Health Care and Social Assistance,33.750038,-117.870493,California,Orange,,06059
"Salisbury, Maryland, United States",General Manager at Delmarva Shorebirds,Vice President/General Manager at Bakersfield Blaze Professional Baseball,1994–1998,,"University of California, Riverside",Delmarva Shorebirds,Bakersfield Blaze Professional Baseball,,,,,,,,38.366027,-75.600996,Maryland,Wicomico,Salisbury,24045
"Downey, California, United States",Senior Director of Operations at Biola University,"Manager of Financial Affairs, Strategy and Communications at Biola University",Biola University Crowell School of Business,Spiritual Formation and Soul Care,"University of California, Riverside",Biola University,Biola University,611310 Universities,611310 Universities,61,61,Educational Services,67390.465,Educational Services,33.942215,-118.123565,California,Los Angeles,Downey,06037
"Los Angeles, California, United States","Director Of Business Development at Wood, Smith, Henning & Berman LLP","Business Development | Audit | Sr. Supervising Paralegal | Office Administrator  at Wood, Smith, Henning & Berman LLP","University of California, Riverside",Associate in Risk Mangement,"University of California, Riverside","Wood, Smith, Henning & Berman LLP","Wood, Smith, Henning & Berman LLP",541110 Tax law attorneys' private practices,541110 Tax law attorneys' private practices,54,54,"Professional, Scientific, and Technical Services",77645.346,"Professional, Scientific, and Technical Services",34.053691,-118.242766,California,Los Angeles,Los Angeles,06037
"Los Angeles, California, United States",Vice President - Application Senior Administrator at City National Bank,Vice President - System Administrator IV at City National Bank,"University of California, Riverside","Business Administration, Accounting & Audit","University of California, Riverside",City National Bank,City National Bank,522110 State commercial banks,522110 State commercial banks,52,52,Finance and Insurance,80163.492,Finance and Insurance,34.053691,-118.242766,California,Los Angeles,Los Angeles,06037
,San Francisco Bay Area,Digital Marketing Manager | eCommerce at SMART Wireless Computing,"University of California, Riverside",Business Managerial Econmics minor in Marketing,"University of California, Riverside",San Francisco Bay Area,SMART Wireless Computing,485112 Urban commuter rail systems (except mixed mode),334419 Vacuum tubes manufacturing,48-49,31-33,Transportation and Warehousing,65503.789,Manufacturing,,,,,,nan
"Gurgaon, Haryana, India",Head Of Sales at Pixis,Business Head at XY-ADS,California State University-San Bernardino,Marketing,"University of California, Riverside",Pixis,XY-ADS,522110 State commercial banks,,52,,Finance and Insurance,80163.492,,28.428262,77.0027,Haryana,,Gurugram,nan
"Orange County, California, United States",National Transportation Manager at Bedrosians Tile and Stone DBA Paragon Trucking,Transportation Manager at Ted Levine Drum Co,California State University-Dominguez Hills,Global Logistics,"University of California, Riverside",Bedrosians Tile and Stone DBA Paragon Trucking,Ted Levine Drum Co,,"332439 Vats, light gauge metal, manufacturing",,31-33,,,Manufacturing,33.750038,-117.870493,California,Orange,,06059
"Orange County, California, United States",Product Marketing Manager - Audio & Accessories at VIZIO,Associate Product Marketing Manager - Audio at VIZIO,"University of California, Riverside",Business Administration - Marketing,"University of California, Riverside",VIZIO,VIZIO,999990,999990,99,99,"Federal, State, and Local Government, excluding state and local schools and hospitals and the U.S. Postal Service (OEWS Designation)",69671.738,"Federal, State, and Local Government, excluding state and local schools and hospitals and the U.S. Postal Service (OEWS Designation)",33.750038,-117.870493,California,Orange,,06059
"Riverside, California, United States",Sales Director at Thermo Fisher Scientific,Health Systems Executive at Thermo Fisher Scientific,La Sierra University,General Management,"University of California, Riverside",Thermo Fisher Scientific,Thermo Fisher Scientific,335999 UPS (uninterruptible power supplies) manufacturing,335999 UPS (uninterruptible power supplies) manufacturing,31-33,31-33,Manufacturing,69174.562,Manufacturing,33.945941,-117.410244,California,Riverside,Riverside,06065
,Station Operations Manager at Amazon,Supplier Performance Manager at Safran,"University of California, Irvine - The Paul Merage School of Business",Strategy and Operations and Decision Technologies,"University of California, Riverside",Amazon,Safran,454110,336411 Ultra light aircraft manufacturing,44-45,31-33,Retail Trade,56013.266,Manufacturing,,,,,,nan
"Los Angeles, California, United States","Director of Business Development, Integrated Partnerships at Smule, Inc.","Director of Community Marketing and Communications at Smule, Inc.","University of California, Riverside",History,"University of California, Riverside","Smule, Inc.","Smule, Inc.","711510 Writers, independent (freelance)","711510 Writers, independent (freelance)",71,71,"Arts, Entertainment, and Recreation",51732.192,"Arts, Entertainment, and Recreation",34.053691,-118.242766,California,Los Angeles,Los Angeles,06037
San Francisco Bay ,Office Managing Partner at MGO (Macias Gini & O'Connell LLP),"Partner at Benjamin & Young, LLP","University of California, Riverside - A. Gary Anderson Graduate School of Management",Accounting and Finance,"University of California, Riverside",MGO (Macias Gini & O'Connell LLP),"Benjamin & Young, LLP",,,,,,,,37.714029,-122.307794,California,San Mateo,,06081
"Omaha, Nebraska, United States","Partner at Priority Technologies, LLC","Partner at Priority Solutions, LLC","University of California, Riverside",Law,"University of California, Riverside","Priority Technologies, LLC","Priority Solutions, LLC",,541612 Personnel management consulting services,,54,,,"Professional, Scientific, and Technical Services",41.258746,-95.938376,Nebraska,Douglas,Omaha,31055
"Rancho Cucamonga, California, United States",Owner at Tomberlin Law,"Associate Attorney at The Myers Law Group, LLP",Washington University in St. Louis School of Law,Law,"University of California, Riverside",Tomberlin Law,"The Myers Law Group, LLP",,,,,,,,34.127927,-117.564322,California,San Bernardino,Rancho Cucamonga,06071
"Los Angeles, California, United States","Associate Strategic Marketing Manager, Epson America at Epson America Inc.",Strategic Brand Marketing Manager at Sigue Corporation,"University of California, Riverside",Political Science Administrative Studies with an emphasis in Marketing,"University of California, Riverside",Epson America Inc.,Sigue Corporation,"334118 Terminals, computer, manufacturing",517311,31-33,51,Manufacturing,69174.562,Information,34.053691,-118.242766,California,Los Angeles,Los Angeles,06037
"Oak Park, California, United States","Vice President, Risk Management & Safety at BETA Healthcare Group",Director Risk Management/Patient Safety at BETA Healthcare Group,University of Illinois College of Medicine,Safety Leadership,"University of California, Riverside",BETA Healthcare Group,BETA Healthcare Group,524114 Medical service plans without providing health care services,524114 Medical service plans without providing health care services,52,52,Finance and Insurance,80163.492,Finance and Insurance,34.179202,-118.761972,California,Ventura,,06111
,"Institutional Research Analyst at University of California, Riverside",Smart Port Hackathon at Métropole Aix-Marseille-Provence,"University of California, Riverside",Sociology,"University of California, Riverside","University of California, Riverside",Métropole Aix-Marseille-Provence,"923110 University regents or boards, government","921190 Supply agencies, government",92,92,,,,,,,,,nan
"Mountain View, California, United States","Director Program Management, Business Technology at Zenefits",Sr. Manager PMO - R&D at Zenefits,"University of California, Riverside",Information Technology,"University of California, Riverside",Zenefits,Zenefits,"511210 Utility software, computer, packaged","511210 Utility software, computer, packaged",51,51,Information,73855.595,Information,37.389389,-122.08321,California,Santa Clara,Mountain View,06085
"Irvine, California, United States","Associate Project Manager, Information Security at Fox Corporation",Information Security Analyst at CoreLogic,"University of California, Riverside",Business Administration and Computer Science,"University of California, Riverside",Fox Corporation,CoreLogic,515120 Television broadcasting stations,"541910 Sampling services, statistical",51,54,Information,73855.595,"Professional, Scientific, and Technical Services",33.685697,-117.825982,California,Orange,Irvine,06059
,"Manager, Talent and Content Partnerships - Gaming & Tech at Ayzenberg","Manager, Talent (Digital Influencers & Creators) at 3BLACKDOT","University of California, Riverside",Business Marketing,"University of California, Riverside",Ayzenberg,3BLACKDOT,"541430 Studios, commercial art",541613 Sales management consulting services,54,54,"Professional, Scientific, and Technical Services",77645.346,"Professional, Scientific, and Technical Services",,,,,,nan
Los Angeles  ,City Manager at City of Santa Fe Springs,"City Manager at City of Rolling Hills, CA","University of California, Riverside",Public Service and Political Science,"University of California, Riverside",City of Santa Fe Springs,"City of Rolling Hills, CA","921110 President's office, United States",,92,,,,,34.053691,-118.242766,California,Los Angeles,Los Angeles,06037
,"Assistant Director - Fully Employed MBA Program at University of California, Irvine - The Paul Merage School of Business","Program Assistant - Fully Employed MBA Program at University of California, Irvine - The Paul Merage School of Business","California State University, Fullerton",Higher Education,"University of California, Riverside","University of California, Irvine - The Paul Merage School of Business","University of California, Irvine - The Paul Merage School of Business",,,,,,,,,,,,,nan
San Francisco Bay ,Associate Chief of Staff at Brimstone Energy,Impact & Sustainability Specialist at GlobeIn,"University of California, Riverside",Sustainability Studies,"University of California, Riverside",Brimstone Energy,GlobeIn,,454110,,44-45,,,Retail Trade,37.714029,-122.307794,California,San Mateo,,06081
"Glendale, California, United States",SDR Manager at Edlio,"SDR Team Lead at Edlio, LLC","University of California, Riverside",Near and Middle Eastern Studies,"University of California, Riverside",Edlio,"Edlio, LLC","541511 Web (i.e., Internet) page design services, custom",,54,,"Professional, Scientific, and Technical Services",77645.346,,34.146942,-118.247847,California,Los Angeles,Glendale,06037
,Tax Senior - Real Estate at EY,Tax Staff at EY,UC Irvine,Accounting,"University of California, Riverside",EY,EY,541213 Tax return preparation services,541213 Tax return preparation services,54,54,"Professional, Scientific, and Technical Services",77645.346,"Professional, Scientific, and Technical Services",,,,,,nan
"Los Angeles, California, United States",Laboratory Technician at ImmunoVec,Laboratory Scientist at Pac Genomics,"University of California, Riverside","Microbiology, General","University of California, Riverside",ImmunoVec,Pac Genomics,,,,,,,,34.053691,-118.242766,California,Los Angeles,Los Angeles,06037
,Associate Media Planner at Essence,Financial Educator at World Financial Group (WFG),COOP Apprentice,"Business Administration, Marketing","University of California, Riverside",Essence,World Financial Group (WFG),541410 Interior designer services,,54,,"Professional, Scientific, and Technical Services",77645.346,,,,,,,nan
Los Angeles  ,Director Of Communications | Digitalizing communication systems at Non Profit,Principal Managing Partner | Multi-$million real estate project management at Real Estate Developer & Investor,USC Annenberg School for Communication and Journalism,Strategic Organizational Communication,"University of California, Riverside",Non Profit,Real Estate Developer & Investor,"611699 Yoga instruction, camps, or schools",,61,,Educational Services,67390.465,,34.053691,-118.242766,California,Los Angeles,Los Angeles,06037
